"pdf_path","url","content"
"output/pdfs-2024/cxT2wVHS1725468503.pdf","https://goo.su/7Qzg9ZU","[Source: amazonasnoticias.com.br] Colisão no Porto: Balsa Carregada de Pedras Atinge Barco de Passageiros em Parintins Ir para o conteúdo Pesquisar Brasil Amazonas Manaus Parintins Esportes Famosos e TV Internacional Política Tribos & Toadas Coluna Em Off Brasil Amazonas Manaus Parintins Esportes Famosos e TV Internacional Política Tribos & Toadas Coluna Em Off Brasil Amazonas Manaus Parintins Esportes Famosos e TV Internacional Política Tribos & Toadas Coluna Em Off Brasil Amazonas Manaus Parintins Esportes Famosos e TV Internacional Política Tribos & Toadas Coluna Em Off Pesquisar Amazonas , Capa-Maior , Parintins Colisão no Porto: Balsa Carregada de Pedras Atinge Barco de Passageiros em Parintins Publicado em 17 de abril de 2024 Um acidente grave ocorreu no porto de Parintins, Amazonas, nesta quarta-feira de manhã, quando a balsa “Vovô Thomáz”, que transportava seixo, colidiu com o barco de passageiros “Coronel Tavares”. Durante uma chuva intensa, a colisão causou pânico entre as pessoas presentes no local. Ver essa foto no Instagram Uma publicação compartilhada por Portal Amazonas Notícias (@amazonasnoticias) Testemunhas no porto descreveram cenas de medo e urgência, enquanto gritos para evacuar a embarcação podiam ser ouvidos em vídeos compartilhados nas redes sociais. Até o momento, não foram divulgadas informações detalhadas sobre as circunstâncias que levaram ao acidente com a balsa. Autoridades locais e equipes de emergência foram rapidamente mobilizadas para atender a situação e investigar as causas do incidente. Tags: Parintins , Porto de Parintins Relacioandos Corpo do segundo jovem afogado no rio Amazonas é encontrado em Parintins 3 de março de 2025 Carnaval na Floresta 2025: Reino Unido da Liberdade é campeã do Grupo Especial em 2025 3 de março de 2025 SES-AM realiza monitoramento contínuo das unidades de urgência e emergência neste Carnaval 3 de março de 2025 Carnailha 2025: Programação da Chave Especial tem blocos em disputa e shows em Parintins 3 de março de 2025 Manaus registra, em fevereiro deste ano, a menor taxa de homicídios em 25 anos 3 de março de 2025 Carnailha 2025: Regulamento da Chave Especial define regras para disputa e critérios de julgamento; veja a ordem de desfile 3 de março de 2025 © 2009 - 2024 Amazonas Notícias [email protected] Host Amazonas - Criação de Sites"
"output/pdfs-2024/cxT2wVHS1725468503.pdf","https://goo.su/kOUwd","[Source: www.dicapi.mil.pe] DICAPI - Dirección General de Capitanías y Guardacostas Organization Historical Review Mission & Vision Organizational Chart General Director Executive Director Technical Supervisor Directions General Direction Aquatic Activities Control Aquatic Environment International Affairs & OMI Coast Guard Operations Maritime Administration Inspections, Audits, and Supervisions Department TUPAM Procedures Regulatory Framework Consultations IFC LATAM PERU es Español Inglés Últimas publicaciones Últimas Publicaciones Correo Web Intranet DICAPI Acceso a Geoportal Correo Web Acceso a Geoportal Home Organization Historical Review Mission & Vision Organizational Chart General Director Executive Director Technical Supervisor Directions General Direction Aquatic Activities Control Aquatic Environment International Affairs & OMI Coast Guard Operations Maritime Administration Inspections, Audits, and Supervisions Department TUPAM Procedures Regulatory Framework Consultations IFC LATAM PERU Organization Historical Review Mission & Vision Organizational Chart General Director Executive Director Technical Supervisor Contact Us Address Constitution St. 150, Callao Digital Office 24 Hours In-person office: 08:00 am - 4:00 pm Telephone 012099300, Extension: 6862 MGP - DICAPI - 2025"
"output/pdfs-2024/cxT2wVHS1725468503.pdf","https://goo.su/RspfM90","[Source: radiorsd.pe] Otra embarcación pesquera se hunde en primer día de pesca Bienvenido a Radio Santo Domingo | | Hora #InformaciónQueSirve Todas las noticias en tu celular Únete aquí a nuestro canal de WhatsApp Inicio Quienes somos Nosotros Misión y Visión Objetivos Valores Iglesia Noticias Columna Programación Editorial Lo último: Denuncian presunto uso indebido de vehículos de la Municipalidad Provincial del Santa Otra embarcación pesquera se hunde en primer día de pesca Creado el Miércoles, 17 de Abril del 2024 09:50:37 am | Modificado el 02/08/2024 11:02:54 am La lancha anchovetera pertenece a la empresa pesquera Capricornio. Produce convocó a una reunión de emergencia a entidades del sector y asociación de armadores La embarcación pesquera Capricornio 3, del grupo Pesquero Capricornio S.A., sufrió un siniestro la tarde de ayer frente a Pucusana, en Lima. La lancha se hundió mientras realizaba faenas en el primer día de pesca de anchoveta. La tripulación fue rescatada por otra embarcación que se encontraba cerca. Las causas del siniestro son materia de investigación por la Dirección de Capitanías y Guardacostas (Dicapi). Como ya se conoce, la primera embarcación siniestrada fue la embarcación pesquera Tasa 415, que se fue a pique a 50 millas del puerto de Chimbote. Frente a los sucesos ocurridos con dos embarcaciones pesqueras industriales durante labores en el litoral, el Ministerio de la Producción se pronunció solidarizándose con las familias de los tripulantes de las embarcaciones siniestradas, quienes se encuentran a salvo. Asimismo, convocó a una reunión de emergencia para la mañana de con a los representantes de la Dicapi, Sociedad Nacional de Pesquería del Perú y Asociación de Armadores Pesqueros de la Ley N.° 26920, a fin de plantear acciones inmediatas que salvaguarden la vida e integridad de los tripulantes pesqueros. (K.C. – RSD Noticias). Foto: Captura de video de Radar Pesquero Tags: Embarcación hundida Capricornio SA Produce Áncash Noticias relacionadas ELECCIONES 2026 | ONPE publica proyecto de reglamento del financiamiento de fondos partidarios Áncash: piedras caen de cerro y casi aplastan a pobladores en Chavín de Huántar Áncash: lluvias intensas en la costa y sierra continuarán hasta el 5 de marzo Áncash: lluvias intensas destruyen dos viviendas en la provincia de Ocros Últimas noticias Chimbote: alcalde encargado denuncia descontrol en el Vaso de Leche ELECCIONES 2026 | ONPE publica proyecto de reglamento del financiamiento de fondos partidarios Reservorios de Sedachimbote presentan graves deficiencias de mantenimiento y seguridad Chimbote: fallece uno de los policías baleados durante intervención MPS recepcionó obra pese a que la constructora no subsanó todas las observaciones Áncash: piedras caen de cerro y casi aplastan a pobladores en Chavín de Huántar Áncash: lluvias intensas en la costa y sierra continuarán hasta el 5 de marzo Áncash: lluvias intensas destruyen dos viviendas en la provincia de Ocros Lo último Chimbote: alcalde encargado denuncia descontrol en el Vaso de Leche ELECCIONES 2026 | ONPE publica proyecto de reglamento del financiamiento de fondos partidarios Reservorios de Sedachimbote presentan graves deficiencias de mantenimiento y seguridad Chimbote: fallece uno de los policías baleados durante intervención Facebook TikTok @radio.rsd.chimbote Iglesia El estado del papa Francisco sigue estable en el hospital, pero recibe oxígeno Áncash: Diócesis de Chimbote te invita a participar de la catequesis familiar Se realiza la asamblea del Vicariato Apostólico San José del Amazonas Se realiza el Congreso sobre Inteligencia Artificial y Abusos Sexuales Publicidad Radio en Vivo Buscar RSD para Android radiorsd.pe @radio.rsd.chimbote +51-943667519 @radio.rsd.chimbote Radio RSD Chimbote Grupo: Radio Santa Rosa Radio San Martín Radio Quillabamba Zonaradio Activa Radio Sepahua Radio Madre de Dios Escuchar Radios en Vivo RADIO SANTO DOMINGO - 102.1 FM TELF: 043-327435 - 043-344632 - CEL: 943667519 E-MAIL: [email protected] , [email protected] DIRECCIÓN: Jr. LEONCIO PRADO #120 CHIMBOTE - PERÚ"
"output/pdfs-2024/cxT2wVHS1725468503.pdf","https://goo.su/gYUO62v","[Source: radiorsd.pe] Embarcación de Tasa se fue a pique y pescadores se salvan Bienvenido a Radio Santo Domingo | | Hora #InformaciónQueSirve Todas las noticias en tu celular Únete aquí a nuestro canal de WhatsApp Inicio Quienes somos Nosotros Misión y Visión Objetivos Valores Iglesia Noticias Columna Programación Editorial Lo último: Denuncian presunto uso indebido de vehículos de la Municipalidad Provincial del Santa Embarcación de Tasa se fue a pique y pescadores se salvan Creado el Martes, 16 de Abril del 2024 06:49:36 pm | Modificado el 16/04/2024 07:01:38 pm Accidente marítimo ocurre en primer día de la temporada de pesca de anchoveta La embarcación pesquera Tasa 415 se fue a pique esta mañana mientras realizaba faena de pesca a 50 millas del puerto de Chimbote. La noticia fue confirmada por la empresa Tasa a través en su página de Facebook. “Afortunadamente toda la tripulación está bien y todos los tripulantes han sido puestos a salvo, siguiendo la normativa de la autoridad marítima y reglamentos vigentes ante siniestros marítimos establecidos”, se lee en un comunicado publicado esta tarde. Los tripulantes, 18 en total, fueron rescatados por otra lancha, también de propiedad de la empresa Tasa. Asimismo, se informó que los pescadores ya estaban rumbo a Chimbote y llegarían esta noche a Capitanía de Puerto. Este lamentable accidente ocurre en el primer día de la temporada de pesca de anchoveta (zona norte-centro) que comenzó este martes 16 de abril a las 00:00 horas . (C.I. – RSD Noticias). Foto: Perú Pesquero Tags: Pesca de anchoveta embarcación TASA Chimbote Noticias relacionadas Chimbote: alcalde encargado denuncia descontrol en el Vaso de Leche Reservorios de Sedachimbote presentan graves deficiencias de mantenimiento y seguridad Chimbote: fallece uno de los policías baleados durante intervención MPS recepcionó obra pese a que la constructora no subsanó todas las observaciones Últimas noticias Chimbote: alcalde encargado denuncia descontrol en el Vaso de Leche ELECCIONES 2026 | ONPE publica proyecto de reglamento del financiamiento de fondos partidarios Reservorios de Sedachimbote presentan graves deficiencias de mantenimiento y seguridad Chimbote: fallece uno de los policías baleados durante intervención MPS recepcionó obra pese a que la constructora no subsanó todas las observaciones Áncash: piedras caen de cerro y casi aplastan a pobladores en Chavín de Huántar Áncash: lluvias intensas en la costa y sierra continuarán hasta el 5 de marzo Áncash: lluvias intensas destruyen dos viviendas en la provincia de Ocros Lo último Chimbote: alcalde encargado denuncia descontrol en el Vaso de Leche ELECCIONES 2026 | ONPE publica proyecto de reglamento del financiamiento de fondos partidarios Reservorios de Sedachimbote presentan graves deficiencias de mantenimiento y seguridad Chimbote: fallece uno de los policías baleados durante intervención Facebook TikTok @radio.rsd.chimbote Iglesia El estado del papa Francisco sigue estable en el hospital, pero recibe oxígeno Áncash: Diócesis de Chimbote te invita a participar de la catequesis familiar Se realiza la asamblea del Vicariato Apostólico San José del Amazonas Se realiza el Congreso sobre Inteligencia Artificial y Abusos Sexuales Publicidad Radio en Vivo Buscar RSD para Android radiorsd.pe @radio.rsd.chimbote +51-943667519 @radio.rsd.chimbote Radio RSD Chimbote Grupo: Radio Santa Rosa Radio San Martín Radio Quillabamba Zonaradio Activa Radio Sepahua Radio Madre de Dios Escuchar Radios en Vivo RADIO SANTO DOMINGO - 102.1 FM TELF: 043-327435 - 043-344632 - CEL: 943667519 E-MAIL: [email protected] , [email protected] DIRECCIÓN: Jr. LEONCIO PRADO #120 CHIMBOTE - PERÚ"
"output/pdfs-2024/cxT2wVHS1725468503.pdf","https://goo.su/zvx8a","[Source: www.news.uscg.mil] Coast Guard interdicts lancha, seizes 440 pounds of illegally caught fish off Texas coast > United States Coast Guard News > Press Releases An official website of the United States government Here's how you know Official websites use .mil A .mil website belongs to an official U.S. Department of Defense organization in the United States. Secure .mil websites use HTTPS A lock ( lock ) or https:// means you’ve safely connected to the .mil website. Share sensitive information only on official, secure websites. Skip to main content (Press Enter). Toggle navigation United States Coast Guard News Department of Homeland Security United States Coast Guard News Search Search U.S. Coast Guard News: Search Search U.S. Coast Guard News: Search News Home CG Home Page Overview Reserve Forcecom Mission Support Operations Atlantic Area Pacific Area History News by Region Headquarters Container Vessel Dali El Faro Marine Board of Investigation Destination Marine Board of Investigation Scandies Rose Seacor Power Titan Submersible Ports & Waterways Safety BOI Academy Bootcamp Atlantic Area 1st District Northeast PADET New York Grande Costa D'Avorio Investigation 5th District Midatlantic PADET Baltimore 7th District Southeast PADET Jacksonville PADET Tampa Bay Puerto Rico Golden Ray Formal Investigation Hearing 8th District Heartland PADET Texas Bouchard No 255 Barge Formal Hearing Genesis River-Voyager collision 9th District Great Lakes Pacific Area 11th District Pacific Southwest PADET San Diego PADET LA/LB 13th District Pacific Northwest PADET Astoria Mary B II Formal Hearing 14th District Hawaii and the Pacific 17th District Alaska PADET Kodiak PADET Anchorage Town Hall Pacific Area Atlantic Area Join the Coast Guard Our Organization Press Releases News Home Press Releases Press Release | April 17, 2024 Coast Guard interdicts lancha, seizes 440 pounds of illegally caught fish off Texas coast Coast Guard PADET Texas - Office: (281) 464-4810 / After Hours: (832) 293-1293 Editor's Note: Click on image to download high-resolution version. CORPUS CHRISTI, Texas — The Coast Guard interdicted a lancha and seized 440 pounds of illegally caught fish in federal waters off southern Texas Tuesday. A Coast Guard Station South Padre Island boat crew, in coordination with Coast Guard Air Station Corpus Christi aircrews, located and stopped four Mexican fishermen engaged in illegal fishing aboard a lancha approximately 12 miles north of the Maritime Boundary Line. A Coast Guard Station South Padre Island 45-foot Response Boat–Medium crew interdicted the lancha, which began rapidly taking on water once stopped. The boat crew embarked the fishermen to ensure their safety. Additionally, Coast Guard personnel seized 440 pounds of red snapper, one shark, fishing gear and high flyers found on board the vessel. Coast Guard crews detained the Mexican fishermen, brought them ashore and transferred the detainees to U.S. Customs and Border Protection personnel for further processing. ""The Coast Guard, along with our Department of Homeland Security, state and local partners, is dedicated to protecting the natural resources in our sovereign waters,"" said Capt. Hans Govertsen, commanding officer, Air Station Corpus Christi. ""All partners have been working in concert to identify, track and interdict illegal fishing ventures that originate in Mexico with the support of transnational criminal organizations. If it were not for the dedicated women and men of Station South Padre Island, Air and Marine Operations, and Texas Parks and Wildlife, we would not be able to protect our precious natural resources from these illegal fishermen."" A lancha is a fishing boat used by Mexican fishermen that is approximately 20-30 feet long with a slender profile, having one outboard motor, and is capable of traveling at speeds exceeding 30 mph. Lanchas are frequently used to transport illegal narcotics to the U.S. and illegally fish in the United States’ Exclusive Economic Zone near the U.S./Mexico border in the Gulf of Mexico. If you witness suspicious activity or illegal fishing out to 200 miles offshore, please contact the U.S. Coast Guard at 361-939-0450. For more information follow us on  Facebook ,  Twitter , and  Instagram . SHARE PRINT FOIA Privacy Policy MHS Notice of Privacy Practices Accessibility No Fear Whistleblower Protection U.S. Department of Homeland Security DHS Office of Inspector General WhiteHouse.gov USA.gov Stay Connected Hosted by Defense Media Activity - WEB.mil"
"output/pdfs-2024/cxT2wVHS1725468503.pdf","https://goo.su/1bFbv","[Source: x.com] JavaScript is not available. We’ve detected that JavaScript is disabled in this browser. Please enable JavaScript or switch to a supported browser to continue using x.com. You can see a list of supported browsers in our Help Center. Help Center Terms of Service Privacy Policy Cookie Policy Imprint Ads info © 2025 X Corp. Something went wrong, but don’t fret — let’s give it another shot. Try again Firefox’s Enhanced Tracking Protection (Strict Mode) is known to cause issues on x.com"
"output/pdfs-2024/cxT2wVHS1725468503.pdf","https://goo.su/WbHEc","[Source: www.bcsnoticias.mx] Embarcación encallada en Puerto Adolfo López Mateos no ha presentado derrame de hidrocarburo - BCS Noticias Municipios La Paz Los Cabos Comondú Loreto Mulegé Gobiernos Gobierno del Estado Ayuntamiento de La Paz Ayuntamiento de Los Cabos Política Electoral Elecciones 2021 Elecciones 2018 Elecciones 2015 Sociedad Turismo Medio Ambiente Deportes Clima Negocios Facebook Twitter Youtube Instagram Se pone en marcha la primera etapa de iluminación del centro de Cabo San Lucas Beca “Rita Cetina” apoyará a más de 17,000 estudiantes del nivel básico en Los Cabos Botón Violeta se instalará en distintos puntos estratégicos de Los Cabos; beneficiará a mujeres Por emitir presuntas facturas falsas en comercio de Mulegé, hombre fue vinculado a proceso Localizaron a un hombre sin vida, en domicilio de la colonia Perlas del Golfo, en La Paz Podrán regularizar predios de 3,000 familias en la colonia López Obrador, en Los Cabos Municipios La Paz Los Cabos Comondú Loreto Mulegé Gobiernos Gobierno del Estado Ayuntamiento de La Paz Ayuntamiento de Los Cabos Política Electoral Elecciones 2021 Elecciones 2018 Elecciones 2015 Sociedad Turismo Medio Ambiente Deportes Clima Negocios Municipios La Paz Los Cabos Comondú Loreto Mulegé Gobiernos Gobierno del Estado Ayuntamiento de La Paz Ayuntamiento de Los Cabos Política Electoral Elecciones 2021 Elecciones 2018 Elecciones 2015 Sociedad Turismo Medio Ambiente Deportes Clima Negocios Embarcación encallada en Puerto Adolfo López Mateos no ha presentado derrame de hidrocarburo 18 abril, 2024 Redacción No se ha detectado el derrame de hidrocarburos ni de otros contaminantes, luego de que una embarcación pesquera quedó varada en el Puerto Adolfo López Mateos Recibe nuestro resumen diario de noticias Comparte esta noticia en: Comondú, Baja California Sur (BCS). Luego de que se atendieran la solicitud de apoyo de la Procuraduría Federal de Protección al Ambiente (Profepa), para realizar una inspección por un presunto derrame de hidrocarburos de una embarcación pesquera encallada en el Puerto Adolfo López Mateos, se indicó que, no se han encontrado señales de contaminación. El Fondo para la Protección de los Recursos Marinos (Fonmar), fue el encargado de realizar el trabajo de inspección, luego de que la embarcación pesquera denominada “Negro Guerrero” quedó varada el pasado 14 de abril (2024), en la playa San Lázaro. “Atendiendo la solicitud de apoyo de PROFEPA, personal de FONMAR acudió a Puerto Adolfo López Mateos para inspeccionar el posible derrame de hidrocarburos de la embarcación pesquera ‘Negro Guerrero’ varada el pasado domingo 14 en la playa San Lázaro”, detallaron en una publicación. De acuerdo con las autoridades marítimas, es decir, por parte del inspector federal de Profepa, no se encontraron señales de derrame de hidrocarburos, ni tampoco de algún otro contaminante. “Tras la revisión del inspector federal de la PROFEPA, no se encontraron señales de derrame de hidrocarburos ni algún otro tipo de contaminación”, detallaron. Finalmente, se mencionó que, el navío se encuentra en buen estado, junto con el producto pesquero y, además, su combustible ha sido asegurado. En los próximos días se realizarán las maniobras de salvataje. Comparte esta noticia en: Recibe nuestro resumen diario de noticias Quizás te interese esto también Beca “Rita Cetina” apoyará a más de 17,000 estudiantes del nivel básico en Los Cabos Botón Violeta se instalará en distintos puntos estratégicos de Los Cabos; beneficiará a mujeres Por emitir presuntas facturas falsas en comercio de Mulegé, hombre fue vinculado a proceso Se puso agresivo y amenazó a su pareja en 2022; le dictan 3 años de cárcel, en Mulegé Movido jueves para Loreto; registran sismo de 5.6 grados al este del pueblo mágico Últimas Noticias Se pone en marcha la primera etapa de iluminación del centro de Cabo San Lucas Beca “Rita Cetina” apoyará a más de 17,000 estudiantes del nivel básico en Los Cabos Botón Violeta se instalará en distintos puntos estratégicos de Los Cabos; beneficiará a mujeres Por emitir presuntas facturas falsas en comercio de Mulegé, hombre fue vinculado a proceso Localizaron a un hombre sin vida, en domicilio de la colonia Perlas del Golfo, en La Paz ÚLTIMAS ENTRADAS Se pone en marcha la primera etapa de iluminación del centro de Cabo San Lucas Beca “Rita Cetina” apoyará a más de 17,000 estudiantes del nivel básico en Los Cabos Botón Violeta se instalará en distintos puntos estratégicos de Los Cabos; beneficiará a mujeres NOSOTROS Acerca de Nosotros BCS Noticias Contacto Únete a nuestro equipo Todos los derechos reservados BCS Noticias 2020 Facebook Twitter Youtube Instagram"
"output/pdfs-2024/cxT2wVHS1725468503.pdf","https://goo.su/HJPLrSo","[Source: x.com] JavaScript is not available. We’ve detected that JavaScript is disabled in this browser. Please enable JavaScript or switch to a supported browser to continue using x.com. You can see a list of supported browsers in our Help Center. Help Center Terms of Service Privacy Policy Cookie Policy Imprint Ads info © 2025 X Corp. Something went wrong, but don’t fret — let’s give it another shot. Try again Some privacy related extensions may cause issues on x.com. Please disable them and try again."
"output/pdfs-2024/cxT2wVHS1725468503.pdf","https://goo.su/RYC2ZG0","[Source: www.dicapi.mil.pe] DICAPI - Dirección General de Capitanías y Guardacostas Organization Historical Review Mission & Vision Organizational Chart General Director Executive Director Technical Supervisor Directions General Direction Aquatic Activities Control Aquatic Environment International Affairs & OMI Coast Guard Operations Maritime Administration Inspections, Audits, and Supervisions Department TUPAM Procedures Regulatory Framework Consultations IFC LATAM PERU es Español Inglés Últimas publicaciones Últimas Publicaciones Correo Web Intranet DICAPI Acceso a Geoportal Correo Web Acceso a Geoportal Home Organization Historical Review Mission & Vision Organizational Chart General Director Executive Director Technical Supervisor Directions General Direction Aquatic Activities Control Aquatic Environment International Affairs & OMI Coast Guard Operations Maritime Administration Inspections, Audits, and Supervisions Department TUPAM Procedures Regulatory Framework Consultations IFC LATAM PERU Organization Historical Review Mission & Vision Organizational Chart General Director Executive Director Technical Supervisor Contact Us Address Constitution St. 150, Callao Digital Office 24 Hours In-person office: 08:00 am - 4:00 pm Telephone 012099300, Extension: 6862 MGP - DICAPI - 2025"
