"pdf_path","url","content"
"output/pdfs-2024/2HLRiW8Y1725404777.pdf","https://goo.su/xF7gP5","[Source: diariocambio22.mx] La Marina Armada de México Decomisa Más de Tres Toneladas y Media de Cocaína Frente a Costas de Chetumal - Diario Cambio 22 - Península Libre 20 febrero 2025 Renán Castro Madera, Director General Diario Cambio 22 – Península Libre Información puntual del acontecer de la sociedad peninsular, con la verdad por delante y combatiendo la desinformación. Toggle navigation Quintana Roo Zona Norte Zona Centro Zona Sur Yucatán México Nuestro Regional Nuestro Mundo Socialidades La red Cultura Campo y Pesca Cancha y Torneos Seguridad y Justicia Opiniones Inicio / La Marina Armada de México Decomisa Más de Tres Toneladas y Media de Cocaína Frente a Costas de Chetumal La Marina Armada de México Decomisa Más de Tres Toneladas y Media de Cocaína Frente a Costas de Chetumal 13 May. 2024 ► Despliegan amplio operativo tras detectar dos narco-lanchas en altamar ► Logran asegurar una de las embarcaciones y detener a tres personas Antonio Briceño/CAMBIO 22 CHETUMAL, 13 de mayo.- Elementos de la Secretaría de Marina de México, destacados en la zona sur de Quintana Roo, llevaron a cabo un extenso operativo tras el hallazgo de una cantidad preliminar de 3.5 toneladas de presunta cocaína. Según la información proporcionada, los elementos avistaron dos lanchas en altamar, las cuales presuntamente intentaban ingresar una gran cantidad de droga al territorio mexicano. Ante esta situación, se desplegó una intensa persecución marítima, logrando asegurar una de las embarcaciones y detener a tres personas. Asimismo, se incautó la importante cantidad de droga. Tras la detención y el decomiso, se llevó a cabo un amplio operativo en la zona sur de Quintana Roo. Finalmente, los individuos fueron trasladados a las instalaciones de la Fiscalía General de la República en Chetumal, donde aguardan su situación jurídica. Hasta el momento, las autoridades han mantenido completo hermetismo sobre este caso debido a la gran cantidad de presunta droga que fue decomisada al interior de la lancha, mientras continúan las investigaciones correspondientes. redaccion@diariocambio22.mx JFCB Buscar Lo más destacado Vertimiento de Aguas Residuales de Planta de CAPA, Principal Causa de Contaminación de la Sabana de Chetumal Lo más destacado, Zona Sur 20 Feb. 2025 Recula el “Rebelde” y Condiciona Realización del “Baxal Toro” en la Expomor Lo más destacado, Zona Centro 20 Feb. 2025 Analizan Implementar Mapeos Satelitales para Detectar Desarrollos Irregulares en Cancún Lo más destacado, Zona Norte 20 Feb. 2025 Destituyen a Director Administrativo de la Secretaría de Seguridad Ciudadana y Tránsito de Cancún Lo más destacado, Zona Norte 20 Feb. 2025 El Cambio de Nombre de Solidaridad: Primer Objetivo del Despojo Histórico Planeado por la Mafia del Poder en Quintana Roo Lo más destacado, Opiniones 20 Feb. 2025 Avanzan Obras de Rehabilitación de Carreteras Federales en Quintana Roo Lo más destacado, Zona Norte 20 Feb. 2025 Magisterio de Quintana Roo Suspenderá Clases el Viernes para Iniciar Movilizaciones en Rechazo a la Reforma de la Ley del ISSSTE Lo más destacado, Nota Principal, Zona Sur 20 Feb. 2025 Embajada de EEUU Pide a sus Connacionales Extremar Precauciones en Destinos Vacacionales de Quintana Roo por Temporada de Spring Break Lo más destacado, Nota Principal, Quintana Roo, Zona Norte 20 Feb. 2025 Portadas del Periódico CAMBIO 22 en su Edición Impresa del 20 de Febrero de 2025 Lo más destacado, Quintana Roo 20 Feb. 2025 Ataque a Balazos a Bar en Cancún Deja Una Persona Muerta y 4 Lesionados Lo más destacado, Nota Principal, Seguridad y Justicia 20 Feb. 2025 Portadas: Edición Impresa Información puntual del acontecer de la sociedad peninsular, con la verdad por delante y combatiendo la desinformación. CATEGORÍAS Quintana Roo Yucatán Regional México Nuestro Nuestro Mundo Seguridad y Justicia Cancha y torneos Socialidades La Red Campo Principales Opiniones Cultura Lo Más Destacado CONTACTO cambio22digitalcun@gmail.com +52 986 100 0853 Cancún, Quintana Roo, Mex. Politica de Privacidad © Cambio 22. Todos los derechos reservados"
"output/pdfs-2024/2HLRiW8Y1725404777.pdf","https://goo.su/azrSu","[Source: x.com] JavaScript is not available. We’ve detected that JavaScript is disabled in this browser. Please enable JavaScript or switch to a supported browser to continue using x.com. You can see a list of supported browsers in our Help Center. Help Center Terms of Service Privacy Policy Cookie Policy Imprint Ads info © 2025 X Corp. Something went wrong, but don’t fret — let’s give it another shot. Try again Some privacy related extensions may cause issues on x.com. Please disable them and try again."
"output/pdfs-2024/2HLRiW8Y1725404777.pdf","https://goo.su/JXrNH","[Source: www.crhoy.com] Guardacostas decomisan 79 paquetes de cocaína Portada Últimas Más Leídas Nacionales Deportes Entretenimiento Economía Tecnología Mundo Opinión Secciones Nosotros Humor Entérese Ambiente Foto del Día Frase del Día Programas Recibir Boletín Contáctenos Contáctenos Recibir Boletín Más Leídas Últimas Nacionales PLN desmiente a Gilberth Jiménez: no puede participar en convención debido a suspensión Rescatan a hombre que fue lanzado al Río Torres tras asalto CCSS dejaría de pagar por licencias de cuido a enfermos graves a partir del 10 de marzo Sospechoso en caso “Los Gery” quería faltar a juicio porque tenía visita íntima Deportes José Giacone ya no es más técnico de Saprissa Carlos Mora comparte equipo ideal con Messi Ya hay fecha y rival: Yokasta Valle confirmó su próxima pelea Técnico de Pumas: “El favorito es el que hace mejor las cosas en la cancha” Entretenimiento Karla Sofía Gascón es blanco de bromas en los Premios Oscar ¿De qué trata Anora, la película ganadora de los Óscar 2025? Con suéter y pantaloneta: ¡Adam Sandler se robó todas las miradas en los premios Óscar! Ondeando la bandera de Costa Rica, Camila llevó a los ticos a un viaje en el pasado con su concierto Economía Tomás Soley asume como jerarca interino de la Supen Empresa vinculada a fabricación de equipos médicos planea 500 contrataciones Agencia de viajes cancela tres salidas a Brasil tras denunciar millonaria estafa Estudio: Cartago fue la provincia donde más se otorgó créditos para vivienda Tecnología ¡Atención! WhatsApp agregaría esta nueva funcionalidad a sus estados Festival Nacional de Robótica 2025 convocará a 430 participantes ¡Tome nota! Facebook cambió sus políticas y esto podría afectarle Apelan resolución que rechazó medida cautelar sobre decreto de ciberseguridad 5G Mundo (VIDEO) Avión aterriza con un motor en llamas en Nueva Jersey Trump aumenta a 20% los aranceles para las importaciones desde China Wall Street cierra con fuerte caída tras anuncio de Trump sobre aranceles a México y Canadá (VIDEO) Turista lleva a su casa a mujeres que acababa de conocer y le roban todo en Argentina Opinión Crisis de los cuidados: un desafío urgente para la igualdad sustantiva ¿Qué es la representación política? Nueva resolución sobre precios de transferencia y la “desconfianza tributaria” Sin prisa Secciones Nosotros Humor Entérese Ambiente Foto del Día Frase del Día Programas Nacionales Sucesos Tras persecusión Guardacostas decomisan 79 paquetes de cocaína Ambar Segura [email protected] Mayo 12, 2024  6:18 pm 05122024 Sujetos no han sido detenidos {{slide.text | html}} {{slide.text | html}} {{slide.text | html}} Oficiales del Servicio Nacional de Guardacostas de Golfito realizaron una persecución y lograron incautar cerca de 79 kilogramos de cocaína, la madrugada de este domingo. La embarcación de nombre Foca VI, donde los sujetos llevaban la cocaína, ingresó a alta velocidad al muelle municipal . Se movilizaba de noche y a gran velocidad, por lo que los oficiales le dieron persecución hasta ubicarla encallada cerca de ese sector, con el motor enterrado en el fango y 2 bultos con droga en su interior. Las autoridades realizaron las diligencias correspondientes en tierra, para tratar de ubicar los sospechosos, los cuales no han sido ubicados. La evidencia fue puesta a la orden de la Policía Judicial para el proceso correspondiente Esto le puede interesar: Haga clic para ver más noticias sobre: cocaína , Nacionales , narcotráfico , Servicio Nacional de Guardacostas Leer comentarios Síganos en redes sociales: Últimas Más Leídas Ultimas Mas Leidos 4:21 pm - PLN desmiente a Gilberth Jiménez: no puede participar en convención debido a suspensión 4:17 pm - (VIDEO) Avión aterriza con un motor en llamas en Nueva Jersey 4:05 pm - Rescatan a hombre que fue lanzado al Río Torres tras asalto 3:51 pm - CCSS dejaría de pagar por licencias de cuido a enfermos graves a partir del 10 de marzo 3:49 pm - Trump aumenta a 20% los aranceles para las importaciones desde China 3:44 pm - José Giacone ya no es más técnico de Saprissa 3:41 pm - Sospechoso en caso “Los Gery” quería faltar a juicio porque tenía visita íntima 3:41 pm - Wall Street cierra con fuerte caída tras anuncio de Trump sobre aranceles a México y Canadá Ver Más + Cámara captó a mujer estallando llantas de carros durante fiesta en San Sebastián Agencia de viajes cancela tres salidas a Brasil tras denunciar millonaria estafa ¿Qué sucederá con la bebé abandonada en las llantas de un camión en Heredia? Abogado de Chaves cobró $10 mil a familia por interponer una acción de inconstitucionalidad “La belleza es subjetiva”: Ligia Madrigal muestra cómo quedó su rostro al subir el Everest Sospechosa de abandonar bebé en Heredia continúa hospitalizada CCSS recomienda adjudicar contrato de $14 millones a hermano de directivo Zelenski advierte que una tregua sin garantías de seguridad “será un fracaso” Ver Más + Paute con Nosotros Los comentarios expresados en las columnas de opinión, página de memes, en la opi"
"output/pdfs-2024/2HLRiW8Y1725404777.pdf","https://goo.su/9jL6EI","[Source: diarioinforme.net] Decomisan en el Caribe de Honduras una embarcación con 112 paquetes de cocaína - Diario Informe INICIO NACIONALES POLÍTICA SUCESOS INTERNACIONALES ECONOMÍA DEPORTES BEISBOL FÚTBOL BALONCESTO MOTORES SALUD ENTRETENIMIENTO CINE CURIOSIDADES TEATRO RELIGIÓN TECNOLOGÍA Internacionales Decomisan en el Caribe de Honduras una embarcación con 112 paquetes de cocaína 9 de mayo, 2024 - 10:50 pm EFE/ foto referencial Las autoridades de Honduras incautaron este jueves una embarcación con al menos 112 paquetes de cocaína, durante una operación en el Caribe del país centroamericano, informó una fuente oficial. La droga, no especificada en su peso, fue hallada dentro de varios barriles que eran transportados en una lancha en el Caribe de Honduras, indicó el Ministerio Público (Fiscalía) en un comunicado. La embarcación fue interceptada en el marco de una operación conjunta entre la Fiscalía Especial Contra el Crimen Organizado, la Agencia Técnica de Investigación Criminal (ATIC) y la Fuerza Especial Naval, en la que no hubo personas detenidas, añadió. El titular de @Sedenahn , @JoseMZelayaR , informó que en una operación en desarrollo por parte de las @FFAAHN a través de la @FuerzaNavalHND en el Caribe de #Honduras , se han decomisado 112 fardos conteniendo en su interior supuesta cocaína pic.twitter.com/vE07U5bTsh — David de la Paz 戴维 (@daviddelapaz) May 10, 2024 El Ministerio Público precisó que desde el fin de semana se daba «seguimiento y análisis a la información de un posible trasiego de cocaína que llegaría a las costas hondureñas». Las autoridades de Honduras lograron «este nuevo golpe al narcotráfico» luego de intercambiar información con fuerzas de inteligencia de México y Colombia, enfatizó. El organismo hondureño señaló que agentes de la ATIC viajarán en las próximas horas a la base naval de Puerto Castilla, en el departamento de Colón, en el Caribe de Honduras, donde inspeccionarán y contarán la droga incautada. El decomiso significa «un fuerte debilitamiento de los brazos operativos y financieros de los grupos de tráfico de drogas a gran escala», subrayó el Ministerio Público. Los fardos de droga pesan generalmente cerca de un kilogramo y la sustancia ilícita más decomisada en Honduras es la cocaína. Por su posición geográfica, el territorio hondureño es utilizado por narcotraficantes internacionales que envían cargamentos, especialmente de cocaína, a Estados Unidos, en avionetas y embarcaciones rápidas que navegan por el Caribe. En lo que va de 2024, las autoridades de seguridad hondureñas han incautado más de cuatro toneladas de cocaína y más de tres millones de arbustos de coca en varias operaciones antidrogas, principalmente en el Caribe del país centroamericano. Honduras decomisó el año pasado 4,7 millones de hojas de coca, 561 kilos de cocaína y 107.727 kilos de marihuana, según cifras de las autoridades. Únete a nuestro canal de Telegram, información sin censura:  https://t.me/canal800noticias Suscribir vía Telegram 112 paquetes cocaína Caribe embarcación Honduras Lea también ■ Internacionales Colombia: Abaten a cabecilla de las disidencias de las FARC en operación militar 1 de noviembre, 2024 - 6:06 pm ■ Internacionales Harris y Trump eligen los mismos estados para su cierre de campaña 1 de noviembre, 2024 - 5:52 pm ■ Internacionales Más de 64 millones de personas ya han votado por adelantado en EEUU 1 de noviembre, 2024 - 5:01 pm ■ Internacionales El relato de una superviviente del temporal en España 1 de noviembre, 2024 - 4:41 pm © 2013-2025 diarioinforme.net Derechos Reservados. Contacte al editor"
"output/pdfs-2024/2HLRiW8Y1725404777.pdf","https://goo.su/ohEj","Error: HTTP 403"
"output/pdfs-2024/2HLRiW8Y1725404777.pdf","https://goo.su/SeSaM","[Source: www.argentina.gob.ar] Control de las fronteras: Prefectura secuestró más de 139 kilos de marihuana y cocaína: hay dos detenidos | Argentina.gob.ar Presidencia de la Nación Pasar al contenido principal Ir a Mi Argentina Buscar Cerrar el buscador Mi Argentina Dejar en blanco Buscar en el sitio Buscar en el sitio Inicio Ministerio de Seguridad Nacional Prefectura Naval Argentina Noticias de la PNA Control de las fronteras: Prefectura secuestró más de 139 kilos de marihuana y cocaína: hay dos detenidos Control de las fronteras: Prefectura secuestró más de 139 kilos de marihuana y cocaína: hay dos detenidos El valor de la droga supera los 318 millones de pesos. 14 de mayo de 2024 Compartir en Facebook Compartir en X Compartir en Linkedin Compartir en Whatsapp Compartir en Telegram Como resultado del intenso trabajo que se realiza en la frontera fluvial del país para prevenir el delito, efectivos de la Prefectura Naval Argentina detuvieron a dos narcotraficantes y secuestraron más de 139 kilos de marihuana y cocaína, en dos procedimientos realizados en Wanda (Misiones) e Ita Ibaté (Corrientes). El primer operativo se desarrolló en la mencionada localidad misionera cuando personal de la Fuerza, que realizaba tareas de vigilancia y control en la zona conocida como “Arenera Cárdenas”, divisó el cruce de una embarcación proveniente del Paraguay, a unos 1.500 metros aguas arriba. De inmediato, el personal de la Fuerza se dirigió al lugar y halló seis bultos de distintas dimensiones, que contenían 156 panes de marihuana, con un peso de más de 131 kilos. Intervino en el caso la Fiscalía y el Juzgado Federal de Eldorado. Por otro lado, en Ita Ibaté (Corrientes), mediante trabajos previos de recolección de información delictual, se tomó conocimiento de que se traficaría droga a bordo de un vehículo que saldría desde el kilómetro 1196 de la Ruta Nacional N° 12. Con ese dato, se desplegó estratégicamente personal y medios en puntos que podrían ser utilizados para realizar la operación. En ese contexto, efectivos de la Prefectura observaron a un vehículo que salía desde camino costero con dirección a la ciudad de Corrientes, que al percatarse de la presencia policial realizó maniobras girando en U intentando darse a la fuga. Tras lograr capturarlo, el personal de la Institución constató que sus dos ocupantes llevaban una bocha de cocaína y un bulto con ocho panes de marihuana, con un peso de más de siete kilos. El Juzgado Federal de Primera Instancia No 2 de Corrientes ordenó la detención de los involucrados y el decomiso de los estupefacientes. Noticias relacionadas 28 de febrero de 2025 Prefectura fue reconocida por su accionar durante un incendio ocurrido en Santa Fe 27 de febrero de 2025 Orquestas unidas: músicos de la Prefectura Naval Argentina y estudiantes de la Escuela de Berisso compartieron un emocionante concierto 27 de febrero de 2025 Prefectura Naval Argentina y la Coast Guard de EE. UU. refuerzan lazos en ceremonia de ascenso Trámites Turnos Trámites a distancia Atención a la ciudadanía Acerca de la República Argentina Nuestro país Leyes argentinas Organismos Mapa del Estado Acerca de Argentina.gob.ar Acerca de este sitio Términos y condiciones Sugerencias Scroll hacia arriba"
"output/pdfs-2024/2HLRiW8Y1725404777.pdf","https://goo.su/6LxTb","[Source: www.dicapi.mil.pe] DICAPI - Dirección General de Capitanías y Guardacostas Organization Historical Review Mission & Vision Organizational Chart General Director Executive Director Technical Supervisor Directions General Direction Aquatic Activities Control Aquatic Environment International Affairs & OMI Coast Guard Operations Maritime Administration Inspections, Audits, and Supervisions Department TUPAM Procedures Regulatory Framework Consultations IFC LATAM PERU es Español Inglés Últimas publicaciones Últimas Publicaciones Correo Web Intranet DICAPI Acceso a Geoportal Correo Web Acceso a Geoportal Home Organization Historical Review Mission & Vision Organizational Chart General Director Executive Director Technical Supervisor Directions General Direction Aquatic Activities Control Aquatic Environment International Affairs & OMI Coast Guard Operations Maritime Administration Inspections, Audits, and Supervisions Department TUPAM Procedures Regulatory Framework Consultations IFC LATAM PERU Organization Historical Review Mission & Vision Organizational Chart General Director Executive Director Technical Supervisor Contact Us Address Constitution St. 150, Callao Digital Office 24 Hours In-person office: 08:00 am - 4:00 pm Telephone 012099300, Extension: 6862 MGP - DICAPI - 2025"
"output/pdfs-2024/2HLRiW8Y1725404777.pdf","https://goo.su/Erv8","[Source: diariolalibertad.com] Incautado alcaloide que era transportado oculto en el doble fondo de una lancha - Diario La Libertad. Facebook Instagram Twitter Inicio Crónica Judicial Nacional Atlantico Magdalena Política Económica Cadena Radial Buscar 29.9 C Barranquilla lunes, marzo 3, 2025 Edictos y Clasificados Cadena radial Registrarse ¡Bienvenido! Ingresa en tu cuenta tu nombre de usuario tu contraseña ¿Olvidaste tu contraseña? consigue ayuda Recuperación de contraseña Recupera tu contraseña tu correo electrónico Se te ha enviado una contraseña por correo electrónico. Diario La Libertad. Inicio Crónica Judicial Nacional Atlantico Magdalena Política Económica Cadena Radial Inicio Crónica Judicial Incautado alcaloide que era transportado oculto en el doble fondo de una... Incautado alcaloide que era transportado oculto en el doble fondo de una lancha 15 de mayo de 2024 Facebook Twitter WhatsApp Con este resultado se evitó el ingreso de más de 13 millones de dólares a las organizaciones de crimen transnacional. Unidades de la Armada de Colombia durante el desarrollo de operaciones de control y seguridad integral marítima interceptaron una embarcación artesanal tripulada por tres sujetos de nacionalidad colombiana, cuando navegaban en el área general del Valle del Cauca, transportando sustancias ilícitas. Durante el proceso de interdicción a la embarcación y posterior visita y registro, el personal de la Estación de Guardacostas de Buenaventura encontró que la estructura de la embarcación había sido modificada, razón por la cual procedió a trasladar a los tres sujetos junto a la embarcación hacia el Distrito de Buenaventura. En las instalaciones de la Estación de Guardacostas de Buenaventura, el personal militar cortó las láminas de la embarcación, hallando un doble fondo en el cual se habían ocultado 400 paquetes rectangulares. Los sujetos y el alijo fueron puestos a disposición de la Policía Nacional, quienes realizaron la Prueba de Identificación Preliminar Homologada – PIPH a los paquetes, arrojando positivo para clorhidrato de cocaína con un peso de 389 kilogramos. Se estima que, este alijo alcanzaría un costo superior a los 13 millones de dólares en el mercado ilegal internacional, cifra que deja de ingresar a las finanzas de las organizaciones al servicio del narcotráfico. Así mismo, se evitó la comercialización de casi un millón de dosis de cocaína en las calles del mundo. La Armada de Colombia continuará desarrollando operaciones contundentes que permitan contrarrestar el flagelo del narcotráfico y sus delitos conexos, afectando todos los eslabones de su cadena financiera en el Pacífico colombiano. Facebook Twitter WhatsApp Artículo anterior Primer ministro de Eslovaquia herido en tiroteo, es llevado a un hospital Artículo siguiente Damnificados de La Mojana ruegan ayuda gubernamental en medio de inundaciones Redacción3 La Libertad Artículos relacionados Más del autor Generales Gran Parada de Comparsas brilla en sus 25 años en el Cumbiódromo de la Vía 40 Generales Barranquilla vivió una faena musical monumental con el Festival de Orquestas 2025 Carnaval SAN FELIPE GANÓ MEJOR FACHADA CARNAVAL 2025 Carnaval Silvestre Dangond recibe el Turbante de la Tradición en el Carnaval 2025 Generales Noche de Orquestas exaltó los talentos musicales en la pista de baile a cielo abierto más grande del Carnaval Generales Atlántico brilló en ANATO 2025: 807 citas de negocios y acuerdos comerciales impulsan crecimiento del turismo Diario La Libertad - Con La Fuerza De La Verdad Contáctanos: weblalibertad@gmail.com Política de Privacidad © COPYRIGHT 2022 DIARIO LA LIBERTAD. Se prohíbe la reproducción total o parcial de cualquiera de los contenidos que aquí aparezca, así como su traducción a cualquier idioma sin autorización escrita por su titular. Te recomendamos leer: Gran Parada de Comparsas brilla en sus 25 años en el... 3 de marzo de 2025 Barranquilla vivió una faena musical monumental con el Festival de Orquestas... 3 de marzo de 2025"
