"pdf_path","url","content"
"output/pdfs-2023/oTbXEbWy1726517068.pdf","https://goo.su/P6BluQ","[Source: vivalanoticia.mx] Zozobra una embarcación, rescatan a 6 turistas. Saltar al contenido 3 marzo, 2025 15:07 SINALOA Sinaloa Centro Sinaloa Sur Sinaloa Norte POLICIACA DEPORTES ESPECTÁCULO POLICIACA Sinaloa Sur Zozobra una embarcación, rescatan a 6 turistas. Por Enrique Gil Vargas Nov 30, 2023 Mazatlán, Sinaloa.- Seis turistas fueron rescatados por elementos salvavidas tras zozobrar y voltearse la embarcación en que viajaban. El percance ocurrió en el área de playa de Gaviotas 2 frente al hotel Misión. Fueron los fuertes vientos que se sintieron la tarde de este miércoles en la costa mazatleca, los que hicieron zozobrar la embarcación Malia de Marina Fonatur. De inmediato se activaron los protocolos de la policia acuatica quienes se trasladaron al lugar. Al llegar se le prestó apoyo a 6 personas que subieron a otra embarcación para trasladarla a la marina de El Cid, sin ameritar el traslado a algun hospital. Tras darle flotabilidad a la embarcación, se le remolcó hacia la Isla del medio para resguardarla y protegerla. Fue el capitán Adán Rodríguez quien solicitó el apoyo de emergencia y narró lo ocurrido. En las tareas de rescate participaron una unidad Comander, y varias Jetski. Comparte esto: WhatsApp Twitter Facebook LinkedIn Telegram Deja un Comentario Leave a Comment Navegación de entradas El VIH sigue siendo un estigma para la población la cultura social aún es necesaria. Despojan de forma violenta una camioneta la madrugada de este jueves . Entrada relacionada El incendio de un automóvil en la 5 de mayo deja miles de pesos en daños. Intensifica gobierno municipal la limpieza de las calles en Mazatlán para deleitar a paseantes. Martes de Carnaval tendrá cierre de la avenida Del Mar. gobierno del estado Funciona gracias a WordPress | Tema: Newsup de Themeansar Home Aviso de Privacidad Contacto Detienen a sujeto que iba al hospital del seguro social a rematar un herido. Por COVID 19, Festival de Glastonbury, anulado por segundo año . Porfolio"
"output/pdfs-2023/oTbXEbWy1726517068.pdf","https://goo.su/j3wwFE","[Source: www.eluniverso.com] Detectan partes de armas camufladas en un bote y dos motos de agua que arribaron en contenedor a puerto de Guayaquil | Seguridad | Noticias | El Universo MENÚ MENÚ Inicia el año mejor informado y más conectado ¡De vacaciones, pero siempre bien informado! Noticias Política Economía Internacional Ecuador Seguridad Informes NOTICIAS Publicidad Ediciones: Guayaquil Quito Tendencias: Resultados de las elecciones Elecciones en Ecuador Partidos de hoy Gastos personales Agenda Seguridad Detectan partes de armas camufladas en un bote y dos motos de agua que arribaron en contenedor a puerto de Guayaquil De manera preliminar se conoció que la embarcación llegó en un contenedor desde Estados Unidos. NOTAS RELACIONADAS Una tonelada de droga fue detectada en lancha a 588 millas de la isla Wolf, en Galápagos Cuatro muertos y un herido en ataques registrados en zonas de Durán y Guayaquil Síguenos en WhatsApp Partes de armas se hallaron en embarcaciones provenientes del exterior. Cortesía. Publicidad 29 de noviembre, 2023 - 19h20 Actualizado el  29 de noviembre, 2023 En uno de los puertos marítimos de Guayaquil se dio un inusual hallazgo dentro de una embarcación que había ingresado proveniente del extranjero. Redacción eluniversocom Recibe las noticias de El Universo desde Google News Publicidad Publicidad Lo último en Seguridad Gobierno firma convenio con el IESS para beneficiar a policías en Playas Presunto cabecilla de Los Águilas, que opera en el sector de Virgen de Fátima, fue capturado durante rescate de secuestrados Hallazgo de presunto explosivo generó zozobra en el suburbio de Guayaquil Mujer fue asesinada mientras esperaba el retiro de un cadáver frente al centro forense de Esmeraldas Despliegue policial en Posorja y Playas para combatir estructuras criminales Tres reos muertos y siete con síntomas de posible intoxicación en la cárcel de Machala Publicidad Comparte este artículo Síguenos en WhatsApp ¿Tienes alguna sugerencia de tema, comentario o encontraste un error en esta nota? Repórtalo a la redacción Publicidad Lo último en Noticias Hermanas recuperan mochila del padre andinista muerto en volcán argentino hace 40 años Gobierno firma convenio con el IESS para beneficiar a policías en Playas Empresa del consorcio Sinopetrol confirma adjudicación del contrato de participación del campo Sacha Donald Trump está abierto a un pacto comercial con Argentina y califica a Javier Milei de ‘gran líder’ Así deberá conformarse la comisión interinstitucional para enfrentar la inseguridad que dispuso la Corte Constitucional Publicidad Publicidad Lo último Campeonato Nacional Liga Pro ‘Esa hambre de jugar y sacar mi mejor versión me tiene aquí’, dice Djorkaeff Reasco sobre su traspaso a El Nacional El delantero ecuatoriano quiere encontrar regularidad y sumar varios minutos en el cuadro militar, en el que aspira pelear el título de la Liga Pro. hace 11 minutos Gobierno firma convenio con el IESS para beneficiar a policías en Playas hace 15 minutos ¡La nueva piel del Ponchito! Mushuc Runa presentó una camiseta conmemorativa para la Copa Sudamericana hace 35 minutos Empresa del consorcio Sinopetrol confirma adjudicación del contrato de participación del campo Sacha hace 40 minutos Lifting nutricional de tres días para reducir la hinchazón, mejorar los contornos del rostro y reafirmar la línea de la mandíbula hace una hora Estos son los 44 equipos que participarán en la Copa Sudamericana hace una hora Publicidad Portada Lo Último Noticias Opinión Guayaquil Marcador Entretenimiento La Revista Juegos Tienda Compañía Trabaja con nosotros Quiénes somos Código deontológico Ayuda / Asistencia Contáctenos Suscripciones Publicidad Nuestras marcas Quiosco Digital El Universo Full Clasificados El Club Tienda El Universo © 2025 C.A. EL UNIVERSO. Todos los derechos reservados Políticas de privacidad Según el Art. 60 de la Ley Orgánica de Comunicación, los contenidos se identifican y clasifican en: (I), informativos; (O), de opinión; (F), formativos/educativos/culturales; (E), entretenimiento; y (D), deportivos"
"output/pdfs-2023/oTbXEbWy1726517068.pdf","https://goo.su/WSPhK","[Source: tiempo.hn] Capturan a tres sujetos por contrabandear 20 cajas de cigarros en Omoa Facebook Instagram WhatsApp Youtube Nación Cronómetro Curiosas Mundo Sucesos de Honduras Autos Vídeo 30.6 C San Pedro Sula lunes, marzo 3, 2025 Facebook Instagram Twitter Inicio Nación Sucesos de Honduras Escena Color Político Autos Noticias USA Cronómetro Canal de Whatsapp Inicio Nación Sucesos de Honduras Escena Color Político Autos Noticias USA Cronómetro Canal de Whatsapp Noticias de Honduras Sucesos de Honduras Capturan a tres sujetos por contrabandear 20 cajas de cigarros en Omoa Por Sophia Figueroa noviembre 24, 2023 Cuota Facebook Twitter Telegram WhatsApp Los involucrados serán remitidos a las autoridades correspondientes. Debes leer Hombre hallado sin vida en cañeras de Potrerillos: quién era y qué sucedió febrero 25, 2025 El Salvador cierra febrero con solo tres homicidios marzo 2, 2025 El papa Francisco da las «gracias» a los fieles de todo el mundo por sus oraciones marzo 2, 2025 Ganadero y ama de casa: las víctimas de ataque armado en Poncaya, Olancho febrero 28, 2025 Omoa, Honduras. Autoridades de la seguridad capturaron a un hondureño y dos ciudadanos guatemaltecos, que supuestamente contrabandeaban 20 cajas de cigarrillos en Chachahuala, Omoa, departamento de Cortés. La Policía Militar del Orden Público ( PMOP ) detuvo a los involucrados con los cigarrillos y, además, un camión, un velero y una cantidad de dólares no especificada. A través de sus redes sociales la PMOP informó que en la operación también participaron miembros de la Fuerza Naval de Honduras. Le puede interesar: Remiten al MP denuncias contra 3 empresas por contrabando y falsificación En la captura también se decomisó un velero. El director de Aduanas, Fausto Cálix , compartió en sus redes sociales la captura. «Dándole seguimiento a este operativo: se reportan 3 personas detenidas; entre ellos 1 hondureño y 2 de nacionalidad extranjera. Vía marítima pretendían ingresar cigarrillos por CONTRABANDO en la zona norte del país. En lo que va del 2023 ya reportamos más de 27 millones de unidades de cigarrillos decomisados», publicó. VEA EL VIDEO [jwp-video n=»1″] Aduanas y MP Recientemente, Fausto Cálix se reunió con el fiscal general interino, Johel Zelaya, para afianzar la relación con el Ministerio Público (MP),y combatir así la evasión y el contrabando. «Hemos sostenido una importante reunión esta mañana con el fiscal general de la República, el abogado Johel Zelaya. Ustedes han tenido conocimiento de las diversas denuncias que hemos presentado desde la llegada nuestra», explicó Cálix en su momento. A su vez, destacó que entre los temas que trataron estaba el de los procesos judiciales en curso tras las denuncias interpuestas desde Aduanas. Le puede interesar: Instalan oficinas para tramitar antecedentes policiales en aeropuertos y aduanas Los funcionarios explicaron que hay varios procesos pendientes. «Le hemos puesto en conocimiento justamente todos esos procesos que hemos ido trabajando. Además, ha servido para mantener y afianzar esas relaciones entre el Ministerio Público y Aduanas «, comentó. Cálix calificó como «importante» la reunión con Zelaya, debido a los casos pendientes que existen en el Ministerio Público. «Consideramos que ha sido una importante reunión para lograr avanzar en todos estos casos pendientes y algunos que vamos a traer en los próximos días ante este ente persecutor del Estado», dijo. De igual manera, enumeró que hasta el momento han denunciado a más de 27 personas que laboran en esta institución. «El compromiso es público por parte del fiscal general. No solo en este tipo de penas sino en general, en lograr combatir la corrupción «, concluyó. Estás a un paso de recibir nuestro PDF Gratis Suscríbete a nuestro Whatsapp Aquí Tags Contrabando de cigarros Fausto cálix PMOP Policía Militar del Orden Público Cuota Facebook Twitter Telegram WhatsApp Artículo anterior Inhuman 49 cadáveres no reclamados por sus familiares en SPS Artículo siguiente Avioneta se estrella en un bosque cercano al aeropuerto de Ciudad de Panamá - Advertisement - Última Hora Horarios de distribución de agua potable en la capital esta semana Hace 12 mins ¡Riña en punto de buses! Agente abofetea a conductor de «rapidito» en SPS Hace 16 mins Convenio de colaboración entre la UTH y CAEC potenciará la investigación comunicacional Hace 29 mins Falla técnica paraliza trámites en el Instituto Nacional de Migración en SPS Hace 48 mins Anuncian cortes de energía en varias partes de Atlántida, Colón y Copán Hace 1 hora Hoy en Cronómetro Ancelotti vaticina lo que sucederá contra el Atlético de Madrid en Champions Fuente: CRONÓMETRO de Diario Tiempo Digital Fecha de publicación 2025-03-03 Jhon Jairo López: “Para mí hubo mano y no nos regalaron nada” Fuente: CRONÓMETRO de Diario Tiempo Digital Fecha de publicación 2025-03-02 Eduardo Espinel: “Me voy con una sensación amarga” Fuente: CRONÓMETRO de Diario Tiempo Digital Fecha de publicación 2025-03-02 Olimpia cede el liderato del "
"output/pdfs-2023/oTbXEbWy1726517068.pdf","https://goo.su/n00hR","[Source: x.com] JavaScript is not available. We’ve detected that JavaScript is disabled in this browser. Please enable JavaScript or switch to a supported browser to continue using x.com. You can see a list of supported browsers in our Help Center. Help Center Terms of Service Privacy Policy Cookie Policy Imprint Ads info © 2025 X Corp. Something went wrong, but don’t fret — let’s give it another shot. Try again Some privacy related extensions may cause issues on x.com. Please disable them and try again."
"output/pdfs-2023/oTbXEbWy1726517068.pdf","https://goo.su/XzK8w","[Source: www.notiuno.com] Intervienen embarcación con personas de estatus migratorio no definido | Noticias | notiuno.com Skip to main content You have permission to edit this article. Edit Close Facebook Twitter YouTube Welcome, Guest Sign Up Log In Dashboard Logout My Account My Account Dashboard Profile Saved items Logout Home Último Minuto En VIVO NotiUno TV NotiUno TV Noticias Gobierno y Política Seguridad y Justicia Economía Entretenimiento Empleos Estados Unidos y Mundo Deportes GoodNius Enhorabuena Increíble Salud Podcasts A Palo Limpio con Ramón Rosario e Iván Rivera Sin Miedo Pelota Dura El Pique de Falú En La Mirilla En Caliente con Carmen Jovet Ponce en Caliente El Tiempo NotiSalud Site search Search Sign Up Log In Dashboard Logout My Account Dashboard Profile Saved items Logout Facebook Twitter YouTube Instagram ¡Primera fiscalizando! Site search Search Home Último Minuto En VIVO NotiUno TV NotiUno TV Noticias Gobierno y Política Seguridad y Justicia Economía Entretenimiento Empleos Estados Unidos y Mundo Deportes GoodNius Enhorabuena Increíble Salud Podcasts A Palo Limpio con Ramón Rosario e Iván Rivera Sin Miedo Pelota Dura El Pique de Falú En La Mirilla En Caliente con Carmen Jovet Ponce en Caliente El Tiempo NotiSalud Destacada Intervienen embarcación con personas de estatus migratorio no definido Notiuno.com Nov 25, 2023 Nov 25, 2023 Comments Facebook Twitter WhatsApp SMS Email Foto Suministrada Facebook Twitter WhatsApp SMS Email Print Copy article link Save Las autoridades intervinieron con una embarcación ocupada con personas de estatus migratorio no definido en el área del balneario de Punta Salinas en Toa Baja.   De acuerdo a la información preliminar, al llegar al balneario, rescataron a dos hombres de 26 y 38 años, de los cuales uno de ellos no sabía nadar. Alegaron que venían en una embarcación con un grupo personas, se separaron en horas de la madrugada de hoy, al llegar a las aguas de Dorado.   Los detenidos fueron atendidos por paramédicos de Manejo de Emergencias del municipio de Toa Baja y entrevistados por agentes de FURA (Fuerzas Unidas de Rápida Acción) y por personal de Homeland Security y de la Patrulla Fronteriza, quienes se hicieron cargo de la investigación y de la custodia de los mismos. Facebook Twitter WhatsApp SMS Email Print Copy article link Save Más popular Articles Images Videos Commented Articles Advierten que República Dominicana debe estar ""preparada"" para gran terremoto Encuentran muertos al actor Gene Hackman, su esposa y su perro Denuncian que ""error matemático"" provoca envío de menos dinero en reintegros Carmelo Ríos: ""Para récord legislativo, Joanne Rodríguez Veve votó en contra de su misma medida"" Rivera Schatz: ""Yo voy a demostrar al Pueblo quién es el enemigo de la cultura en Puerto Rico"" Culpable ""Rey Charlie"" por alteración a la paz contra Capitán de la Policía Ciudadanos celebran eliminación de otro semáforo en Cayey A favor Javier Jiménez de implementar ""DOGE"" en gobierno de Puerto Rico Identifican víctimas del doble asesinato en Canóvanas Exigen excarcelación de convicta por la muerte de su bebé Images Videos Commented Sorry, there are no recent results for popular commented articles. Sobre Nosotros Contáctanos Quiénes Somos Programación Encuesta del Día Newsletter Las Noticias Más Leídas Sitemap Encuentra Nuestro App Google Play Store App Store Redes Sociales Facebook Twitter YouTube Instagram Uno Radio Group notiuno.com • 1581 Ponce de León Street, Urb. El Cerezal, San Juan, PR 00926 Phone: 787-474-0630 • Email: noticias@unoradio.com EEO Report - Public Inspection File for: • WUNO • WPRP • WORA • WCMN-AM • WNEL-AM Derechos de autor  | Términos, y Condiciones de Uso  | Política De Privacidad Powered by BLOX Content Management System from BLOX Digital . × Browser Compatibility Your browser is out of date and potentially vulnerable to security risks. We recommend switching to one of the following browsers: Microsoft Edge Google Chrome Firefox"
"output/pdfs-2023/oTbXEbWy1726517068.pdf","https://goo.su/ldIX","[Source: www.elheraldo.co] Recuperan el cuerpo de un joven que estaba desaparecido en Cartagena - ELHERALDO.CO B olívar | Inicio Locales Deportes Judicial Opinión Sociedad País Región Economía Otros servicios Contenidos en alianza Clasificados Opens in new window Obituarios Partner inmobiliaria Opens in new window Precio del Dólar hoy $4.134 Ayer $4.120 Multimedia EL EDITORIAL escúchalo en: Opens in new window Fotos Videos Infografías Podcast Síguenos en redes Suscríbete a El Heraldo Otras secciones Política Mundo Wasapea Cultura Educación Mujer e Igualdad Entretenimiento Gastronomía Salud Turismo Medio ambiente Ciencia Mascotas Familia Sociales Tecnología Términos y condiciones  -  Contáctenos Lo Último Un asalto carnavalero lleno de alegría por los barrios de la ciudad 9:47 PM Trump impondrá aranceles a México y Canadá a partir de este martes 9:39 PM Tatiana Angulo se bailó el cumbiódromo en su tercer día como reina del Carnaval de Barranquilla 2025 9:27 PM Hombres armados entran al centro de detención El Oasis y ayudan a escapar a siete adolescentes 9:17 PM El llanto también se escuchará por toda la Calle 84 9:11 PM Real Madrid vs. Atlético de Madrid: el derbi de la eterna revancha europea 8:40 PM En Córdoba le piden al Gobierno Nacional agilizar entrega de aulas en Montería 8:40 PM ¿Cómo le ha ido al América en sus últimas visitas al ‘Metro’? 8:16 PM Un asalto carnavalero lleno de alegría por los barrios de la ciudad 9:47 PM Trump impondrá aranceles a México y Canadá a partir de este martes 9:39 PM Tatiana Angulo se bailó el cumbiódromo en su tercer día como reina del Carnaval de Barranquilla 2025 9:27 PM Hombres armados entran al centro de detención El Oasis y ayudan a escapar a siete adolescentes 9:17 PM El llanto también se escuchará por toda la Calle 84 9:11 PM Real Madrid vs. Atlético de Madrid: el derbi de la eterna revancha europea 8:40 PM En Córdoba le piden al Gobierno Nacional agilizar entrega de aulas en Montería 8:40 PM ¿Cómo le ha ido al América en sus últimas visitas al ‘Metro’? 8:16 PM Publicidad Bolívar Recuperan el cuerpo de un joven que estaba desaparecido en Cartagena A propósito de este caso, las autoridades marítimas alertan sobre fuertes vientos y olas de gran altura en el Caribe, por lo que los bañistas deben ser precavidos. noviembre 28, 2023 Publicidad Compartir: Por:   Maria Victoria Bustamante Fernandez La Armada Nacional reportó en la tarde de este martes 28 de noviembre el hallazgo del cuerpo de un joven que había desaparecido desde el pasado domingo 26 de noviembre cuando se registró un siniestro marítimo entre las motonaves 'Nacajo I'  y 'El Shadday', en el sector de Bocachica, zona insular de Cartagena . Lea:  Reanudan audiencia contra capturada por robo en la casa de Silvestre Dangond El hallazgo fue posible porque en horas de la mañana de este martes la comunidad avisó que había visto un cuerpo flotando sobre el mar en inmediaciones de Isla Abanico. Ante ello tripulantes de Guardacostas y de Buceo y Salvamento de la Armada verificaron el área y ubicaron el cuerpo del joven de 20 años, procediendo a asegurar el área para el proceso de identificación, extracción y levantamiento por parte de Policía Judicial en el sector de Bocachica . De interés:  Imponen medida de aseguramiento contra presunto miembro del Clan del Golfo Temas tratados desaparecido cuerpo de joven Cartagena Bolívar Joven desaparecido Noticias relacionadas Locales Un asalto carnavalero lleno de alegría por los barrios de la ciudad Mundo Trump impondrá aranceles a México y Canadá a partir de este martes Publicidad Convierta a EL HERALDO en su fuente de noticias Más de Bolívar Bolívar En Cartagena capturaron a dos hombres que desvalijaban la moto que se habían robado Bolívar Incendio en bodega de reciclaje en Cartagena afectó cuatro viviendas Bolívar Rescatan a 42 turistas luego de que su lancha naufragara en Cartagena Bolívar La Policía de Bolívar aumenta su personal con 66 nuevos uniformados Bolívar Sicarios asesinaron a un hombre de 62 años en un negocio de venta de frutas y verduras en Cartagena Publicidad Suscríbase a nuestro canal de WhatsApp aquí 👉 EL HERALDO Publicidad Te puede interesar Bolívar Juez niega tutela a un taller que buscaba evitar desalojo en Chambacú, en Cartagena Bolívar Investigan causas de un incendio en almacén de cadena, en El Laguito Bolívar Capturan a hombre señalado de abusar sexualmente de su ahijado Bolívar En Cartagena habilitaron carril para descongestionar el tráfico en la Avenida Santander Bolívar Cartagena presentó en Anato la imagen oficial de Semana Santa Bolívar Torre del Reloj de Cartagena se trasladó en réplica a la Vitrina Turística de Anato 2025 Bolívar Dimar investiga hundimiento de embarcación turística con 30 personas a bordo en Cartagena Bolívar En Cartagena inició el desmonte de las últimas casetas del peaje en Mamonal Bolívar San Juan Nepomuceno despidió a fallecidos por intoxicación Bolívar Capturan a un hombre por porte y distribución de drogas en Magangué, Bolívar Publicidad Publica"
