"pdf_path","url","content"
"output/pdfs-2023/1J7507iy1726496604.pdf","https://goo.su/HdP4BE6","[Source: www.dicapi.mil.pe] DICAPI - Dirección General de Capitanías y Guardacostas Organization Historical Review Mission & Vision Organizational Chart General Director Executive Director Technical Supervisor Directions General Direction Aquatic Activities Control Aquatic Environment International Affairs & OMI Coast Guard Operations Maritime Administration Inspections, Audits, and Supervisions Department TUPAM Procedures Regulatory Framework Consultations IFC LATAM PERU es Español Inglés Últimas publicaciones Últimas Publicaciones Correo Web Intranet DICAPI Acceso a Geoportal Correo Web Acceso a Geoportal Home Organization Historical Review Mission & Vision Organizational Chart General Director Executive Director Technical Supervisor Directions General Direction Aquatic Activities Control Aquatic Environment International Affairs & OMI Coast Guard Operations Maritime Administration Inspections, Audits, and Supervisions Department TUPAM Procedures Regulatory Framework Consultations IFC LATAM PERU Organization Historical Review Mission & Vision Organizational Chart General Director Executive Director Technical Supervisor Contact Us Address Constitution St. 150, Callao Digital Office 24 Hours In-person office: 08:00 am - 4:00 pm Telephone 012099300, Extension: 6862 MGP - DICAPI - 2025"
"output/pdfs-2023/1J7507iy1726496604.pdf","https://goo.su/P7GJ","[Source: amazonasnoticias.com.br] Operação conjunta da PF e Ibama destrói centenas de dragas em garimpos ilegais de ouro no Amazonas Ir para o conteúdo Pesquisar Brasil Amazonas Manaus Parintins Esportes Famosos e TV Internacional Política Tribos & Toadas Coluna Em Off Brasil Amazonas Manaus Parintins Esportes Famosos e TV Internacional Política Tribos & Toadas Coluna Em Off Brasil Amazonas Manaus Parintins Esportes Famosos e TV Internacional Política Tribos & Toadas Coluna Em Off Brasil Amazonas Manaus Parintins Esportes Famosos e TV Internacional Política Tribos & Toadas Coluna Em Off Pesquisar Amazonas , Capa-Maior Operação conjunta da PF e Ibama destrói centenas de dragas em garimpos ilegais de ouro no Amazonas Publicado em 31 de agosto de 2023 Uma operação histórica realizada pela Polícia Federal (PF) e pelo Instituto Brasileiro do Meio Ambiente e dos Recursos Naturais Renováveis (Ibama) resultou na destruição de centenas de dragas utilizadas em garimpos ilegais de ouro no estado do Amazonas. As equipes, que partiram de Manaus no último sábado (26), permanecem na região, sem previsão de retorno. Durante as ações, mais de 200 balsas foram encontradas apenas no Rio Madeira, representando a maior destruição de infraestrutura de garimpeiros já realizada no país, de acordo com a PF. Essas balsas eram utilizadas pelos criminosos para a extração ilegal de ouro, causando graves danos ambientais à região. O Ministro da Justiça e Segurança Pública, Flávio Dino, utilizou as redes sociais para comentar sobre a operação e ressaltou o compromisso do Governo Federal em zelar pelo cumprimento das leis em favor das atuais e futuras gerações. Para garantir que as balsas não voltem a ser operadas, elas foram inutilizadas por meio de explosivos. Além disso, os garimpeiros estão sendo expulsos da região, como parte das medidas para combater a atividade ilegal e preservar o meio ambiente. Essa operação conjunta representa um importante passo no combate aos garimpos ilegais de ouro na Amazônia, uma prática que causa sérios danos à floresta e aos rios da região. A destruição das dragas e a expulsão dos garimpeiros são medidas necessárias para proteger o ecossistema e garantir a preservação da maior floresta tropical do mundo. A ação das autoridades demonstra o comprometimento em enfrentar o crime ambiental e reforça a importância de se combater a extração ilegal de recursos naturais. A preservação da Amazônia é fundamental não apenas para o Brasil, mas para todo o planeta, e a destruição das dragas é um passo significativo nessa direção. Tags: dragas , garimpo ilegal , Ibama , Polícia Federal Relacioandos Corpo do segundo jovem afogado no rio Amazonas é encontrado em Parintins 3 de março de 2025 Carnaval na Floresta 2025: Reino Unido da Liberdade é campeã do Grupo Especial em 2025 3 de março de 2025 SES-AM realiza monitoramento contínuo das unidades de urgência e emergência neste Carnaval 3 de março de 2025 Carnailha 2025: Programação da Chave Especial tem blocos em disputa e shows em Parintins 3 de março de 2025 Manaus registra, em fevereiro deste ano, a menor taxa de homicídios em 25 anos 3 de março de 2025 Carnailha 2025: Regulamento da Chave Especial define regras para disputa e critérios de julgamento; veja a ordem de desfile 3 de março de 2025 © 2009 - 2024 Amazonas Notícias [email protected] Host Amazonas - Criação de Sites"
"output/pdfs-2023/1J7507iy1726496604.pdf","https://goo.su/tFCTBhV","[Source: www.cibercuba.com] Voluntarios retiran más de 1,000 libras de basura de la costa en Miami Portada Actualidad Noticias de Cuba Noticias de Miami Entretenimiento Lo más trending hoy Tasa de cambio informal Videos Deportes Archivo de CiberCuba Entrevistas CiberCuba Opinión Cocina Estados Unidos Florida España Cultura Noticias internacionales Lecturas Turismo Historia Naturaleza Salud ES EN FR IT DE PT RU ZH Voluntarios retiran más de 1,000 libras de basura de la costa en Miami Montones de latas de bebidas, botellas y bolsas plásticas, papeles y otros deshechos arrojados por el hombre fueron retirados del litoral. Actualidad Por Redacción de CiberCuba Lunes, 28 Agosto, 2023 - 11:22 Compartir en: Este artículo es de hace 1 año Más de 1,000 libras de residuos y deshechos fueron retiradas de la costa por voluntarios ecologistas de Miami que se movilizaron este domingo para contribuir a la limpieza del entorno marítimo de esta ciudad. “¡Todos los voluntarios de @cleanmiamibeach lo dieron todo ayer! ¡Increíble! ¡1,006 libras de basura y escombros fueron retirados de la costa en Bayfront Park! Estamos más que agradecidos a cada uno de ustedes que se ofrecieron, contribuyeron y apoyaron. Gracias a todos por ayudar a salvar el océano”, dijo en Instagram el sitio de noticias lifestyle_miami . Lo más leído hoy: En un video compartido por ese medio se pudo ver a medio centenar de personas que recorrieron el litoral en Bayfront Park, recogiendo todo tipo de residuos, muchos de ellos latas de bebidas, botellas y bolsas plásticas, papeles y otros deshechos arrojados por el hombre. “¡Dejen de arrojar basura al mar!, pidió la página de sucesos a los residentes en Miami. “Biscayne Bay está muriendo y debemos hacerlo mejor. Cada acción importa. ¡Vamos juntos podemos cambiar la marea!”, concluyó el mensaje de los activistas ecologistas. A finales de mayo, voluntarios ecologistas de Miami se unieron en una ardua jornada de recogida de limpieza costera a lo largo de Julia Tuttle Causeway, donde recolectaron la impresionante cantidad de 4,125 libras de basura . En menos de dos horas, los voluntarios de diversas organizaciones y ciudadanos comprometidos sanearon una extensa área donde acumularon un asombroso volumen de desperdicios sólidos, incluida una rueda de ruleta de casino, según apuntaron las organizaciones convocantes en las redes sociales. Infinidad de plásticos, latas de bebidas, envoltorios de alimentos, colillas de cigarrillos y objetos de gran tamaño, como neumáticos, fueron retirados de la costa. Los esfuerzos de los voluntarios dejan un impacto visible en la limpieza de la playa, pero llaman la atención a todos los ciudadanos sobre la urgencia de cuidar las costas para un futuro más limpio y sostenible. También este fin de semana miembros de la comunidad de Miami demostraron estar comprometidos en hacer frente al problema de la contaminación costera y la protección de la vida marina. VER COMENTARIOS (1) Compartir en: Archivado en: Ecología Medio ambiente Playas de Florida Basura Contaminación Noticias de Miami Internacionales Noticias en 2023 Noticias en Agosto del 2023 Noticias del Lunes, 28 de Agosto del 2023 Redacción de CiberCuba Equipo de periodistas comprometidos con informar sobre la actualidad cubana y temas de interés global. En CiberCuba trabajamos para ofrecer noticias veraces y análisis críticos. ¿Tienes algo que reportar? Escribe a CiberCuba: editores@cibercuba.com +1 786 3965 689 Redacción de CiberCuba Equipo de periodistas comprometidos con informar sobre la actualidad cubana y temas de interés global. En CiberCuba trabajamos para ofrecer noticias veraces y análisis críticos. Más sobre este tema Problemas para Meliá en Cuba: Vertimiento de aguas albañales de hotel amenaza manglares en Trinidad Construyen parques infantiles con neumáticos reciclados en Cuba Mark Zuckerberg se hace ganadero: Sus vacas comen macadamia y beben cerveza Vecinos del Vedado indignados tras tala de cedro histórico por empresa estatal Animalistas protestan frente a Acuario de Miami tras la muerte de la orca Lolita Muere la orca Lolita despues de 50 años en cautiverio en el Acuario de Miami Científicos estudian posibles efectos de la cocaína en tiburones de Florida Activistas vandalizan megayate de 300 millones de la heredera de Walmart 2025-02-04T04:59:01+01:00 Esta Web utiliza cookies propias y de terceros, para mejorar la experiencia de usuario, recopilar estadísticas para optimizar la funcionalidad y mostrar publicidad adaptada a sus intereses. Más información sobre nuestra política de privacidad. Aceptar Siguiente artículo: No hay más noticias que mostrar, visitar Portada"
"output/pdfs-2023/1J7507iy1726496604.pdf","https://goo.su/KpOof","[Source: www.dicapi.mil.pe] DICAPI - Dirección General de Capitanías y Guardacostas Organization Historical Review Mission & Vision Organizational Chart General Director Executive Director Technical Supervisor Directions General Direction Aquatic Activities Control Aquatic Environment International Affairs & OMI Coast Guard Operations Maritime Administration Inspections, Audits, and Supervisions Department TUPAM Procedures Regulatory Framework Consultations IFC LATAM PERU es Español Inglés Últimas publicaciones Últimas Publicaciones Correo Web Intranet DICAPI Acceso a Geoportal Correo Web Acceso a Geoportal Home Organization Historical Review Mission & Vision Organizational Chart General Director Executive Director Technical Supervisor Directions General Direction Aquatic Activities Control Aquatic Environment International Affairs & OMI Coast Guard Operations Maritime Administration Inspections, Audits, and Supervisions Department TUPAM Procedures Regulatory Framework Consultations IFC LATAM PERU Organization Historical Review Mission & Vision Organizational Chart General Director Executive Director Technical Supervisor Contact Us Address Constitution St. 150, Callao Digital Office 24 Hours In-person office: 08:00 am - 4:00 pm Telephone 012099300, Extension: 6862 MGP - DICAPI - 2025"
"output/pdfs-2023/1J7507iy1726496604.pdf","https://goo.su/UKwNzeU","[Source: www.eluniverso.com] 14 inmigrantes fueron detenidos en Florida, luego de que embarcación colisionara contra una de la Policía | Internacional | Noticias | El Universo MENÚ MENÚ Inicia el año mejor informado y más conectado ¡De vacaciones, pero siempre bien informado! Noticias Política Economía Internacional Ecuador Seguridad Informes NOTICIAS Publicidad Ediciones: Guayaquil Quito Tendencias: Resultados de las elecciones Elecciones en Ecuador Partidos de hoy Gastos personales Agenda Internacional 14 inmigrantes fueron detenidos en Florida, luego de que embarcación colisionara contra una de la Policía Los inmigrantes fueron entregados a la Patrulla Fronteriza, añadió la oficina del alguacil. Síguenos en WhatsApp Foto referencial. Barcos de la Guardia Costera de EE. UU. junto con un helicóptero de Aduanas y Protección Fronteriza de EE. UU. participan en el simulacro de migración masiva del Sureste del Grupo de Trabajo de Seguridad Nacional. Foto: AFP Publicidad 25 de agosto, 2023 - 13h21 Actualizado el  25 de agosto, 2023 Un grupo de 14 migrantes fue detenido este viernes después de que la embarcación en que viajaban embistiera a otra de la unidad marítima de la Policía del condado Palm Beach (PBSO), al norte de Miami, Florida (EE.UU.), que intentaba interceptarla, y acabara encallando en una playa de ese lugar, informó la oficina del alguacil. Redacción eluniversocom Recibe las noticias de El Universo desde Google News Publicidad Florida Inmigrantes Inmigración Migración Publicidad Contenidos relacionados ¿A qué edad puedo dejar solo a mi hijo en casa? Leyes de Florida establecen que los hermanos mayores no deben supervisar a los niños Nuevo paquete legislativo en Florida trae leyes que afectan desde la educación hasta la seguridad pública de los inmigrantes ¿De qué trata la propuesta sobre la restricción de remesas en Florida? Inmigrantes no podrían enviar dinero a sus familias Construcciones y cultivos sin mano de obra, el video viral de TikTok que refleja la ausencia de trabajadores en medio de las redadas de deportaciones en Estados Unidos ¿Florida con nieve? Este es el fenómeno inusual que rompió récord de 70 años Varios heridos en Florida, EE.UU., deja el choque de un tren con un carro de bomberos Lo último en Internacional Hermanas recuperan mochila del padre andinista muerto en volcán argentino hace 40 años Donald Trump está abierto a un pacto comercial con Argentina y califica a Javier Milei de ‘gran líder’ Donald Trump anuncia aranceles a las importaciones de productos agrícolas desde el 2 de abril Fallece el excongresista de EEUU Lincoln Díaz-Balart, impulsor de las sanciones a Cuba El papa Francisco sufrió “dos episodios de insuficiencia respiratoria aguda” ¿Cómo está la salud del papa Francisco hoy, lunes 03 de marzo? Publicidad Comparte este artículo Síguenos en WhatsApp ¿Tienes alguna sugerencia de tema, comentario o encontraste un error en esta nota? Repórtalo a la redacción Publicidad Lo último en Noticias Hermanas recuperan mochila del padre andinista muerto en volcán argentino hace 40 años Gobierno firma convenio con el IESS para beneficiar a policías en Playas Empresa del consorcio Sinopetrol confirma adjudicación del contrato de participación del campo Sacha Donald Trump está abierto a un pacto comercial con Argentina y califica a Javier Milei de ‘gran líder’ Así deberá conformarse la comisión interinstitucional para enfrentar la inseguridad que dispuso la Corte Constitucional Publicidad Publicidad Lo último Campeonato Nacional Liga Pro ‘Esa hambre de jugar y sacar mi mejor versión me tiene aquí’, dice Djorkaeff Reasco sobre su traspaso a El Nacional El delantero ecuatoriano quiere encontrar regularidad y sumar varios minutos en el cuadro militar, en el que aspira pelear el título de la Liga Pro. hace 11 minutos Gobierno firma convenio con el IESS para beneficiar a policías en Playas hace 15 minutos ¡La nueva piel del Ponchito! Mushuc Runa presentó una camiseta conmemorativa para la Copa Sudamericana hace 35 minutos Empresa del consorcio Sinopetrol confirma adjudicación del contrato de participación del campo Sacha hace 40 minutos Lifting nutricional de tres días para reducir la hinchazón, mejorar los contornos del rostro y reafirmar la línea de la mandíbula hace una hora Estos son los 44 equipos que participarán en la Copa Sudamericana hace una hora Publicidad Portada Lo Último Noticias Opinión Guayaquil Marcador Entretenimiento La Revista Juegos Tienda Compañía Trabaja con nosotros Quiénes somos Código deontológico Ayuda / Asistencia Contáctenos Suscripciones Publicidad Nuestras marcas Quiosco Digital El Universo Full Clasificados El Club Tienda El Universo © 2025 C.A. EL UNIVERSO. Todos los derechos reservados Políticas de privacidad Según el Art. 60 de la Ley Orgánica de Comunicación, los contenidos se identifican y clasifican en: (I), informativos; (O), de opinión; (F), formativos/educativos/culturales; (E), entretenimiento; y (D), deportivos"
"output/pdfs-2023/1J7507iy1726496604.pdf","https://goo.su/EBPKy","[Source: x.com] JavaScript is not available. We’ve detected that JavaScript is disabled in this browser. Please enable JavaScript or switch to a supported browser to continue using x.com. You can see a list of supported browsers in our Help Center. Help Center Terms of Service Privacy Policy Cookie Policy Imprint Ads info © 2025 X Corp. Something went wrong, but don’t fret — let’s give it another shot. Try again Some privacy related extensions may cause issues on x.com. Please disable them and try again."
"output/pdfs-2023/1J7507iy1726496604.pdf","https://goo.su/xzFcM2t","[Source: www.argentina.gob.ar] Misiones: Prefectura incautó más de 8.700 kilos de soja | Argentina.gob.ar Presidencia de la Nación Pasar al contenido principal Ir a Mi Argentina Buscar Cerrar el buscador Mi Argentina Dejar en blanco Buscar en el sitio Buscar en el sitio Inicio Ministerio de Seguridad Nacional Prefectura Naval Argentina Noticias de la PNA Misiones: Prefectura incautó más de 8.700 kilos de soja Misiones: Prefectura incautó más de 8.700 kilos de soja Personal de la Prefectura Naval Argentina decomisó un cargamento de más de ocho toneladas y media de soja que iban a ser exportados ilegalmente y aprehendió a cinco implicados, en un procedimiento realizado en la localidad misionera de El Soberbio. 31 de agosto de 2023 Compartir en Facebook Compartir en X Compartir en Linkedin Compartir en Whatsapp Compartir en Telegram El hecho ocurrió cuando efectivos de la Fuerza detectaron que se estaban descargando bultos desde un camión hacia una embarcación embicada en la costa, a la altura del kilómetro 1.143,8 del río Uruguay. Al dirigirse al lugar, los prefecturianos lograron aprehender a cinco involucrados y constatar que intentaban contrabandear 186 bolsas de arpillera que contenían 8.740 kilos de granos de soja en su interior. La Fiscalía y el Juzgado Federal de Oberá dispusieron el decomiso de la mercadería, con la intervención de la AFIP. Los implicados quedaron sujetos a la causa. Noticias relacionadas 28 de febrero de 2025 Prefectura fue reconocida por su accionar durante un incendio ocurrido en Santa Fe 27 de febrero de 2025 Orquestas unidas: músicos de la Prefectura Naval Argentina y estudiantes de la Escuela de Berisso compartieron un emocionante concierto 27 de febrero de 2025 Prefectura Naval Argentina y la Coast Guard de EE. UU. refuerzan lazos en ceremonia de ascenso Trámites Turnos Trámites a distancia Atención a la ciudadanía Acerca de la República Argentina Nuestro país Leyes argentinas Organismos Mapa del Estado Acerca de Argentina.gob.ar Acerca de este sitio Términos y condiciones Sugerencias Scroll hacia arriba"
"output/pdfs-2023/1J7507iy1726496604.pdf","https://goo.su/j1qcGSc","[Source: eldia.com.do] Repatrian a RD a 29 migrantes detenidos en aguas Puerto Rico - Publicidad - Cerrar Publicidad NewsLetter search Buscar Portada Nacionales Opinión Económicas Globales Deportes Espectáculos Vida & Estilo Salud Nacionales Económicas Deportes Salud Opinión Columnas Cuentas Claras Director 3.0 Editorial Globales Haití New York Espectáculos Cine & Cartelera El Día Juegos Vida & Estilo A&B Ecoturismo Sociales Robles Más Ciencia y Tecnologia Arte y Literatura Cobertura Especial Coloquios Almuerzo del Grupo Corripio Caricatura Edición Impresa Viralísimas Portada Nacionales Opinión Económicas Globales Deportes Espectáculos Vida & Estilo Salud Nacionales Opinión Todo Columnas Cuentas Claras Director 3.0 Editorial Económicas Globales Todo Haití New York Deportes Espectáculos Todo Cine & Cartelera Vida & Estilo Todo A&B Ecoturismo Sociales Robles Salud Más Ciencia y Tecnologia Arte y Literatura Cobertura Especial Coloquios Almuerzo del Grupo Corripio Caricatura Edición Impresa Viralísimas Newsletter Buscar - Publicidad - Repatrian a República Dominicana a 29 migrantes detenidos en aguas de Puerto Rico Nacionales Por EFE agosto 29, 2023 14:20 | Actualizado en agosto 29, 2023 Migrantes San Juan.- La Guardia Costera estadounidense informó este martes de la repatriación de 29 migrantes a República Dominicana, luego de la interdicción de un barco sobrecargado en aguas del Canal de Mona, frente a la costa oeste de Puerto Rico. La tripulación de un avión HC-144 Ocean Sentry de la Guardia Costera detectó la embarcación sospechosa a aproximadamente cuatro millas náuticas (7,4 kilómetros) al norte de la isla puertorriqueña de Desecheo. El buque Donald Horsley embarcó a 33 migrantes que afirmaban ser dominicanos y un haitiano, y transportó a parte del grupo a aguas territoriales de la República Dominicana, donde se completó la repatriación en la víspera. Cinco de los hombres dominicanos detenidos en este viaje fueron transferidos a agentes de Patrulla Fronteriza porque enfrentan un proceso federal en el Tribunal de Distrito de Estados Unidos en Puerto Rico, según el comunicado de los guardacostas. Están acusados de intento de reingreso ilegal a Estados Unidos, de entrada indebida por parte de un ciudadano no estadounidense y de traer y albergar ilegalmente a migrantes. Desde el 1 de octubre de 2022 hasta el 28 de agosto de 2023, la Guardia Costera ha detenido en aguas de Puerto Rico a 1.965 migrantes, entre ellos 1.675 dominicanos y 264 haitianos. Etiquetas dominicano Migrantes Puerto Rico EFE EFE es la primera agencia de noticias en español y distribuye 3 millones de noticias al año en texto, fotografía, video, audio y multimedia. Artículos Relacionados 11 febrero, 2025 Red estafó residentes en EUA, PR y Europa 4 febrero, 2025 Arrestan a 5 dominicanos que trataron de llegar como polizones en un barco a Puerto Rico 4 febrero, 2025 Dominicanos que se quedaron en EEUU con visa de turistas corren riesgo de deportación, advierte experta en migración - Publicidad - Más leídas 2 March, 2025 Zoe Saldaña hace historia; se lleva el Oscar a mejor ... 3 March, 2025 Juan Pablo Duarte: Todo lo que pudo ser y no fue 2 March, 2025 El papa sigue estable, sin fiebre y sin ventilación ... 3 March, 2025 Vladimir Guerrero Jr. podría ir a parar a casa del enemigo 2 March, 2025 Así lució Zoé Saldaña en la alfombra roja de los ... - Publicidad - Últimas noticias 3 March, 2025 Wall Street cierra con notables caídas al confirmar Trump ... 3 March, 2025 Barbecue habla de diálogo en Haití, pero amenaza con ... 3 March, 2025 Entre política y besos sorpresivos en la boca: 5 momentos ... 3 March, 2025 Abel Martínez rechaza candidato presidencial del PLD sea ... 3 March, 2025 Policía gana oro en ajedrez por equipos en los Juegos ... Fundado el 5 de Marzo de 2002. ¡SÍGUENOS! © El Día 2025 | Todos los derechos reservados Contactos Quiénes somos Políticas de cookies Comercializado por: Digo Network"
