"pdf_path","url","content"
"output/pdfs-2023/1J7507iy1726496604.pdf","https://goo.su/xCeNzp","[Source: www.elnuevodia.com] Guardia Costera interviene con una embarcación cerca de Desecheo en la que viajaban 34 migrantes - El Nuevo Día You need to enable JavaScript to view this site. Opinión Magacín e-Paper Raúl Juliá Newsletters Dark mode Secciones Suscriptores Últimas Noticias Noticias Locales Gobierno Legislatura Política Seguridad Tribunales El Tiempo EE.UU. Washington D. C. Opinión Editorial Columnas Negocios Empresas y Comercios Banca y Finanzas Economía En Pies Cuadrados Turismo Consumo Autos Agro Construcción Entretenimiento SanSe 2025 Películas y series Música Cultura Farándula Televisión Gaming Deportes Béisbol Boxeo Voleibol Tenis Baloncesto Fútbol Otros deportes Magacín Belleza En casa Lujo Realeza Bodas Inspiración y liderazgo Moda Estilos de Vida Salud Bienestar Familia Nutrición y ejercicios Relaciones Mundo Ciencia y Ambiente Flora y fauna Cambio climático Espacio y astronomía Otros Gastronomía Restaurantes Barras y coctelería Recetas De Viaje Cruceros Por la Isla Destinos Parques Temáticos Tecnología Celulares Aplicaciones Redes sociales Otros Juegos Vídeos Fotos English News Business Sports Entertainment Opinion Editorial Podcasts Horóscopos Newsletters Lotería Especiales EXPLORAR BrandStudio e-Paper Suplementos Lotería Shop.pr Oferta Del Día Clasificados Síguenos Login 3 de marzo de 2025 80° lluvia ligera Noticias Seguridad Locales Gobierno Legislatura Política Seguridad Tribunales El Tiempo EE.UU. Washington D. C. Suscriptores PATROCINADO POR Se adhiere a los criterios de The Trust Project Guardia Costera interviene con una embarcación cerca de Desecheo en la que viajaban 34 migrantes Cuatro hombres fueron entregados al Negociado de Aduanas y Protección Fronteriza por infracciones migratorias previas 29 de agosto de 2023 - 2:58 PM Compartir ... Nota de archivo Esta historia fue publicada hace más de 1 año. Se adhiere a los criterios de En la embarcación detenida viajaban unas 34 personas, en su mayoría provenientes de la República Dominicana. ( Information Systems Technician 1st Class Vincent Aguirre ) Por El Nuevo Día Una embarcación en la que viajaban 34 personas fue intervenida por oficiales de la Guardia Costera en la tarde del domingo a unas cuatro millas náuticas del norte de la isla de Desecheo. RELACIONADAS Noticias La Guardia Costera suspende la búsqueda de avioneta perdida entre Culebra y St. Thomas Por José Omar Rolón Martínez Noticias Encuentran con vida a los dos buzos que desaparecieron mientras pescaban cerca de la isla Caja de Muertos Por Richard I. Colón Badillo y José Omar Rolón Martínez Tags Guardia Costera Negociado de Aduanas y Protección Fronteriza República Dominicana Inmigrantes ACERCA DEL AUTOR El Nuevo Día ... Popular en la Comunidad PUBLICIDAD El diario de hoy lunes, 3 de marzo de 2025 PUBLICIDAD De lunes a viernes Boletín A.M. Las noticias explicadas de forma sencilla y directa para entender lo más importante del día. Regístrate a Boletín A.M. Al someter tu correo electrónico, aceptas la Política de Privacidad y Términos y Condiciones de El Nuevo Día. Además, aceptas recibir información u ofertas especiales de productos o servicios de GFR Media, sus afiliadas o de terceros. Podrás optar salirte de los boletines en cualquier momento. Noticias Ver más -> Seguridad Residente de Filadelfia reporta haber sido víctima de “carjacking” en Yauco Actualizado hace 34 minutos Estados Unidos Fallece el excongresista Lincoln Díaz Balart, un impulsor de las sanciones a Cuba Actualizado hace 77 minutos Locales “El número de casos sigue siendo alarmante”: Departamento de Salud reporta la primera muerte por dengue en 2025 Actualizado hace 97 minutos Mundo Japón: incendio forestal causa daños a decenas de hogares y obliga a cientos a evacuar en el noreste Actualizado hace 101 minutos Estados Unidos Líder republicano en Texas quiere ponerle el nombre del estado a un corte de carne Actualizado hace 127 minutos DISPONIBLE EN Google Play DISPONIBLE EN App Store Mi cuenta Suscríbete Newsletters Servicio al cliente ¿Quiénes somos? Contáctanos FAQ El diario de hoy Reglas de concursos Mapa del sitio ¿Por qué confiar en nosotros? Otras marcas de GFR Media Política de privacidad Términos y condiciones Términos y condiciones del suscriptor Correcciones © 2025 GFR Media, Todos los Derechos Reservados. Home Últimas Noticias Secciones Juegos Suscriptores Recibe notificaciones de las noticias más importantes del día. NO, GRACIAS RECIBIR Ups... Nuestro sitio no es visible desde este navegador. Te invitamos a descargar cualquiera de estos navegadores para ver nuestras noticias: Microsoft Edge Google Chrome Firefox Safari"
"output/pdfs-2023/1J7507iy1726496604.pdf","https://goo.su/1qB4OR0","[Source: www.dicapi.mil.pe] DICAPI - Dirección General de Capitanías y Guardacostas Organization Historical Review Mission & Vision Organizational Chart General Director Executive Director Technical Supervisor Directions General Direction Aquatic Activities Control Aquatic Environment International Affairs & OMI Coast Guard Operations Maritime Administration Inspections, Audits, and Supervisions Department TUPAM Procedures Regulatory Framework Consultations IFC LATAM PERU es Español Inglés Últimas publicaciones Últimas Publicaciones Correo Web Intranet DICAPI Acceso a Geoportal Correo Web Acceso a Geoportal Home Organization Historical Review Mission & Vision Organizational Chart General Director Executive Director Technical Supervisor Directions General Direction Aquatic Activities Control Aquatic Environment International Affairs & OMI Coast Guard Operations Maritime Administration Inspections, Audits, and Supervisions Department TUPAM Procedures Regulatory Framework Consultations IFC LATAM PERU Organization Historical Review Mission & Vision Organizational Chart General Director Executive Director Technical Supervisor Contact Us Address Constitution St. 150, Callao Digital Office 24 Hours In-person office: 08:00 am - 4:00 pm Telephone 012099300, Extension: 6862 MGP - DICAPI - 2025"
"output/pdfs-2023/1J7507iy1726496604.pdf","https://goo.su/CWZjI","[Source: caraotadigital.net] ﻿ Panamá intercepta embarcación con 46 venezolanos, traficantes los abandonaron para huir de las autoridades Notificación Font Resizer Aa Inicio Venezuela Venezuela Mostrar Más Saab anunció excarcelación de 110 presos políticos tras protestas postelectorales +Comunicado 3 de marzo de 2025, 5:27 PM Por esquizofrenia e intento de suicidio: Los dos presos políticos excarcelados en las últimas horas 3 de marzo de 2025, 1:59 PM TERROR EN EL AIRE: Hombre intentó abrir compuerta de avión que viajaba de Madrid a Maiquetía 3 de marzo de 2025, 12:07 PM Tras 12 días de oscuridad: Maduro autorizó ingreso de planta eléctrica a la Embajada de Argentina en Caracas 3 de marzo de 2025, 9:32 AM Padre de tiktoker de 16 años detenida por burlarse de la muerte de una persona con cáncer pidió audiencia con el fiscal Saab 2 de marzo de 2025, 5:10 PM Mundo Mundo Mostrar Más Salud del papa Francisco se debilita: Sufrió episodios de insuficiencia respiratoria aguda 3 de marzo de 2025, 5:58 PM «Camino a las Bahamas con Sara»: Los perturbadores mensajes del femicida de la venezolana en Chile en sus redes sociales 3 de marzo de 2025, 3:41 PM Los países donde se puede pagar una «Visa Dorada» como la de Trump, muchos son de América Latina 3 de marzo de 2025, 1:27 PM EN VIDEO: Depravado amarró y abusó a niña de 9 años al engañarla con un helado, una turba enfurecida lo asesinó 3 de marzo de 2025, 10:29 AM Departamento del Tesoro de EEUU anunció que se «prepara» para revocar las licencias petroleras concedidas a Venezuela 2 de marzo de 2025, 2:10 PM USA Sucesos Caraota Show Caraota Show Mostrar Más «Soy una orgullosa hija de inmigrantes»: El discurso viral de Zoe Saldaña tras ganar el Oscar por Emilia Pérez 3 de marzo de 2025, 11:21 AM La razón por la que Shakira debió cancelar un nuevo concierto de su accidentada gira 2 de marzo de 2025, 6:45 PM El diagnóstico médico por el que Harrison Ford debió suspender su participación en los Óscar 2025 de este 2Feb 2 de marzo de 2025, 5:46 PM VIDEO: Lasso estuvo presente en clausura de Viña del Mar cantando con Sebastián Yatra 2 de marzo de 2025, 4:19 PM La millonaria herencia que recibirán los hijos del legendario actor Gene Hackman tras su extraña muerte 1 de marzo de 2025, 3:20 PM Deportes Tendencias Cripto Caraota Tips Mis Favoritos Únete Buscar Lectura: Panamá intercepta embarcación con 46 venezolanos, traficantes los abandonaron para huir de las autoridades Compartir Font Resizer Aa Venezuela Mundo Sucesos Caraota Show Deportes Tendencias Cripto Caraota Tips Buscar Inicio Inicio Categorías Venezuela Mundo Sucesos Caraota Show Deportes Tendencias Cripto Caraota Tips Link Extras Mis Favoritos Sitemap ¿Tienes una cuenta existente? Inicia Sesión Síguenos Advertise © 2022 Caraota Digital. Todos los derechos reservados Mundo Panamá intercepta embarcación con 46 venezolanos, traficantes los abandonaron para huir de las autoridades Por Jhoan Melendez Publicado 27 de agosto de 2023, 7:58 PM 3 Min de Lectura Compartir 3 Min de Lectura Foto: Senafront Panamá Compartir Las autoridades de Panamá localizaron una embarcación con 46 ocupantes venezolanos y cinco ecuatorianos, los cuales fueron abandonados por una red de trata de personas para intentar escapar de los funcionarios de ese país. Tabla de Contenido LEA TAMBIÉN: TRATA DE PERSONAS: EL GRAVE DELITO QUE CRECE EXPONENCIALMENTE AÑO TRAS AÑO EN EL PAÍS PROBLEMÁTICA EN AUMENTO A través de Twitter (X), el Servicio Nacional de Fronteras (Senafront) informó que el bote era una lancha rápida. Una patrulla del organismo la detectó en el litoral Caribe de Guna Yala, una comarca indígena fronteriza con Colombia. Leer Más Las impactantes imágenes aéreas del accidente que involucró 158 vehículos en EEUU, van siete muertos EN VIDEO: Rescatan a un migrante venezolano en el Darién, se fracturó ambas piernas Estado Islámico se atribuye el tiroteo y explosión en una sala de conciertos en Moscú Carlos Reyes, ejecutivo del Tercer Batallón Puerto Obaldía del Senafront, narró cómo ocurrieron los hechos. En su relato, los efectivos policiales intentaron detener la embarcación, pero esta emprendió la huida. LEA TAMBIÉN: TRATA DE PERSONAS: EL GRAVE DELITO QUE CRECE EXPONENCIALMENTE AÑO TRAS AÑO EN EL PAÍS Finalmente, el bote terminó encallando en una playa cercana. Los traficantes de personas lograron adentrarse en la selva antes que las autoridades pudieran arrestarlos. Hasta los momentos se desconoce cuántos sujetos eran, reseñó Frontera Viva. Foto: Senafront Panamá Por ahora, los agentes de seguridad realizan un operativo de búsqueda para dar con los delincuentes. Asimismo, para desmantelar las actividades que guarden relación con el tráfico ilícito de migrantes. Debido al impacto de la lancha al encallar en la playa ubicada en el corregimiento de Tubualá, al menos 10 de los migrantes tuvieron que recibir atención médica. Esto se debe a que sufrieron algunas heridas. Unidades del Batallón Puerto Obaldia, en conjunto con unidades de la Dirección de Inteligencia, interceptar"
"output/pdfs-2023/1J7507iy1726496604.pdf","https://goo.su/JjxG0q","[Source: www.dicapi.mil.pe] DICAPI - Dirección General de Capitanías y Guardacostas Organization Historical Review Mission & Vision Organizational Chart General Director Executive Director Technical Supervisor Directions General Direction Aquatic Activities Control Aquatic Environment International Affairs & OMI Coast Guard Operations Maritime Administration Inspections, Audits, and Supervisions Department TUPAM Procedures Regulatory Framework Consultations IFC LATAM PERU es Español Inglés Últimas publicaciones Últimas Publicaciones Correo Web Intranet DICAPI Acceso a Geoportal Correo Web Acceso a Geoportal Home Organization Historical Review Mission & Vision Organizational Chart General Director Executive Director Technical Supervisor Directions General Direction Aquatic Activities Control Aquatic Environment International Affairs & OMI Coast Guard Operations Maritime Administration Inspections, Audits, and Supervisions Department TUPAM Procedures Regulatory Framework Consultations IFC LATAM PERU Organization Historical Review Mission & Vision Organizational Chart General Director Executive Director Technical Supervisor Contact Us Address Constitution St. 150, Callao Digital Office 24 Hours In-person office: 08:00 am - 4:00 pm Telephone 012099300, Extension: 6862 MGP - DICAPI - 2025"
"output/pdfs-2023/oTbXEbWy1726517068.pdf","https://goo.su/XVQ9","[Source: www.lacuarta.com] Pescador tuvo que lanzarse al mar tras sufrir robo en Coquimbo | Crónica MENÚ CHILE ESPECTÁCULOS DEPORTES TENDENCIAS MUNDO SERVICIOS URBANA KPOP EMPRENDIMIENTO CONSTRUCTOR COMERCIANTE INICIO SECCIONES CHILE ESPECTÁCULOS DEPORTES TENDENCIAS MUNDO SERVICIOS URBANA KPOP EMPRENDIMIENTO CONSTRUCTOR COMERCIANTE TEMAS Policial Redes Sociales Televisión Música Urbana Salud En las redes Crónica / Policial Pescador tuvo que lanzarse al mar tras sufrir robo en Coquimbo Playa changa LEE TAMBIÉN Espectáculos Qué fue de “Gaby” de BKN: El presente de Camila López y a lo que se dedica Daniela Ramirez Meneses hace 12 horas Tendencias “Qué es hueón este otro”: joven se hace viral por celebrar el funeral de una mascota Marco Oyarzún 28-02-2025 Chile El Zafrada: De niño símbolo del terremoto a la funa en redes sociales Axel Christiansen Z. 27-02-2025 VER MÁS LO ÚLTIMO Deportes Revelan el primer confirmado para los próximos partidos de La Roja por Eliminatorias Bastián Escalona Ampuero hace 12 minutos Chile “Con mi hijo recién nacido y aún hospitalizada”: Karol Cariola habla tras sorpresivo allanamiento de la PDI Erasmo Tauran hace 37 minutos VER MÁS Facebook Twitter Whatsapp El hecho fue grabado por un testigo que estaba cerca de Playa Changa. Rubith Morales Painepi jueves, 30 de noviembre de 2023 15:54 hs Durante la jornada de este jueves, un pescador sufrió un robo en Coquimbo y tuvo que lanzarse al mar en consecuencias de la situación. Este impactante hecho quedó grabado en un video que realizó un testigo, quien a las 7:30 horas aproximadamente vio a la víctima del hecho que estaba pescando a la orilla del mar en Playa Changa , cuando fue abordado por tres individuos. En el clip se ve como el afectado está siendo brutalmente agredido con palos , para posteriormente ver como los ladrones roban su ropa, así indicó 24 Horas. Lo más insólito del caso, es que los delincuentes obligaron a un hombre a ingresar al mar, para que ellos pudieran escapar tranquilamente. El alcalde Coquimbo lamentó la situación Ante el hecho, el alcalde de Coquimbo, Alí Manouchehri alzó la voz y lamentó la situación y señaló que  “son situaciones complejas que están pasando en distintas áreas”. “ Hacemos un llamado a la organización, poder recibir recursos, herramientas y tecnologías ”, e indicó que quieren que “ haya más personal para cubrir todos los requerimientos” , sentenció. Leer más en La Cuarta: - “Ella era diputada” y “¡Dejen de reírse de la gente!”: JC Rodríguez furia por defensa de Andrea Molina por Caso Audios - “No me gusta inspirar lástima”: la pregunta que quebró en vivo a Mauricio Medina Temas Relacionados Policial Nacional Coquimbo Pescador Robo COMPARTIR NOTA Facebook Twitter Whatsapp MÁS DE CRÓNICA Chile “Arráncate, di que fue un animal”: los crudos antecedentes tras muerte de universitarias por choque de conductor ebrio Chile “¡Tenía un cuchillo!”: Graban tenso momento que vivió un equipo del matinal Mucho Gusto en Maipú Chile Insólito: intentan ingresar sopaipillas rellenas con droga en el Complejo Penitenciario de Puerto Montt Chile Partido Republicano pide apurar la “prisión preventiva” para Daniel Jadue y “evitar su fuga” TE PUEDE INTERESAR Espectáculos ¿Quién es Juan Pablo López? Fue el “más desconocido” en 2017 y volverá como un consagrado del humor a la Quinta Vergara Daniela Ramirez Meneses Tendencias La aterradora historia detrás del viral “Perdónenme todos, no acepto” Paloma Pareja Espectáculos Marlen Olivari y su “Marlenazo” que generó teorías conspirativas en el Festival de Viña Paulo Quinteros Espectáculos “Yo me voy a ir” y “roto picante”: los detalles del recordado “desaire” de Alejandro Goic a Patricia Maldonado que remeció el Mucho Gusto Juan Carlos Muñoz C. VER MÁS PORTADA Chile “Con mi hijo recién nacido y aún hospitalizada”: Karol Cariola habla tras sorpresivo allanamiento de la PDI Erasmo Tauran hace 37 minutos Chile “Se me ocurrió una idea”: Filtran los chats entre Karol Cariola e Irací Hassler que estarían bajo la lupa de Fiscalía Erasmo Tauran hace una hora Espectáculos “Cómo podemos ser tan ordinarios”: los descargos de Rodrigo Sepúlveda tras fallida presentación de Shakira en Chile Bastián Escalona Ampuero hace una hora Espectáculos “Casi 14 años y…”: la opinión de hermana de Felipe Camiroaga tras mención de Pedro Ruminot en Festival de Viña Juan Carlos Muñoz C. hace 6 horas VER MÁS SUBIR ¿Quiénes Somos? | Declaración de intereses | Canal de Denuncias | Contacto Comercial | Contacto | Términos y Condiciones | Política de Privacidad | Código de Ética | Tarifas Publicidad Electoral © 2025 La Cuarta. Todos los derechos reservados."
"output/pdfs-2023/oTbXEbWy1726517068.pdf","https://goo.su/Z79mG6","[Source: www.facebook.com] Redirecting..."
"output/pdfs-2023/oTbXEbWy1726517068.pdf","https://goo.su/IFyX5L","[Source: zonacero.com] Incautan cargamento de cocaína y marihuana avaluado en 2 millones de dólares en San Andrés | ZONA CERO Pasar al contenido principal Menú Subscribe block header Suscribirse User account menu Mostrar — User account menu Ocultar — User account menu Iniciar sesión Iniciar sesión Main navigation Mostrar — Main navigation Ocultar — Main navigation Home Secciones Destacados Zona Cero La Zona Radio Main navigation Mostrar — Main navigation Ocultar — Main navigation Home Secciones Generales Mundo Podcast Política Sociales Eventos Deportes Tecnología Multimedia Judiciales Opinión Destacados Barranquilla Atlántico Colombia Zona Caribe Síguenos Mostrar — Síguenos Ocultar — Síguenos Facebook Twitter YouTube Instagram Palabras clave Título de la noticia Contenido de la noticia Autor Categoría - Cualquiera - Cultura Entretenimiento Generales Jorge Cura La zona radio Show de Joselo Zona de profundidad Sociales Política Deportes Judiciales Mundo Tecnología Tipo de contenido - Cualquiera - Artículos Solo artículos con video Podcasts Ordenar por Authored on Antiguos Authored on Recientes Relevancia Antiguos Relevancia Recientes Sobrescribir enlaces de ayuda a la navegación Inicio Judiciales Incautan cargamento de cocaina y mari... X La Armada y la Policia mostraron la droga incautada en San Andrés Foto Armada de Colombia Zona Cero @zonacero 26 de Noviembre de 2023 9:11 pm Share: Judiciales Incautan cargamento de cocaína y marihuana avaluado en 2 millones de dólares en San Andrés En operativo de Guardacostas de San Andrés y Compañía Antinarcóticos de la Policía. En desarrollo de una operación coordinada entre Unidades de Guardacostas de la Armada de Colombia y la Policía Antinarcóticos , se logró la incautación de 54,1 kilogramos de clorhidrato de cocaína y 48,7 kilogramos de marihuana, avaluados en 2 millones de dólares en el mercado ilegal. La droga estaba al interior de una motonave de bandera colombiana. El alijo fue descubierto durante una inspección al interior de los cuartos fríos de la embarcación que se encontraba atracada en la isla. El informe reveló que fueron hallados 128 paquetes sospechosos, los cuales fueron puestos a disposición de personal del Cuerpo Técnico de Investigación -CTI- de la Fiscalía General de la Nación. La Prueba de Identificación Preliminar Homologada –PIPH-, arrojó positivo para clorhidrato de cocaína con un peso de 54,1 kilogramos y marihuana con un peso de 48,7 kilogramos. Con la incautación, se evitó la comercialización de 143 mil dosis de narcóticos en el mundo, revelaron los investigadores. Más sobre este tema: Etiquetas Zona Caribe cargamento de droga San Andrés Armada de Colombia Noticias recientes Article Sociales El Rey Momo, Gabriel Marriaga desfiló en la Vía 40 rindiendo homenaje a la vida hace 49 minutos Article Sociales Tatiana, una “reina bacana”, que llenó de fantasía el Cumbiódromo de la Vía 40 hace 1 hora Article Judiciales A la cárcel alias ‘Diablito’, presunto integrante del ‘Clan del Golfo’ en Atlántico hace 1 hora Regístrate aquí para recibir nuestros boletines informativos Email The subscriber's email address. Footer Mostrar — Footer Ocultar — Footer SECCIONES Generales Mundo Podcast Política Sociales Eventos Deportes Tecnología Multimedia Judiciales Opinión DESTACADOS Barranquilla Atlántico Zona Caribe Colombia Síguenos Mostrar — Síguenos Ocultar — Síguenos Facebook Twitter YouTube Instagram Legales footer Mostrar — Legales footer Ocultar — Legales footer Nosotros Contacto Términos y condiciones Política de privacidad Zonacero.com | Todos los derechos reservados Calle 82 # 55-55 - Oficina 310. Barranquilla, Colombia Desarrollado por"
