"pdf_path","url","content"
"output/pdfs-2023/oTbXEbWy1726517068.pdf","https://goo.su/UdrOz","[Source: www.sandiegouniontribune.com] Ecuador: tres detenidos tras decomiso de 5 toneladas de drogas en zona maritima cercana a Galapagos – San Diego Union-Tribune Skip to content All Sections 60°F Monday, March 3rd 2025 e-Edition Home Page Close Menu About Us About Us Our Journalism Community Advisory Board Contact the Newsroom eNewspaper The San Diego Union-Tribune Carmel Valley News Del Mar Times Encinitas Advocate La Jolla Light PB Monthly Point Loma OB Monthly Poway News Chieftain Ramona Sentinel Rancho Bernardo News Rancho Santa Fe Review Solana Beach Sun Columnists Nick Canepa Lisa Deaderick Tom Krasovic Bryce Miller Michael Smolens News Local News Border & Baja California Crime and Public Safety Courts Education Environment Health Immigration Local Politics Military National News National Politics Politics Science Transportation Watchdog World News Local News San Diego County San Diego North County East County South County Business Business Biotech Growth & Development Economy Energy Real Estate Restaurants, Food and Drink Technology Tourism Best Reviews Opinion Opinion Community Voices Commentary Editorials Letters to the Editor Editorial Board Sports Sports SDSU Aztecs San Diego Padres San Diego FC San Diego Wave FC High School Sports Chargers/Rams Toreros San Diego Gulls Golf Fantasy Sports Things to do Things to do Amusement Parks Arts Books Casinos Puzzles Recipes Home and Garden Movies Music and Concerts Restaurants, Food and Drink Theater Travel TV and Streaming UT Store Weather U-T En Español Del Mar Times Encinitas Advocate La Jolla Light Pacific San Diego PB Monthly Point Loma OB Monthly Pomerado News Rancho Santa Fe Review Ramona Sentinel U-T Community Press Del Mar Times Encinitas Advocate La Jolla Light PB Monthly Point Loma OB Monthly Pomerado News Ramona Sentinel Rancho Santa Fe Review Pacific San Diego Together San Diego Obituaries Obituaries News Obituaries Place an Obituary Comics and Games Subscriber Services Manage Subscription EZ Pay Vacation Stop Delivery Issue Sponsored Content The T.E.A. Advertise with Us Close Menu Get the latest news in your inbox! Sign Up Espanol | Ecuador: tres detenidos tras decomiso de 5… Share this: Click to share on Twitter (Opens in new window) Click to share on Facebook (Opens in new window) Click to print (Opens in new window) Click to email a link to a friend (Opens in new window) Click to share on Reddit (Opens in new window) Subscribe Login Account Settings Contact Us Log Out Spoof a user Get the latest news in your inbox! Sign Up Subscribe Login Search 60°F Monday, March 3rd 2025 e-Edition Espanol Trending: Espanol | 📽️ Oscars: The winners Espanol | 🔌 Battle over electric vehicles Espanol | 👠 Oscars: Red carpet fashion Espanol | 📈 Another teen flu death Espanol | ☀️ Rady Shell summer season Espanol Espanol | Ecuador: tres detenidos tras decomiso de 5 toneladas de drogas en zona maritima cercana a Galapagos Share this: Click to share on Twitter (Opens in new window) Click to share on Facebook (Opens in new window) Click to print (Opens in new window) Click to email a link to a friend (Opens in new window) Click to share on Reddit (Opens in new window) By Associated Press | ap@dfmdev.com UPDATED: November 24, 2023 at 11:05 PM PST QUITO QUITO — Unas cinco toneladas de drogas fueron decomisadas en un semisumergible hallado en una zona marítima de Galápagos, informaron el viernes las Fuerzas Armadas de Ecuador. El hallazgo se produjo durante una operación en la Zona Económica Exclusiva en el área insular, señalaron las Fuerzas Armadas en la red social X, antes Twitter. Galápagos está ubicada en el océano Pacífico a unos 1.000 kilómetros de distancia del territorio continental ecuatoriano. La Armada también informó en un comunicado emitido la tarde del viernes que el cargamento hallado en el semisumergible de tres motores contenía 178 bultos. Agregó que producto de la operación, realizada 150 millas al sur de las islas Galápagos, se aprehendió a tres ciduadanos de nacionalidad colombiana, quienes fueron puestos a disposición de las autoridades correspondientes. Según informó la institución a The Associated Press, la captura se realizó la víspera y los narcóticos fueron trasladados a puerto Baquerizo Moreno, en la Isla San Cristóbal. A inicios de octubre la policía de Ecuador informó el decomiso de un cargamento de 14 toneladas de cocaína en al menos ocho provincias. La droga provenía de una zona de producción del Putumayo, en el sur colombiano, y su destino era Centroamérica, Estados Unidos y Europa. En 2022 otra embarcación similar fue encontrada a unas 120 millas al sureste de Galápagos. En aquella oportunidad el cargamento decomisado fue de dos toneladas en un operativo que dejó cuatro detenidos, tres de nacionalidad colombiana y un ecuatoriano. Según cifras oficiales, entre mayo de 2021 y noviembre de 2023 se han decomisado unas 560 toneladas de drogas en el país andino, lo que implica un récord que lo ubica entre los países con mayor incautación. En 2022 se decomisaron 201 toneladas"
"output/pdfs-2023/oTbXEbWy1726517068.pdf","https://goo.su/EtSARSY","[Source: www.bluradio.com] Denuncian ataques y amenazas a embarcaciones que transportan hidrocarburos por el río Magdalena - BluRadio Publicidad Publicidad Publicidad En vivo Señal visual radio Entrada de búsqueda Enviar búsqueda Programación Nación Bogotá Política Economía Especiales Deportes Empleos Mundo Cotidiano Últimas Noticias Cultura Entretenimiento Motor Tecnología Regiones Medio Ambiente Síguenos en:: whatsapp youtube facebook instagram twitter Tendencias: Filtración Papá Pitufo Shakira Salud de papa Francisco Premios Óscar whatsapp youtube facebook instagram twitter Publicidad Reciba notificaciones de Blu Radio para tener las principales noticias de Colombia y el mundo. No activar Activar Blu Radio /  Regiones /  Santanderes /  Denuncian ataques y amenazas a embarcaciones que transportan hidrocarburos por el río Magdalena Denuncian ataques y amenazas a embarcaciones que transportan hidrocarburos por el río Magdalena Cinco embarcaciones fueron atacadas a tiros por hombres armados en el río Magdalena, cuando realizaban el trayecto entre Barrancabermeja y Barranquilla. Río Magdalena. Dimar. Por:  Redacción BLU Radio Santander | 29 de Noviembre, 2023 Facebook Twitter Whatsapp Actualizado: noviembre 29, 2023 09:45 a. m. El terror se apodero entre los transportadores de hidrocarburos a través del río Magdalena desde la refinería de Barrancabermeja hacia Cartagena y Barranquilla, por los cinco ataques a bala contra embarcaciones que se han presentado en los últimos días. Las empresas navieras denunciaron que hombres armados han disparado contra las embarcaciones entre los municipios de San Pablo y Pinillos, en el sur de Bolívar . “Hay un grupo armado que se denomina Autodefensas Gaitanistas y que desde hace una semana está atacando con fusil a los remolcadores de varias navieras que van navegando por el río Magdalena en el sur de Bolívar. Eso ha generado una angustia por parte de las navieras. Además, hombres armados han amedrantado a los tripulantes y han entregado panfletos amenazantes, poniendo el riesgo el transporte de carga e hidrocarburos por el río"", afirmó Juan Pablo Remolina, presidente de Prosantander. Publicidad La Asociación Colombiana del Petróleo y Gas (ACP) rechazó las amenazas y ataques que grupos al margen de la ley han realizado en contra de empresas que transportan hidrocarburos por el río Magdalena. “Dichos hechos violentos han puesto en riesgo la vida no solo de las personas que trabajan en esta actividad fundamental para garantizar el abastecimiento de los energéticos en el país, sino también de las comunidades aledañas, en una violación contundente a los derechos humanos”, dice el comunicado de la ACP. Comunicado ACP: Publicidad En poblaciones del río Magdalena circula un panfleto del Clan del Golfo amenazando a las empresas navieras. Las empresas fluviales que utilizan para transportar mercancías e hidrocarburos por el río Magdalena desde Barrancabermeja hicieron un llamado a las autoridades para que se garantice la seguridad e integridad de quienes trabajan en estas operaciones y de las comunidades vecinas. Le puede interesar: Publicidad Únase a nuestro canal de Whatsapp y manténgase al tanto de los hechos más relevantes. ✔️ Síganos en Google Noticias con toda la información de Colombia y el mundo. Relacionados Blu Radio Noticias de hoy Barrancabermeja Ecopetrol Refinería Agencia Nacional de Hidrocarburos Río Magdalena Publicidad Lo más reciente Blog Deportivo Millonarios vence a Deportes Tolima: 03 de marzo 2025 - Blog Deportivo, programa completo Meridiano BLU Papa enfrenta nueva crisis de salud: 03 de marzo de 2025 - Meridiano Blu, programa completo Mañanas BLU 10:30 Legalización de la venta de marihuana: Mañanas Blu, Camila Zuluaga, 03 de marzo 2025 Mañanas BLU Colombia resalta en los premios Óscar: Mañanas Blu, lunes 03 de marzo de 2025 Educación Cambridge abre más de 25 cursos gratuitos para colombianos: fechas y cómo inscribirse Publicidad close Publicidad Síguenos en: whatsapp facebook instagram twitter Más contenido en youtube-footer Descarga nuestra app en Descarga nuestra app en Red de portales Noticias Caracol Caracol Televisión Gol Caracol La Kalle HJCK DiTu El Espectador Teatro Mayor Caracol Internacional Caracol Corporativo Caracol Next Servicios Corporativos Servicio al televidente Defensor del televidente TDT Código del buen gobierno Contáctanos Clientes y proveedores Paute con nosotros Mapa del sitio Legal Condiciones de acceso a la red Responsabilidad corporativa Política de tratamiento de la información Política de cookies Términos y condiciones El uso de este sitio web implica la aceptación de los Términos y condiciones y Políticas de Tratamiento de la Información de CARACOL TELEVISIÓN S.A. Todos los Derechos Reservados D.R.A. Prohibida su reproducción total o parcial, así como su traducción a cualquier idioma sin autorización escrita de su titular. Reproduction in whole or in part, or translation without written permission is prohibited. All rights reserved 2025. Miembro de:"
"output/pdfs-2023/oTbXEbWy1726517068.pdf","https://goo.su/N19Lzm","[Source: www.primicias.ec] Tres detenidos tras incautación de una tonelada de cocaína en San Cristóbal, Galápagos Suscríbete a nuestras notificaciones para recibir las últimas noticias y actualizaciones. Lo Último Temas: Daniel Noboa Luisa González Asamblea Elecciones 2025 Donald Trump Lunes, 3 de marzo de 2025 Home Lo Último Política Elecciones Ecuador 2025 Economía Empresas Reputación en Acción Seguridad Sucesos Caso Metástasis Quito Guayaquil Jugada #Eldeportequequeremos Eliminatorias Mundial 2026 Tabla de posiciones LigaPro 2025 Tabla de posiciones Eliminatorias Mundial 2026 Sociedad Censo Ecuador Trending TV y Streaming Música Gastronomia Cine Cultura Firmas Internacional NEWSLETTER Juegos Telegram X Twitter × Telegram X Twitter Lo Último Política Elecciones Ecuador 2025 Economia Empresas Reputación en Acción Seguridad Sucesos Caso Metástasis Quito Guayaquil Jugada LigaPro Fútbol La Tri Tabla de posiciones LigaPro 2024 Más deportes Ciclismo Eliminatorias Mundial 2026 #Eldeportequequeremos Juegos Olímpicos 2024 Sociedad Censo Ecuador Trending TV y Streaming Música Gastronomia Cine Cultura Ciencia y Tecnología Firmas Internacional Juegos Videos Activar Notificaciones Desactivar Notificaciones NEWSLETTERS Sucesos Tres detenidos tras incautación de una tonelada de cocaína en San Cristóbal, Galápagos Con ayuda de guardacostas de Estados Unidos, la Policía y la Armada incautaron 32 bultos de cocaína, a 588 millas de la isla Wolf, en las islas Galápagos. Paquetes de cocaína incautados en una operación en Galápagos, el 29 de noviembre de 2023. Armada Nacional Autor: Redacción Primicias Actualizada: 29 nov 2023 - 11:51 Compartir: X Twitter Telegram ÚNETE A NUESTO CANAL Un nuevo decomiso de cocaína se efectuó en el archipiélago de Galápagos , donde la Policía y la Armada detectaron 32 bultos con cocaína en la isla San Cristóbal, la madrugada de este 29 de noviembre de 2023. Según información preliminar de la Policía, la droga estaba camuflada en sacos de tela y fue detectada inicialmente durante un patrullaje de la Armada de Ecuador en el mar de las islas. Por su parte, la Armada señaló que la intervención se realizó a 588 millas de la isla Wolf , en el noroeste del archipiélago, y gracias a la ayuda de guardacostas de Estados Unidos. En total, lo decomisado asciende a una tonelada de cocaína que se transportaba a bordo de una lancha rápida. Cada paquete de cocaína estaba marcada con siglas y logos especiales como la palabra 'Gucci' o 'Comandante'. Por esta operación hay tres detenidos, todos de nacionalidad ecuatoriana. En las últimas semanas, Galápagos ha copado los titulares de los medios por los hallazgos de droga en alta mar, incluso se detectó un narcosubmarino con 3,4 toneladas de cocaína. Mientras que el pasado 20 de noviembre, las autoridades incautaron un arsenal de armas en la isla San Cristóbal, en un hecho por el que aún no hay detenidos. #narcotráfico #Islas Galápagos #San Cristóbal #Armada Nacional #decomiso de cocaína Compartir: X Twitter Telegram Noticias Relacionadas Sucesos Dramática liberación de dos secuestrados en Guayas, tras balacera en el sector de Churute, Guayaquil Leer más » Sucesos Enfrentamiento armado en Puerto El Carmen, Sucumbíos, deja dos heridos durante un evento por carnaval Leer más » Sucesos Macabro hallazgo en Guayaquil: Un cuerpo decapitado flotaba en el estero y su cabeza estaba en un saco Leer más » Sucesos Un policía murió en Esmeraldas tras abatir a dos presuntos asesinos Leer más » Sucesos Acción policial en Manabí permite detener a 13 presuntos miembros de Los Choneros y Los Lobos Leer más » Sucesos Ecuatoriano miembro de Los Lobos y con notificación de Interpol es detenido en Colombia Leer más » Sucesos Cuenca: Cinco personas mueren por el choque de un bus sin frenos en Sayausí, el vehículo no tenía permiso de circulación Leer más » Sucesos Alias ‘Garzón’, supuesto miembro de Los Tiguerones, fue detenido por la Policía en Santa Elena Leer más » LO Último 01 EN VIVO | Mire aquí Independiente del Valle vs. Cerro Porteño por la Copa Libertadores Sub 20 02 Caso Purga: Jueza sentencia a 13 años de prisión a Pablo Muentes, Fabiola Gallardo y a Johann Marfetán 03 En Salinas, ""no hay dónde poner un pie"" por el feriado de carnaval en Santa Elena 04 Este es el balance de las autoridades de Ecuador sobre el devastador invierno en la provincia de El Oro 05 A horas del Miércoles de Ceniza, el papa Francisco sufre dos episodios de insuficiencia respiratoria aguda Esta página web usa cookies Las cookies de este sitio web se usan para personalizar el contenido y los anuncios, ofrecer funciones de redes sociales y analizar el tráfico. Además, compartimos información sobre el uso que haga del sitio web con nuestros partners de redes sociales, publicidad y análisis web, quienes pueden combinarla con otra información que les haya proporcionado o que haya recopilado a partir del uso que haya hecho de sus servicios. Puede revisar nuestra política de privacidad y tratamiento de datos . Aceptar todo Telegram X Twitt"
"output/pdfs-2023/oTbXEbWy1726517068.pdf","https://goo.su/oCKk","Error: HTTP 404"
"output/pdfs-2023/oTbXEbWy1726517068.pdf","https://goo.su/g0aVVal","[Source: www.ensenada.net] Se hundió en Ensenada el sardinero Maranathá 2 - Ensenada.Net Publicidad | Contacto | | | | Tipo de Cambio Compra Venta 03/03/2025 $19.78 $20.14 Portada Noticias Casas y Depas Clasificados Entretenimiento Hoy es 3 de marzo de 2025 :: 2:07 pm Buscar en noticias Las Más Recientes Los Pelos de la Mula Sondeo Reportajes Nota Roja Se hundió en Ensenada el sardinero Maranathá 2 Frente a las costas de Eréndira, sus tripulantes a salvo Nota publicada el 24 de noviembre de 2023 por Elizabeth Vargas Un buque sardinero el Maranathá 2 se hundió la tarde del jueves 23 de noviembre en las costas de Baja California, frente a la delegación de Eréndira, 100 kilómetros al sur de la ciudad de Ensenada. Datos obtenidos por Ensenada Net, indican que el buque propiedad de la empresa Atunes y Sardinas de México, es una embarcación de 22.8 metros de eslora, con Matrícula 02015183235 y base en el Puerto de Ensenada, se volcó cuando realizaba maniobras para cargar sardina que acababa de pescar frente a las costas. El buque con 9 tripulantes a bordo que resultaron ilesos, alcanzó a pedir ayuda cuando la pluma que jalaba la carga empezó a inclinarse sobre su costado hasta volcarse y hundirse. Una embarcación de nombre Consuelo del Mar, fue la primera en llegar al sitio del accidente para rescatar a la tripulación que fue posteriormente trasladada a otra nave el Baja Sea que los llevó hasta El Sauzal donde fueron desembarcados. El hundimiento de la nave se registró alrededor de las 13:30 horas del jueves, sin embargo, autoridades de Armada de México y Capitanía de Puerto habrían recibido el aviso del accidente hasta las 18:00 horas. Al parecer una maniobra mal realizada fue la que provocó el hundimiento del sardinero el cual deberá ser investigado por las autoridades correspondientes. Este viernes daban inicio las primeras investigaciones sobre dicho hundimiento para determinar las causas del incidente y además establecer con exactitud las coordenadas y cantidad de combustible que llevaba la embarcación a bordo para evitar derrames en la zona. Asimismo si la misma embarcación por la profundidad del lugar del hundimiento podría representar un peligro para la navegación. Desde ayer, empezó a circular un corto video del sitio del hundimiento frente a las costas de Eréndira. Compartir Derechos Reservados 2025. Queda prohibida la reproducción total o parcial de la nota sin la autorización previa y por escrito de Ensenada Net. El auge de los tokens En el sector del entretenimiento para adultos La estrella en ascenso del fútbol mundial Julián Álvarez La carrera de un jugador de baloncesto español Alberto Abalde Autos y camionetas Changan Los factores clave para elegirlas Era hombre el cuerpo hallado en una maleta Se encontraba en avanzado estado de descomposición No olvide que suspenderán servicio por interconexión en Bulevar Bucaneros Del lunes 24 al 27 de febrero, para que este prevenido Todo listo para el inicio del Carnaval de Ensenada Inicia este jueves, con quema del Mal Humor y Los Ángeles Azules Murieron dos menores en un incendio este jueves en Ensenada Hay dos adultos con quemaduras de tercer grado Buscan a Jesús Manuel Beltrán Núñez de Ensenada Desapareció desde el pasado 13 de febrero Capturó la FESC a pareja con armamento y droga Detenidos por circular con exceso de velocidad Murió ahogado un jovencito en la playa de La Salina de Ensenada La tarde de este domingo. Era residente de Tijuana Déjanos tus Comentarios | Aviso de Privacidad | Ensenada.net es presentado por :"
"output/pdfs-2023/oTbXEbWy1726517068.pdf","https://goo.su/6OlUT","Error: HTTP 404"
"output/pdfs-2023/oTbXEbWy1726517068.pdf","https://goo.su/YK6Dl","[Source: noticaribepeninsular.com.mx] Aseguran 25 paquetes de cocaína en la zona de playa de un hotel en Tulum Inicio Península Política Seguridad Pública Medio Ambiente Rompeolas Deportes Tren Maya Nacional Fotogalerías Opinión lunes, marzo 3, 2025 Inicio Península Política Seguridad Pública Medio Ambiente Rompeolas Deportes Tren Maya Nacional Fotogalerías Opinión No Result View All Result No Result View All Result Aseguran 25 paquetes de cocaína en la zona de playa de un hotel en Tulum 30 noviembre, 2023 in Seguridad Pública Reading Time: 2 mins read A A A A Reset 1 Redacción/NOTICARIBE PENINSULAR TULUM.- Elementos de la Secretaría de Seguridad Ciudadana, se encontraban haciendo recorridos pedestres de vigilancia y prevención en las zonas de playa, como referencia en el área del Hotel Dreams del Municipio de Tulum. En ese momento, los oficiales lograron observar sobre la arena una mochila enterrada con varios paquetes. Ante el hecho, procedieron a la identificación de los objetos localizados. Te puede interesar: Aseguran paquete de cocaína en una playa de Cozumel Se aseguraron en total 25 paquetes de cocaína con un peso aproximado de 30 kilogramos, los cuales en un costado tenían una etiqueta color verde con letras color negro con la leyenda “LOOK”. Se realizó el traslado del indicio recolectado a las instalaciones de la Fiscalía General de la República ubicada en el municipio de Solidaridad para la puesta a disposición. Con acciones como esta, la Secretaría de Seguridad Ciudadana refrenda su compromiso con la seguridad de las y los quintanarroenses. Tags: droga Tulum [adrotate banner=""3""] Previous Post Impulsa Alday cambios en el Código Civil para promover la equidad y el bienestar familiar Next Post EN EL MALECÓN TAJAMAR: Inauguran “Navidad en Villas Cancún” y pista de patinaje Related Posts Seguridad Pública CRUCE RIESGOSO: Avenidas Politécnico y México, con mayor incidencia en accidentes de tránsito 3 noviembre, 2024 Seguridad Pública SEIS DETENIDOS: Aseguran narcóticos en 5 cateos en Cancún 2 noviembre, 2024 Seguridad Pública Encuentran osamenta en la colonia México de Cancún 2 noviembre, 2024 Seguridad Pública Detenidos a balazos, implicados en asalto a transporte público 1 noviembre, 2024 Seguridad Pública Hallan restos de joven desaparecido desde 2017 en Cancún 1 noviembre, 2024 Principal A QUEMARROPA: Policías repelen a tiros a 2 motodelincuentes (VIDEO) 1 noviembre, 2024 Load More Next Post EN EL MALECÓN TAJAMAR: Inauguran ""Navidad en Villas Cancún"" y pista de patinaje Deja un comentario Cancelar respuesta Tu dirección de correo electrónico no será publicada. Los campos obligatorios están marcados con * Comentario * Nombre * Correo electrónico * Web Guardar mi nombre, correo electrónico y sitio web en este navegador para la próxima vez que haga un comentario. Ultimas Noticias SE CONTRADICEN OTRA VEZ: Ayuntamiento morenista realizará feria con corridas de toros Persiste pésimo servicio de transporte público en Cancún Realizarán campaña de desarme voluntario en zona maya AFIRMA SANTAMARÍA: La CTM ya no es corporativa Crearán primer juzgado especializado en adopción en QR Surge potencial ciclón tropical 18 en el Caribe Litorales Agustin Labrada Alberto Guerra Naranjo Asel Maria Eliana Cárdenas Méndez Fabian Herrera Manzanilla Jorge Manríquez Centeno Manuel Enríquez Raciel Manríquez No Result View All Result Inicio Península Política Seguridad Pública Medio Ambiente Rompeolas Deportes Tren Maya Nacional Fotogalerías Opinión"
"output/pdfs-2023/oTbXEbWy1726517068.pdf","https://goo.su/SEnfVA","[Source: www.dicapi.mil.pe] DICAPI - Dirección General de Capitanías y Guardacostas Organization Historical Review Mission & Vision Organizational Chart General Director Executive Director Technical Supervisor Directions General Direction Aquatic Activities Control Aquatic Environment International Affairs & OMI Coast Guard Operations Maritime Administration Inspections, Audits, and Supervisions Department TUPAM Procedures Regulatory Framework Consultations IFC LATAM PERU es Español Inglés Últimas publicaciones Últimas Publicaciones Correo Web Intranet DICAPI Acceso a Geoportal Correo Web Acceso a Geoportal Home Organization Historical Review Mission & Vision Organizational Chart General Director Executive Director Technical Supervisor Directions General Direction Aquatic Activities Control Aquatic Environment International Affairs & OMI Coast Guard Operations Maritime Administration Inspections, Audits, and Supervisions Department TUPAM Procedures Regulatory Framework Consultations IFC LATAM PERU Organization Historical Review Mission & Vision Organizational Chart General Director Executive Director Technical Supervisor Contact Us Address Constitution St. 150, Callao Digital Office 24 Hours In-person office: 08:00 am - 4:00 pm Telephone 012099300, Extension: 6862 MGP - DICAPI - 2025"
"output/pdfs-2023/oTbXEbWy1726517068.pdf","https://goo.su/OHcdOU","[Source: goo.su] Redirecting Redirecting... Please wait"
"output/pdfs-2023/oTbXEbWy1726517068.pdf","https://goo.su/7z6U8","Error: HTTP 403"
