"pdf_path","url","content"
"output/pdfs-2024/8ueadVFM1729791280.pdf","https://goo.su/48Jpq3","[Source: www.dicapi.mil.pe] DICAPI - Dirección General de Capitanías y Guardacostas Organization Historical Review Mission & Vision Organizational Chart General Director Executive Director Technical Supervisor Directions General Direction Aquatic Activities Control Aquatic Environment International Affairs & OMI Coast Guard Operations Maritime Administration Inspections, Audits, and Supervisions Department TUPAM Procedures Regulatory Framework Consultations IFC LATAM PERU es Español Inglés Últimas publicaciones Últimas Publicaciones Correo Web Intranet DICAPI Acceso a Geoportal Correo Web Acceso a Geoportal Home Organization Historical Review Mission & Vision Organizational Chart General Director Executive Director Technical Supervisor Directions General Direction Aquatic Activities Control Aquatic Environment International Affairs & OMI Coast Guard Operations Maritime Administration Inspections, Audits, and Supervisions Department TUPAM Procedures Regulatory Framework Consultations IFC LATAM PERU Organization Historical Review Mission & Vision Organizational Chart General Director Executive Director Technical Supervisor Contact Us Address Constitution St. 150, Callao Digital Office 24 Hours In-person office: 08:00 am - 4:00 pm Telephone 012099300, Extension: 6862 MGP - DICAPI - 2025"
"output/pdfs-2024/8ueadVFM1729791280.pdf","https://goo.su/l4aRsz","[Source: m.facebook.com] 𝗢𝗰𝘂𝗽𝗮𝗰𝗶ó𝗻 𝗱𝗲 𝗺𝗮𝗱𝗲𝗿𝗮 𝘆 𝘁𝗿𝗮𝘀𝗹𝗮𝗱𝗼... - Ejército de Nicaragua | Facebook This browser is not supported Use Facebook app tap to use a supported browser Safari Chrome"
"output/pdfs-2024/8ueadVFM1729791280.pdf","https://goo.su/PW2Hdp","[Source: www.cgfm.mil.co] Fuerzas Militares inmovilizan maquinaria amarilla destinada para delitos ambientales en el litoral Pacífico nariñense | Comando General de las Fuerzas Militares de Colombia Pasar al contenido principal ES English FR Comando General de las Fuerzas Militares de Colombia Buscar Menú Navegación principal Inicio Transparencia Acceso a Información Pública Atención y servicios a la ciudadanía Atención y servicios a la ciudadanía sub-navigation Canales de atención Peticiones, quejas, reclamos, sugerencias y denuncias (PQRSD) Gaula Militares Preguntas frecuentes Trámites y servicios Participa Participa sub-navigation Descripción General Estructura y secciones del menú ""Participa"". Diagnóstico e identificación de problemas Planeación y presupuesto participativo Consulta ciudadana Colaboración e innovación Rendición de cuentas Control social Conócenos Conócenos sub-navigation Quiénes somos Cultura militar Dependencias Historia Línea de mando Organigrama Incorporaciones Incorporaciones sub-navigation Libreta militar Ejército Nacional Armada de Colombia Fuerza Aérea Colombiana Sala de prensa Sala de prensa sub-navigation Insignia Noticias Periódico Las Fuerzas Ruta de navegación Inicio Multimedia Noticias Fuerzas Militares Inmovilizan Maquinaria Amarilla Destinada Para Delitos Ambientales En El Litoral Pacífico Nariñense Conocenos Quiénes somos Historia Organigrama Cultura militar Línea de mando Dependencias del Comando General de las Fuerzas Militares Memoria histórica y contexto Fuerzas Militares inmovilizan maquinaria amarilla destinada para delitos ambientales en el litoral Pacífico nariñense Estos elementos no tenían la guía de movilización, ni la tarjeta de registro; así mismo, el equipo localizador GPS de la maquinaria no venía encendido. Mediante el desarrollo de operaciones ofensivas, enmarcadas dentro del Plan de Campaña Estratégico Conjunto Ayacucho -Tiempo 2- las Fuerzas Militares, incautaron tres retroexcavadoras junto a diferentes elementos empleados para la explotación ilícita de yacimientos mineros en el área general del municipio de Santa Bárbara de Iscuandé, Nariño. El resultado fue posible gracias a la contundencia operacional de las tropas de la Fuerza de Tarea Conjunta Hércules, quienes  adelantan labores de control y presencia institucional en las arterias fluviales del litoral Pacífico colombiano, enfocados en la afectación a las economías ilegales de los grupos armados organizados y en la protección de la población civil. Las tres retroexcavadoras se encontraban a bordo de un planchón, que navegaba sobre el rio Iscuandé, siendo remolcadas por un sujeto que no contaba con la documentación reglamentaria de acuerdo con la ley 1242 de 2008, por que fue inmovilizada para prevenir su uso en actividades de explotación ilícita de yacimientos mineros. Esta maquinaria, al parecer, vendría desde la ciudad de Medellín, con documentos falsos lo que le permitió pasar por diversos puestos de control de las autoridades competentes y así buscar ser empleada en actividades criminales. Con la incautación de esta maquinaria se afecta el sistema de finanzas ilegales del Bloque Occidental Jacobo Arenas estructura 30 “Rafael Aguilera” en aproximadamente 2.280 millones de pesos. Así mismo, se aporta significativamente a la protección del medio ambiente, especialmente de los afluentes que se contaminan con estas prácticas de extracción ilícita de yacimientos mineros. Durante las operaciones no se presentaron capturas. Entre tanto, el material incautado fue puesto a disposición de las autoridades competente para los fines que se estimen conveniente dentro del marco de la Ley. La Fuerza de Tarea Conjunta Hércules con todas sus unidades, ratifica su compromiso con la conservación del ecosistema y continuará desarrollando operaciones militares y de registro y control fluvial sobre los ríos del litoral Pacífico Colombiano, para negar este espacio a los grupos armados organizados, a la vez que invita a la comunidad a denunciar a las organizaciones ilegales al servicio de la minería ilegal que causan daños irreparables al medio ambiente. Etiquetas Comando General de las Fuerzas Militares - COGFM Contra la minería ilegal Santa Bárbara de Iscuande - Nariño FB X YT IG SF 15 August, 2024 Card Images COMIC UNIDADES MILITARES INSIGNIA: RELATOS EN NUESTRAS BOTAS DEFINE: TU SITUACIÓN MILITAR Comando General Fuerzas Militares de Colombia  Sede Principal  Carrera 54 N°26-25 Barrio Esmeralda Bogotá D.C., Colombia Código postal: 111071 Oficina de Atención al Ciudadano: Carrera 59a N° 44B-29 Barrio Esmeralda Bogotá D.C., Colombia    Horario de Atención: Lunes a Viernes de 8:00 a.m. a 4:00 p.m. Línea de Atención:  Gratuita Nivel Nacional +57 018000 952930 +57 (601)5804826 +57 3175765798  Whatsapp: + 57 3175765798 Línea anticorrupción:  EJC 152 | ARC +57 3166192914 | FAC +57 3057341858 Correo Institucional: atencionalciudadano@cgfm.mil.co  QUEJAS Y/O DENUNCIAS DISCIPLINARIAS   NOTIFICACIONES JUDICIALES Facebook X Instagram Youtube TikTok Link"
"output/pdfs-2024/8ueadVFM1729791280.pdf","https://goo.su/wysP","[Source: www.dicapi.mil.pe] DICAPI - Dirección General de Capitanías y Guardacostas Organization Historical Review Mission & Vision Organizational Chart General Director Executive Director Technical Supervisor Directions General Direction Aquatic Activities Control Aquatic Environment International Affairs & OMI Coast Guard Operations Maritime Administration Inspections, Audits, and Supervisions Department TUPAM Procedures Regulatory Framework Consultations IFC LATAM PERU es Español Inglés Últimas publicaciones Últimas Publicaciones Correo Web Intranet DICAPI Acceso a Geoportal Correo Web Acceso a Geoportal Home Organization Historical Review Mission & Vision Organizational Chart General Director Executive Director Technical Supervisor Directions General Direction Aquatic Activities Control Aquatic Environment International Affairs & OMI Coast Guard Operations Maritime Administration Inspections, Audits, and Supervisions Department TUPAM Procedures Regulatory Framework Consultations IFC LATAM PERU Organization Historical Review Mission & Vision Organizational Chart General Director Executive Director Technical Supervisor Contact Us Address Constitution St. 150, Callao Digital Office 24 Hours In-person office: 08:00 am - 4:00 pm Telephone 012099300, Extension: 6862 MGP - DICAPI - 2025"
"output/pdfs-2024/8ueadVFM1729791280.pdf","https://goo.su/BSBsrD","[Source: www.dicapi.mil.pe] DICAPI - Dirección General de Capitanías y Guardacostas Organization Historical Review Mission & Vision Organizational Chart General Director Executive Director Technical Supervisor Directions General Direction Aquatic Activities Control Aquatic Environment International Affairs & OMI Coast Guard Operations Maritime Administration Inspections, Audits, and Supervisions Department TUPAM Procedures Regulatory Framework Consultations IFC LATAM PERU es Español Inglés Últimas publicaciones Últimas Publicaciones Correo Web Intranet DICAPI Acceso a Geoportal Correo Web Acceso a Geoportal Home Organization Historical Review Mission & Vision Organizational Chart General Director Executive Director Technical Supervisor Directions General Direction Aquatic Activities Control Aquatic Environment International Affairs & OMI Coast Guard Operations Maritime Administration Inspections, Audits, and Supervisions Department TUPAM Procedures Regulatory Framework Consultations IFC LATAM PERU Organization Historical Review Mission & Vision Organizational Chart General Director Executive Director Technical Supervisor Contact Us Address Constitution St. 150, Callao Digital Office 24 Hours In-person office: 08:00 am - 4:00 pm Telephone 012099300, Extension: 6862 MGP - DICAPI - 2025"
"output/pdfs-2024/2HLRiW8Y1725404777.pdf","https://goo.su/zcJUstj","[Source: www.news.uscg.mil] Coast Guard offloads more than $185 million in illegal narcotics during Fleet Week Miami > United States Coast Guard News > Press Releases An official website of the United States government Here's how you know Official websites use .mil A .mil website belongs to an official U.S. Department of Defense organization in the United States. Secure .mil websites use HTTPS A lock ( lock ) or https:// means you’ve safely connected to the .mil website. Share sensitive information only on official, secure websites. Skip to main content (Press Enter). Toggle navigation United States Coast Guard News Department of Homeland Security United States Coast Guard News Search Search U.S. Coast Guard News: Search Search U.S. Coast Guard News: Search News Home CG Home Page Overview Reserve Forcecom Mission Support Operations Atlantic Area Pacific Area History News by Region Headquarters Container Vessel Dali El Faro Marine Board of Investigation Destination Marine Board of Investigation Scandies Rose Seacor Power Titan Submersible Ports & Waterways Safety BOI Academy Bootcamp Atlantic Area 1st District Northeast PADET New York Grande Costa D'Avorio Investigation 5th District Midatlantic PADET Baltimore 7th District Southeast PADET Jacksonville PADET Tampa Bay Puerto Rico Golden Ray Formal Investigation Hearing 8th District Heartland PADET Texas Bouchard No 255 Barge Formal Hearing Genesis River-Voyager collision 9th District Great Lakes Pacific Area 11th District Pacific Southwest PADET San Diego PADET LA/LB 13th District Pacific Northwest PADET Astoria Mary B II Formal Hearing 14th District Hawaii and the Pacific 17th District Alaska PADET Kodiak PADET Anchorage Town Hall Pacific Area Atlantic Area Join the Coast Guard Our Organization Press Releases News Home Press Releases Search by keword Select a Region Select a Region Headquarters Academy Bootcamp Atlantic Area 1st District Northeast ...PADET New York 5th District Mid-Atlantic ...PADET Baltimore 7th District Southeast ...PADET Jacksonville ...PADET Tampa Bay ...Puerto Rico 8th District Heartland ...PADET Texas 9th District Great Lakes Pacific Area 11th District Pacific Southwest ...PADET San Diego ...PADET LA/LB 13th District Pacific Northwest ...PADET Astoria 14th District Hawaii and the Pacific 17th District Alaska ...PADET Kodiak ...PADET Anchorage Search by date range PHOTO INFORMATION Download Details Share Coast Guard offloads more than $185 million in illegal narcotics during Fleet Week Miami U.S. Coast Guard Cutter Mohawk (WMEC-913) crewmembers pose with approximately 18,000 pounds of illegal narcotics at Port Everglades in Fort Lauderdale, Florida, May 10, 2025. The Mohawk is homeported in Key West, Florida. (U.S. Coast Guard photo by Petty Officer 2nd Class Ryan Estrada) PHOTO INFORMATION Download Details Share Coast Guard offloads more than $185 million in illegal narcotics during Fleet Week Miami U.S. Coast Guard Cutter Mohawk (WMEC-913) crewmembers wrap illegal narcotics during a drug offload at Port Everglades in Fort Lauderdale, Florida, May 10, 2025. The Mohawk is homeported in Key West, Florida. (U.S. Coast Guard photo by Petty Officer 2nd Class Ryan Estrada) PHOTO INFORMATION Download Details Share Coast Guard offloads more than $185 million in illegal narcotics during Fleet Week Miami A Helicopter Maritime Strike Squadron (HSM) 50 aircrew deployed aboard the USS Leyte Gulf (CG 55) hovers over the U.S. Coast Guard Cutter Mohawk (WMEC 913) in the Atlantic Ocean, April 24, 2024. The crew of U.S. Coast Guard Cutter Mohawk (WMEC 913) offloaded more than 13,803 pounds of cocaine and 3,736 pounds of marijuana with a combined estimated street value of approximately $185 million in Port Everglades on May 10, 2024. (U.S. Coast Guard courtesy photo) PHOTO INFORMATION Download Details Share Coast Guard offloads more than $185 million in illegal narcotics during Fleet Week Miami U.S. Coast Guard Cutter Mohawk (WMEC 913) crewmembers receive a transfer of illegal narcotics via vertical replenishment (VERTREP) from USS Leyte Gulf (CG 55) and by a Helicopter Maritime Strike Squadron (HSM) 50 aircrew in the Atlantic Ocean, April 24, 2024. The crew of U.S. Coast Guard Cutter Mohawk (WMEC 913) offloaded more than 13,803 pounds of cocaine and 3,736 pounds of marijuana with a combined estimated street value of approximately $185 million in Port Everglades on May 10, 2024. (U.S. Coast Guard courtesy photo) PHOTO INFORMATION Download Details Share Coast Guard offloads more than $185 million in illegal narcotics during Fleet Week Miami A Helicopter Maritime Strike Squadron (HSM) 50 aircrew deployed aboard the USS Leyte Gulf (CG 55) transfers seized contraband to U.S. Coast Guard Cutter Mohawk (WMEC 913) crewmembers in the Atlantic Ocean, April 24, 2024. The crew of U.S. Coast Guard Cutter Mohawk (WMEC 913) offloaded more than 13,803 pounds of cocaine and 3,736 pounds of marijuana with a combined estimated street value of approximately $185 million in Port Everglades on May 10, "
"output/pdfs-2024/2HLRiW8Y1725404777.pdf","https://goo.su/cApk5z","[Source: x.com] JavaScript is not available. We’ve detected that JavaScript is disabled in this browser. Please enable JavaScript or switch to a supported browser to continue using x.com. You can see a list of supported browsers in our Help Center. Help Center Terms of Service Privacy Policy Cookie Policy Imprint Ads info © 2025 X Corp. Something went wrong, but don’t fret — let’s give it another shot. Try again Some privacy related extensions may cause issues on x.com. Please disable them and try again."
"output/pdfs-2024/8ueadVFM1729791280.pdf","https://goo.su/SdnZQz","[Source: www.facebook.com] Facebook"
"output/pdfs-2024/2HLRiW8Y1725404777.pdf","https://goo.su/AKn1upB","[Source: www.aeronaval.gob.pa] SENAN DECOMISA LANCHA ARTESANAL EN PRESUNTA ACTIVIDAD DE NARCOTRÃFICO EN GUNA YALA República de Panamá - Ministerio de Seguridad Pública SERVICIO NACIONAL AERONAVAL ""Dios, Patria y Honor"" Inicio La Institución Noticias Actividades Labor Social Transparencia Contáctenos Correo Institucional Instagram Facebook Twitter Youtube NOTICIAS SENAN DECOMISA LANCHA ARTESANAL EN PRESUNTA ACTIVIDAD DE NARCOTRÃFICO EN GUNA YALA Publicado el 10-05-2024 Unidades del Servicio Nacional Aeronaval (SENAN) incautaron dos sacos que contenÃ­an paquetes de presunta sustancia ilÃ­cita, ademÃ¡s se aprehendieron a dos masculinos que viajaban a bordo de una lancha artesanal al este de los Cayos Holandeses en la Comarca Guna Yala. Previa coordinaciÃ³n con la FiscalÃ­a de Drogas de ColÃ³n y Guna Yala, la embarcaciÃ³n, tripulantes y el presunto ilÃ­cito fueron trasladados a la Base Naval Almirante CristÃ³bal ColÃ³n en Sherman donde se contabilizaron 9 paquetes de sustancia ilÃ­cita y 48 bolsas ziploc con hierba seca que se presume sea droga. Esta acciÃ³n antidrogas se realizÃ³ en el marco de la âOperaciÃ³n Apoloâ que desarrollan los estamentos de seguridad en coordinaciÃ³n con las autoridades del Ministerio PÃºblico y el Centro Regional de Operaciones Aeronavales de PanamÃ¡ (CROAN). En lo que va del aÃ±o 2024 el SENAN mediante la ejecuciÃ³n de 49 operaciones efectivas contra el narcotrÃ¡fico ha logrado el decomiso total de 30,585 paquetes de sustancias ilÃ­citas. Nos mantenemos firmes contrarrestando las redes criminales ligadas al narcotrÃ¡fico en todas sus modalidades, reforzando nuestras tareas de patrullajes por aire, mar y tierra en todo el territorio nacional. BoletÃ­n Aeronaval Síguenos Seguir a @senanpanama Tweets by SENANPanama La Patria y el SENAN te necesitan SI YA ESTÃS INSCRITO PARA GUARDIA AERONAVAL CONSULTA SU ESTATUS AQUÃ RITN PANAMÃ RITN RED INTERAMERICANA DE TELECOMUNICACIONES NAVALES DESTACAMENTO RITN PANAMÃ (CWP) SICOFAA SENAN es miembro de SICOFAA, una organizaciÃ³n cuya finalidad es promover y fortalecer los lazos de amistad y cooperaciÃ³n entre las Fuerzas AÃ©reas o sus equivalentes en las AmÃ©ricas. Multimedia Videos Imágenes La palabra Haced con los demÃ¡s todo lo que deseÃ¡is que hagan ellos con vosotros (Mat. 7:12) Contáctenos Email de contacto: correspondencia.dige@aeronaval.gob.pa Teléfono:  (507) 520-6100 (Central telefónica) Dirección:  Comando General Aeronaval, Cocolí, Edificio 3005, Corregimiento de Veracruz, Distrito de Arraiján Apartado postal:  0843-02817 Panamá Visitas : 10857060 En lÃ­nea : 17 Todos los derechos reservados (c) 2025 - Servicio Nacional Aeronaval Inicio | La institución | Noticias | Actividades | Labor social | Comunicados | Contáctenos | Videos"
"output/pdfs-2024/2HLRiW8Y1725404777.pdf","https://goo.su/2crCw","[Source: x.com] JavaScript is not available. We’ve detected that JavaScript is disabled in this browser. Please enable JavaScript or switch to a supported browser to continue using x.com. You can see a list of supported browsers in our Help Center. Help Center Terms of Service Privacy Policy Cookie Policy Imprint Ads info © 2025 X Corp. Something went wrong, but don’t fret — let’s give it another shot. Try again Some privacy related extensions may cause issues on x.com. Please disable them and try again."
"output/pdfs-2024/2HLRiW8Y1725404777.pdf","https://goo.su/tBpaE8B","[Source: www.infobae.com] Cayó narcolancha con coca en el pacífico: su valor sería de 18 millones de dólares - Infobae 3 Mar, 2025 Buscar en todo el sitio Argentina España México Perú Mundo Venezuela The economist The Washington Post Realeza Opinión Últimas Noticias Entretenimiento Deportes Violencia Cultura Qué puedo ver Tendencias Podcasts Malditos Nerds Salud Tecno ; Bienvenido Por favor, ingresa a tu cuenta. REGISTRARME INICIAR SESIÓN Colombia Últimas Noticias Violencia Economía Entretenimiento Colombia Cayó narcolancha con coca en el pacífico: su valor sería de 18 millones de dólares El operativo se llevó a cabo entre la Policía Nacional y la Armada de Colombia y evitó que la droga fuera transporta a Centroamérica Por Juan Manuel Arias Montenegro 12 May, 2024 08:23 p.m. EST Guardar La Policía Nacional incautó 456 kilos de coca en el mar Pacífico - crédito @PoliciaColombia En la tarde del domingo 12 de mayo de 2024, la Policía Nacional confirmó la interceptación de una lancha rápida que transportaba varios kilogramos de cocaína. Así lo dio a conocer la institución a través de una publicación en su cuenta de X en la que aseguró que la embarcación transportaba un total de 456 kilos del estupefaciente. Ahora puede seguirnos en nuestro WhatsApp Channel y en Facebook . De acuerdo con la información que se conoció sobre el hecho, el operativo fue llevado a cabo por la Policía Antinarcóticos y la Armada Nacional en aguas del pacífico colombiano. De acuerdo con las autoridades, el cargamento tendría un valor de 18 millones de dólares - crédito @PoliciaColombia En su publicación, la Policía Nacional confirmó que la embarcación tipo Go Fast tenía destino Centroamérica y transportaba el cargamento encaletado en su fuselaje ; como también, que la droga tendría un valor en el mercado de 18 millones de dólares, los cuales, serían usados en rentas criminales. La mayor incautación de heroína de los últimos años en Colombia A principios de mayo de 2024, se conoció que, en una operación conjunta efectuada por la Policía Nacional, la Fiscalía General de la Nación, la Administración para el Control de Drogas (DEA por sus siglas en inglés) y el Ejército Nacional, se logró la incautación de 53,5 kilos de heroína en un área rural del corregimiento de Santa Fe, municipio de Buesaco, Nariño. Las labores de inteligencia de las autoridades permitieron confirmar que este alijo fue preparado para su envío inicial a Guayaquil, Ecuador, para su posterior distribución en el mercado estadounidense. El operativo reveló estrategias sofisticadas por parte de los narcotraficantes, quienes escondieron la droga en una vivienda aparentemente humilde, planeando su exportación en modalidades de empaque que imitaban dediles para evadir los controles de seguridad. De acuerdo con la Dirección Antinarcóticos, el valor estimado de este cargamento es de 802 millones de pesos en su lugar de origen, cifra que se elevaría a aproximadamente 3,7 millones de dólares una vez alcanzado el mercado internacional. La acción policial previno la circulación de cerca de 860 mil dosis de este potente narcótico. Incautación de heroína en Nariño - crédito Policía Nacional Durante la investigación, que contó con el apoyo de autoridades ecuatorianas en un contexto de cooperación binacional, se identificó la posible participación de una organización criminal transnacional que usaba etiquetas con el logo de un equipo de fútbol de Guayaquil para camuflar sus envíos, por lo que dicha intervención permitió el decomiso de mil etiquetas relacionadas con esta maniobra. Para los delincuentes la ubicación geográfica de Buesaco, caracterizada por su elevada altitud y complicadas rutas montañosas, facilitaría tanto el cultivo de amapolas como la producción de heroína, convirtiéndose en un punto estratégico para los traficantes. Según manifestó el director General de la Policía Nacional, general William René Salamanca Ramírez, esta operación se registró gracias a una ofensiva más amplia contra el tráfico de heroína y el narcotráfico en general, destacando el trabajo coordinado con Ecuador y la DEA ; además, resaltó varios operativos exitosos contra el tráfico de marihuana y cocaína, que han permitido significativas incautaciones y la captura de involucrados en estos ilícitos. Entre estos, se destacan el decomiso de más de 3.400 kilos de marihuana y cocaína en diferentes zonas del país, incluyendo un cargamento significativo de marihuana tipo creepy y otro de clorhidrato de cocaína interceptado en ruta marítima hacia el Distrito Especial de Buenaventura. “Esta operación hace parte de la ofensiva integral contra el narcotráfico, en especial contra el fenómeno de la heroína que hemos detectado en la frontera con el hermano país de Ecuador, con el cual venimos trabajando articuladamente, en coordinación con la DEA”, explicó el director de la Policía Nacional. General William Salamanca, comandante de la Policía Nacional - crédito Colprensa Hasta la fecha, las incautaciones acumuladas representan un golpe financi"
