"pdf_path","url","content"
"output/pdfs-2024/mO2xSg7M1725471357.pdf","https://goo.su/6VU1IGM","[Source: ntelemicro.com] Incautan 182 kilos de cocaína y detienen contrabandistas en aguas de Puerto Rico Menú Buscar por Inicio Nacionales Internacionales Espectáculo Tecnología Economía Deportes Salud Seguir Facebook X YouTube Instagram Switch skin Buscar por Inicio / Internacionales / Incautan 182 kilos de cocaína y detienen contrabandistas en aguas de Puerto Rico Internacionales ÚLTIMA HORA Incautan 182 kilos de cocaína y detienen contrabandistas en aguas de Puerto Rico Agencias Última Actualización 8 de marzo de 2024 1 minuto de lectura PUERTO RICO.- La Guardia Costera incautó este viernes 182 kilogramos de cocaína , valorados en 4,5 millones de dólares, en el puerto de Mayagüez, en el oeste de  Puerto Rico, donde transfirió también la custodia de dos presuntos contrabandistas dominicanos detenidos. La lancha rápida fue interceptada en la costa suroeste de Cabo Rojo por un buque de la Marina Real Británica, que capturó asimismo a los dominicanos que iban a bordo, según el comunicado publicado hoy por la Guardia Costera. «Apreciamos el trabajo y la colaboración de nuestros socios de la Marina Real Británica para detener los buques de contrabando de drogas en alta mar», dijo el comandante Gerard Wenk, jefe de respuesta del Sector de la Guardia Costera de San Juan. Publicaciones relacionadas Ministerio de Hacienda alerta sobre plataforma de apuestas deportivas no autorizada “ATB Football” Pentágono enviará 3,000 soldados adicionales a la frontera entre EE. UU. y México «El trabajo que hacemos juntos a diario con nuestros socios federales, locales y regionales ayuda a proteger y traer estabilidad a la región del Caribe frente a esta amenaza», agregó. La agente especial a cargo de la División del Caribe de la Administración de Control de Drogas (DEA, en inglés), Denise Foster, afirmó que las organizaciones de narcotráfico representan «la mayor amenaza para la seguridad y la salud» de los ciudadanos. El pasado domingo, la Guardia Costera estadounidense y la Marina Británica anunciaron que habían interceptado cerca de las Islas Vírgenes un bote rápido con más de 2,700 kilogramos de cocaína y otras drogas. Copy URL Copiar URL Agencias Última Actualización 8 de marzo de 2024 1 minuto de lectura Facebook X LinkedIn Tumblr Reddit Pocket WhatsApp Telegram Compartir por correo electrónico Imprimir Publicaciones relacionadas VIDEO: Asaltan banco en La Romana y matan guardia de seguridad A 5 años del COVID, recuerdan al italiano que trajo el primer caso de COVID al país VIDEO: Ministro de Defensa asegura que la frontera con Haití está bajo estricta vigilancia en cada punto Ministro de defensa recorre la frontera Lo Último Ministerio de Hacienda alerta sobre plataforma de apuestas deportivas no autorizada “ATB Football” Pentágono enviará 3,000 soldados adicionales a la frontera entre EE. UU. y México VIDEO: Asaltan banco en La Romana y matan guardia de seguridad A 5 años del COVID, recuerdan al italiano que trajo el primer caso de COVID al país VIDEO: Ministro de Defensa asegura que la frontera con Haití está bajo estricta vigilancia en cada punto Copyright © 2025 · Noticias Telemicro · Todos los Derechos Reservados Diseño adaptado por Yorvis Bracho Telemicro 5 Telemicro Internacional Digital 15 Telecentro 13 Emisoras Telemicro Viva Aster Facebook X YouTube Instagram Facebook X LinkedIn Reddit Compartir por correo electrónico Imprimir Facebook X WhatsApp Telegram Botón volver arriba Cerrar Buscar: Facebook X YouTube Instagram Cerrar Buscar por Cerrar Buscar por Usamos cookies para asegurar que te damos la mejor experiencia en nuestra web. Si continúas usando este sitio, asumiremos que estás de acuerdo con ello. Aceptar No Política de privacidad"
"output/pdfs-2024/cxT2wVHS1725468503.pdf","https://goo.su/SLqpJ","[Source: www.argentina.gob.ar] Control de los espacios marítimos: Prefectura detectó dos buques que navegaban desde Malvinas sin autorización argentina | Argentina.gob.ar Presidencia de la Nación Pasar al contenido principal Ir a Mi Argentina Buscar Cerrar el buscador Mi Argentina Dejar en blanco Buscar en el sitio Buscar en el sitio Inicio Ministerio de Seguridad Nacional Prefectura Naval Argentina Noticias de la PNA Control de los espacios marítimos: Prefectura detectó dos buques que navegaban desde Malvinas sin autorización argentina Control de los espacios marítimos: Prefectura detectó dos buques que navegaban desde Malvinas sin autorización argentina El guardacostas GC-28 Prefecto Derbes, que se encuentra finalizando una campaña de patrullaje de la Zona Económica Exclusiva y su área adyacente, informó a los capitanes de la infracción. 14 de abril de 2024 Compartir en Facebook Compartir en X Compartir en Linkedin Compartir en Whatsapp Compartir en Telegram Como parte del trabajo que realiza la Prefectura Naval Argentina, como Autoridad Marítima nacional, para vigilar y controlar los espacios marítimos del país, su guardacostas GC-28 Prefecto Derbes, en colaboración con sus Servicios de Tráfico Marítimo y de Buques Guardacostas, logró la detección de dos buques que navegaban desde las Islas Malvinas sin la correspondiente autorización argentina. El hecho fue posible gracias al monitoreo permanente que realiza la Institución combinando patrullajes marítimos, aéreos y electrónicos para proteger los intereses marítimos argentinos. En ese sentido, además de la presencia en el vasto territorio marítimo, desde la Dirección de Tráfico Marítimo, Fluvial y Lacustre, se efectúa un seguimiento de los buques a través del Sistema Guardacostas, una moderna plataforma tecnológica que integra diferentes sistemas de geolocalización para hacer una vigilancia en tiempo real de los buques que navegan por el mundo. Con ese contexto, la Fuerza advirtió que dos buques (""BEAGLE"", de bandera chilena, aparentemente remolcando al pesquero ""AN FONG NO.136"", de bandera Taiwán) navegaban a velocidad reducida dentro de la Zona Económica Exclusiva del país , al través de la ciudad de Comodoro Rivadavia, a 245 millas náuticas de la costa. Las embarcaciones mencionadas presentan la particularidad de haber zarpado de las Islas Malvinas simultáneamente, con rutas idénticas, lo que sugiere que el remolcador podría estar prestando asistencia al buque pesquero “AN FONG NO.136” (IMO 9777979). Cabe destacar que, de acuerdo al decreto 256/10, concordante con la Ordenanza 01-10 de la Prefectura, todo buque o artefacto naval que se proponga transitar entre puertos ubicados en el territorio continental argentino y puertos ubicados en las Islas Malvinas, Georgias del Sur y Sandwich del Sur, atravesar aguas jurisdiccionales argentinas en dirección a estos últimos y/o cargar mercaderías a ser transportadas en forma directa o indirecta entre esos puertos, deberá solicitar una autorización previa expedida por la autoridad nacional competente. Ante esto, personal del guardacostas Prefecto Derbes notificó a los capitanes de los buques infractores, por incumplir la mencionada norma al haber operado en las Islas Malvinas, sin el correspondiente aval argentino. Además, se ha confirmado que ambos buques tienen previsto dirigirse al Puerto de Montevideo, según la información proporcionada por el sitio web de la Administración Nacional de Puertos (ANP-ROU). Noticias relacionadas 28 de febrero de 2025 Prefectura fue reconocida por su accionar durante un incendio ocurrido en Santa Fe 27 de febrero de 2025 Orquestas unidas: músicos de la Prefectura Naval Argentina y estudiantes de la Escuela de Berisso compartieron un emocionante concierto 27 de febrero de 2025 Prefectura Naval Argentina y la Coast Guard de EE. UU. refuerzan lazos en ceremonia de ascenso Trámites Turnos Trámites a distancia Atención a la ciudadanía Acerca de la República Argentina Nuestro país Leyes argentinas Organismos Mapa del Estado Acerca de Argentina.gob.ar Acerca de este sitio Términos y condiciones Sugerencias Scroll hacia arriba"
"output/pdfs-2024/mO2xSg7M1725471357.pdf","https://goo.su/zuHTq","[Source: elnacional.com.do] ¡Uf! Más cocaína; incautan otros 767 paquetes en Baní Portada Actualidad Deportes Opinión Página Dos ¿Qué Pasa? Mundo Economía Reportajes Semana Privacidad 3' Actualidad Policial ¡Uf! Más cocaína; incautan otros 767 paquetes en Baní Por Diogenes Tejada marzo 8, 2024 10:14 | Actualizado en marzo 8, 2024 10:31 Las autoridades incautaron esta madrugada otro cargamento de 767 paquetes de cocaína y arrestaron a dos hombres en las costas de Bani provincia Peravia donde suman 1.7 toneladas en las últimas 24 horas. En la operación participaron, agentes de la Dirección Nacional de Control de Drogas (DNCD) , la Armada de República Dominicana, la Fuerza Aérea en coordinación con el Ministerio Público. Se recuerda que ayer fueron incautados 984 paquetes cocaína, equivalente a casi una tonelada, considerado otro contundente golpe al narcotráfico donde fueron arrestados  tres venezolanos que trataron de introducir el millonario alijo al país en una embarcación procedente desde Sudamérica en la que llegaron por las costas de la provincia Peravia. La incautación del cargamento de  767 se produjo durante un operativo por aire, mar y tierra de más de 15 horas, en el que participaron miembros de la Dirección Nacional de Control de Drogas (DNCD), Armada Dominicana, Fuerza Aérea, de las agencias de seguridad e inteligencia de las Fuerzas Armadas y representantes del Ministerio Público de Baní. Las autoridades, además de ocupar el gran cargamento de cocaína, apresaron a dos dominicanos, los cuales serán sometidos a la Justicia Te puede interesar leer: Ocupan una tonelada de cocaína en Baní Las unidades aéreas, navales y terrestres, luego de recibir informes de inteligencia, dispusieron de un amplio operativo de persecución, para atrapar a varios individuos a bordo de una lancha rápida (tipo Go Fast), que tenían la intención de introducir un significativo alijo de sustancias controladas a territorio dominicano. Horas después del despliegue de las fuerzas, por aire, mar y tierra, las autoridades lograron interceptar a varias millas náuticas al sur de Punta Salinas, municipio de Baní, una embarcación de unos 23 pies de eslora, con dos motores fuera de borda, de 60 caballos de fuerza cada uno. Al abordar la lancha, de color azul, sin nombre ni matrícula, se arrestaron a dos dominicanos y se confiscaron 23 pacas, conteniendo un total de 767 paquetes de una sustancia, que se presume es cocaína. En la operación, que inició la tarde de este jueves y concluyó la madrugada de este viernes, se ocuparon además, siete garrafones de combustibles, tres tanques plásticos,  lonas, una neverita y otras evidencias. “Con los constantes golpes al narcotráfico nacional e internacional, el Gobierno dominicano, demuestra su compromiso inquebrantable de seguir enfrentando con firmeza a las estructuras criminales que intentan utilizar nuestro territorio para sus actividades ilícitas”. Los organismos oficiales profundizan las investigaciones en torno a la frustrada operación de narcotráfico y tratan de establecer si el recién decomiso, de una tonelada de cocaína, en el día de ayer en las costas de Baní, guarda alguna relación con la incautación de este nuevo cargamento. Hay que destacar que las autoridades dominicanas, han confiscado 1.7 toneladas de cocaína, en las últimas horas en la parte sur del país; mientras los detenidos en este último caso, están siendo entregados al Ministerio Público de la provincia Peravia, para conocerles medidas de coerción en las próximas horas. La DNCD informó que los 767 paquetes ocupados en esta nueva operación fueron enviados bajo cadena de custodia al Instituto Nacional de Ciencias Forenses (INACIF) para determinar el tipo y peso del cargamento. TEMAS: #Baní #cocaína #DNCD #El Nacional Digital #Noticias actuales #noticias de hoy #paquetes #Periódico El Nacional Impreso jueves 27 de febrero 2025 El Nacional febrero 27, 2025 Artículos relacionados Hoy se decidirá el esperado aumento de salario de 15 a 20 % Hackman y su esposa fueron encontrados muertos tras la alerta de un vecino CARD demanda ante TSA sistema Seguridad Social JCE asegura montaje comicios va perfecto Abel Martínez critica desconexión entre discurso de Abinader y realidad sobre seguridad Intrant inicia recertificación transporte turístico Leonel dice discurso de Abinder fue «puros cuentos» Reforma Ley Minera Médicos alertan por neumonía en China CNS acuerda alza salarial del 20 % en dos etapas; 12 % en abril de este año y 08 % en febrero 2026 Abinader prioriza protección de Cuevas del Pomier y anuncia avances ambientales y mineros ¿Cómo serán los ciclones en el Atlántico y Pacífico oriental? Expertos responden Francelys Furcal enfrenta 20 años de cárcel por el asesinato de Zongxin Chen en 2022 Francelys Furcal condenada 5 años por el asesinato de Zongxin Chen en 2022 Hoy en Portada Versión clásica Powered by La voz de todos Av San Martin 236, Santo Domingo 10149 809-565-5581 ext. 348 redaccion@elnacional.com.do Actualidad Deportes Opinión Página Dos ¿Qué pa"
"output/pdfs-2024/mO2xSg7M1725471357.pdf","https://goo.su/vkRwr7","[Source: 7dias.com.do] 7dias.com.do :: Decomisan 984 paquetes de cocaína en lancha rápida llegó a Baní Usamos archivos de cookies para optimizar el uso del sitio web. Los usamos también para obtener datos estadísticos agregados y anónimos que nos ayudan a analizar cómo el usuario navega por nuestro sitio web. Esta información ayuda a mejorar la estructura y el contenido de nuestro sitio web. Acepto Lunes, 3 de Marzo, 2025 Contactos Nosotros Términos y Condiciones X Inicio Nacionales Internacionales Política Economía Deportes Tecnología Opinión Variedades Exclusiva Últimas Noticias Juicio de fondo del caso Medusa inicia desde cero con nuevos jueces DGII lanza operativo en Las Terrenas para regularizar negocios informales PLD crea comisión para seleccionar a los posibles aspirantes a la candidatura presidencial DIDA llama a denunciar cambios Irregulares de medicamentos oncológicos ¡Viral! Halle Berry le roba un beso a Adrien Brody en los Óscar 2025 y recibe cientos de críticas Zoe Saldaña se disculpa por ‘Emilia Pérez’ y reflexiona sobre la representación en el cine Banco Popular presenta la nueva Visa Infinite Prestige Hombre asesina su pareja sentimental de varias estocadas en Barahona Trump advierte que ""no tolerará por mucho tiempo"" las posiciones de Zelenski sobre la paz Vaguada provocará aguaceros, tronadas y ráfagas de viento en algunas localidades del país En Vivo Inicio Nacionales Internacionales Política Economía Deportes Tecnología Opinión Variedades Exclusiva Nacionales Por: La Redacción jueves 07 marzo, 2024 Decomisan 984 paquetes de cocaína en lancha rápida llegó a Baní Baní, provincia Peravia.-Las autoridades informaron el decomiso de casi una tonelada de cocaína a una embarcación rápida que penetró a aguas nacionales por Baní desde suramérica. La Dirección Nacional de Control de Drogas (DNCD), quien recibió apoyo de la Armada y otras agencias, dijo que en total el cargamento está compuesto por 984 paquetes. A bordo de la embarcación, tipo Eduardo, fueron apresados varios hombres, pero no se ofrecieron más detalles. Las autoridades, ocuparon además, dos motores fuera de borda, varios tanques llenos de combustibles, tres celulares, una neverita con agua, bebidas energizantes y comestibles, lonas, entre otras evidencias. Subscribete a nustro canal de YouTube Conecta con nosotros Últinas Noticias Ver todas 3 marzo, 2025 Juicio de fondo del caso Medusa inicia desde cero con nuevos jueces 3 marzo, 2025 DGII lanza operativo en Las Terrenas para regularizar negocios informales 3 marzo, 2025 PLD crea comisión para seleccionar a los posibles aspirantes a la candidatura presidencial 3 marzo, 2025 DIDA llama a denunciar cambios Irregulares de medicamentos oncológicos 3 marzo, 2025 ¡Viral! Halle Berry le roba un beso a Adrien Brody en los Óscar 2025 y recibe cientos de críticas 3 marzo, 2025 Zoe Saldaña se disculpa por ‘Emilia Pérez’ y reflexiona sobre la representación en el cine 3 marzo, 2025 Banco Popular presenta la nueva Visa Infinite Prestige 3 marzo, 2025 Hombre asesina su pareja sentimental de varias estocadas en Barahona Boletín Semanal Las noticias más relevantes de la semana en su email. Tú contenido importa Tú también puedes informar que pasa en tu comunidad o tus alrededores. Videos, fotos y noticias para publicarla en nuestros medios. Boletín Diario Más vistas Carnaval de Santo Domingo este se celebrará en la av. Venezuela DIGESETT convocará al alcalde Dio Astacio y al INTRANT para tratar la “problemática” de los contenedores de basura en la vía pública Se entrega joven acusado de distribuir gomitas alucinógenas entre compañeros Apresan mujer acusada de robo con “burundanga” en el sector capitalino de Villa Consuelo Hallan cadáver de hombre en el vertedero de Rafey, Santiago Secciones Portada Nacionales Internacionales Política Economía Deportes Tecnología Opinión Variedades Exclusiva Enlaces acdmedia.com proceso.com.do super7fm.com entelevision.com catorcetv.com turismoglobal.com Notas en imágenes www.7dias.com.do te mantiene informado de las noticias de mayor relevancia en República Dominicana. El periódico digital 7dias.com.do te garantiza el seguimiento continuo de las informaciones que constituyen el día a día en el acontecer del dominicano los 7 días de las semanas las 24 horas del día. Reciba los acontencimientos más relevantes de la semana en su email © Derechos reservados 2022 | Diseño Grupo Jorlex Desarrollo dtavarez.com.do Contactos Nosotros Términos y Condiciones"
"output/pdfs-2024/mO2xSg7M1725471357.pdf","https://goo.su/R0toiWw","[Source: evtv.online] Colombia decomisa más de 420 kilos de cocaína, detuvieron a un venezolano Facebook Twitter Instagram Youtube Telegram Disfruta De Nuestra Señal En Vivo Inicio Destacados Venezuela EE.UU Internacionales Elecciones EEUU 2024 Opinión Deportes Entretenimiento Search for: Search Primary Menu Search for: Search Home Internacionales Colombia decomisa más de 420 kilos de cocaína, detuvieron a un venezolano Internacionales Colombia decomisa más de 420 kilos de cocaína, detuvieron a un venezolano marzo 10, 2024 marzo 10, 2024 1 Cortesía: Versión Final Unidades de la Armada Colombiana y de la Fuerza Aérea Colombiana lograron decomisar un envío de cocaína valuado en más de 14 millones de dólares en el Cabo de La Vela, ubicado en La Guajira. «La operación se inició cuando una aeronave de la Fuerza Aeroespacial Colombiana detectó una motonave sospechosa navegando a gran velocidad en el mar Caribe. De forma inmediata, la información fue transmitida a la Fuerza Naval del Caribe, que desplegó sus medios de superficie, aéreos y de Guardacostas para ubicar la embarcación», dijo la Armada. Lee también: Conmoción en Perú: Venezolano sospechoso de quemar y violar perros y gatos Dentro de la embarcación, se encontraron 16 sacos de diversos tamaños, recipientes de combustible y suministros líquidos para la tripulación. Según informó El Tiempo, durante la operación, los tripulantes de la lancha aparentemente arrojaron parte del cargamento al mar en un intento por eludir la acción de las autoridades, reseñó Versión Final en su sitio web. Los detenidos, uno de nacionalidad venezolana y otro dominicana, fueron trasladados a Riohacha junto con el material confiscado. Allí, el Cuerpo Técnico de Investigación de la Fiscalía General de la Nación llevó a cabo pruebas de identificación homologadas a la sustancia encontrada dentro de los paquetes, concluyendo que se trataba de 428.2 kilogramos de clorhidrato de cocaína. Lee también: Autoridades identifican a los fallecidos que se estrellaron en un helicóptero en Texas Este decomiso es parte de las operaciones llevadas a cabo por la Fuerza Naval del Caribe para combatir a las organizaciones criminales involucradas en el tráfico ilícito de drogas a nivel transnacional. Armada colombiana cocaína Fuerza Aérea Colombiana la Guajira Venezolano 1 Entrada anterior Macron desmintió que su esposa sea transgénero Siguiente entrada ¿Qué haces ahí sentada?: Madonna criticó a fan durante un concierto Entradas recientes Trump confirma aranceles del 25% a productos de México y Canadá para este #4Abr Trump considera suspender ayuda militar a Ucrania y centrarse en alianzas con América Latina ONGs de defensa de inmigrantes demandan a la administración Trump por terminación del TPS para haitianos y venezolanos El papa Francisco sufre nuevos episodios de insuficiencia respiratoria y vuelve a ventilación mecánica no invasiva Primero Justicia celebra 25 años de lucha por la libertad y la democracia en Venezuela Nuestro Twitter #EVTVEsVenezuelaLibre 🇻🇪 Las inhabilitaciones de los dirigentes democráticos de Venezuela forman parte de la violencia de la dictadura contra nuestro derecho humano a elegir 🇻🇪Nosotros debemos responder con una gigantesca participación en las primarias #EVTVElCanaldeLaLibertad pic.twitter.com/oZCfPr6BjP — EVTV (@EVTVMiami) July 3, 2023 Categorías Actualizados Agenda EVTV Al Mediodia Ciencia y Tecnología COPA AMÉRICA Coronavirus Deportes Despedida Destacados EE.UU EEUU 2024 Emergencia Venezuela Entretenimiento ESPECIAL WEB Fact-Cheking Finanzas Galería de Fotos Historias de éxitos Horóscopo Inmigración Internacionales La Entrevista Noticias EVTV Opinión Predicciones EVTV Presidenciales 2024 PRUEBAS COVID Rumbo a la Casa Blanca Salud TPS Ucrania Uncategorized VACUNACIÓN EEUU Venezuela Venezuela Cobra Viajes Video del Día VIÑA 2025 7620 NW 25th St #5, Miami, FL 33122 Contact us: [email protected] Copyright © 2021 EVTV. All rights reserved. Facebook Twitter Instagram Youtube Telegram Disfruta De Nuestra Señal En Vivo Inicio Destacados Venezuela EE.UU Internacionales Elecciones EEUU 2024 Opinión Deportes Entretenimiento"
"output/pdfs-2024/mO2xSg7M1725471357.pdf","https://goo.su/5Ptmimz","[Source: www.eje21.com.co] Detienen en Colombia a 3 panameños cuando transportaban en una lancha 254 kilos de cocaína - Eje21 3 de marzo de 2025 Noticias Opinión Videos Económicas Política Caldas Quindío Risaralda Columnistas Noticias Detienen en Colombia a 3 panameños cuando transportaban en una lancha 254 kilos de cocaína 9 de marzo de 2024 9 de marzo de 2024 Bogotá, 10 mar (EFE).- Las autoridades colombianas detuvieron a tres personas de nacionalidad panameña que estaban transportando en una lancha en las costas del Pacífico colombiano bultos con 254 kilos de clorhidrato de cocaína, informó este sábado la Armada. «Unidades de la Armada de Colombia interceptaron una embarcación tripulada por tres personas de nacionalidad panameña cuando transportaban en su interior 254 kilogramos en el departamento del Valle del Cauca (suroeste)», informó el comandante de la estación de guardacostas de Buenaventura, el capitán de corbeta Camilo Larrota. Al ver a los guardacostas, estas tres personas intentaron deshacerse del material lanzándolo al mar y tratando de huir, pero la Armada «recuperó los doce bultos del agua». Tras lo cual, los guardacostas trasladaron la embarcación, el alijo y a los sujetos hasta el puerto de Buenaventura, el principal colombiano del Pacífico, donde se comprobó que se trataba de clorhidrato de cocaína. «Con este resultado, se evitó que más de ocho millones y medio de dólares ingresaran a las organizaciones narcotraficantes, producto de la comercialización en el mercado ilegal extranjero y se evitó la distribución de más de 600,000 dosis en las calles del mundo», estimó la Armada en un comunicado. EFE Noticias recomendadas 1 Petro propondrá al próximo presidente de Ecuador reabrir sede de la Unasur en Quito 2 Gobierno pecueca 3 Rescatan a 39 turistas luego de que su lancha zozobrara en el Caribe colombiano Ver comentarios Quienes Somos Política de protección de datos Términos y condiciones Contáctenos Inicio Opinión Columnistas Política Ciencia y Tecnología Económicas Caldas Risaralda Quindío Cultura y Entretenimiento Judiciales Escriba con nosotros Paute con Nosotros Contáctenos"
