"pdf_path","url","content"
"output/pdfs-2024/cxT2wVHS1725468503.pdf","https://goo.su/OEWyU","[Source: www.swissinfo.ch] Enterrados en Brasil los cadáveres de los nueve africanos encontrados en barca a la deriva - SWI swissinfo.ch Ir a Portada Ir a Navegación Ir a Contenido Ir a Buscar Perspectivas suizas en 10 idiomas Iniciar sesión Buscar Cerrar Menú Cerrar Buscar Buscar Página principal A fondo Opinión Debates Vídeos Quinta Suiza Newsletters Guía de Suiza Quiénes somos Buscar en English de Deutsch fr Français it Italiano es Español pt Português ja 日本語 ar العربية zh 中文 ru Русский Enterrados en Brasil los cadáveres de los nueve africanos encontrados en barca a la deriva Este contenido fue publicado en 25 abril 2024 - 20:52 2 minutos São Paulo, 25 abr (EFE).- Las autoridades brasileñas sepultaron este jueves los cadáveres de los nueve migrantes africanos, todavía sin identificar, que fueron encontrados en una barca a la deriva en la costa del país sudamericano. El procedimiento de inhumación, realizado en un cementerio de la ciudad amazónica de Belém, permite que cualquiera de los cadáveres pueda ser exhumado y sepultado en otro lugar «en caso de que sea del interés de las familias», señaló la Policía Federal en un comunicado. En la ceremonia laica participaron representantes de Acnur, la agencia de la ONU para los refugiados, de la Organización Internacional para las Migraciones (OIM), así como de las fuerzas de seguridad brasileñas. Aunque ninguna de las víctimas ha sido identificada, se cree que proceden de Mali y de Mauritania, país desde donde supuestamente salió la embarcación con destino a las islas Canarias antes de perder el rumbo y continuar a la deriva durante 4.800 kilómetros. «La Policía Federal mantiene contacto permanente, vía la Interpol, con entidades internacionales, mientras que la pericia es realizada en el Instituto Nacional de Criminalística», afirmó la institución. La embarcación, hecha de fibra de vidrio y con cerca de trece metros de eslora, fue avistada por primera vez hace casi dos semanas por unos pescadores en la costa del estado de Pará, al norte de Brasil. En ella, además de los cadáveres en avanzado estado de descomposición, los agentes encontraron 25 chubasqueros, por lo que la Policía sospecha que la barcaza transportaba por lo menos el mismo número de pasajeros y que todos murieron por la falta de agua y comida. Los migrantes desaparecidos al intentar alcanzar por mar las islas Canarias desde el continente africano han aumentado un 20 % en lo que va del año, según un reciente informe de la OIM. EFE jmc/ed/psh (foto) Los preferidos del público Mostrar más Ginebra internacional Los recortes suizos debilitan una Ginebra internacional bajo presión leer más Los recortes suizos debilitan una Ginebra internacional bajo presión Mostrar más Cultura Alpes suizos y discreción, el cóctel perfecto para la gente famosa leer más Alpes suizos y discreción, el cóctel perfecto para la gente famosa Mostrar más Vida alpina «La ingeniería suiza en su máxima expresión»: el teleférico más empinado del mundo leer más «La ingeniería suiza en su máxima expresión»: el teleférico más empinado del mundo Mostrar más Política exterior Cómo China controla a las minorías tibetana y uigur en Suiza leer más Cómo China controla a las minorías tibetana y uigur en Suiza Mostrar más Cambio climático ¿Podría Suiza formar parte del éxodo del Acuerdo de París? leer más ¿Podría Suiza formar parte del éxodo del Acuerdo de París? Los más discutidos Próxima Previa Mostrar más Debate moderado por Kaoru Uda ¿Deben los países gastar más en ayuda exterior o están justificados los recortes? Muchos países están recortando en ayuda exterior, Suiza entre ellos. ¿Cree que está justificado? Únase al debate 10 feb. 2025 10 Me gusta 28 Comentarios Ver la discusión Mostrar más Debate moderado por Giannis Mavris ¿Cuál es la reputación de Suiza en su país de residencia? Suiza goza de buena reputación y es popular en todo el mundo, al menos eso creen muchos suizos. Pero, ¿por qué? Únase al debate 27 feb. 2025 77 Me gusta 130 Comentarios Ver la discusión Mostrar más Debate moderado por Benjamin von Wyl ¿Considera que la desinformación se está volviendo una amenaza significativa para la democracia directa? Un experto de la EPFL cree que la desinformación puede ser especialmente peligrosa para países como Suiza, donde se practica la democracia directa. Únase al debate 10 dic. 2024 68 Me gusta 134 Comentarios Ver la discusión Otros debates Síganos Nuestro equipo Declaración de protección de datos Condiciones de uso Derechos sobre el contenido y la responsabilidad Ofertas de empleo Quiénes somos SWI swissinfo.ch reporte anual 2023 Newsletters Contacto SWI swissinfo.ch - Sociedad Suiza de Radio y Televisión SRG SSR RTS SRF RSI RTR SWI swissinfo.ch - Sociedad Suiza de Radio y Televisión SRG SSR"
"output/pdfs-2024/cxT2wVHS1725468503.pdf","https://goo.su/QttawTV","[Source: economis.com.ar] Decomisaron elementos de pesca prohibidos en el lago Urugua-í – Economis Skip to content lun. Mar 3rd, 2025 Inicio ECONOMIA POLITICA LA CHACRA EL MUNDO INFOTECNO EDUCACION TURISMO Economis Información para tomar decisiones Primary Menu Inicio ECONOMIA POLITICA LA CHACRA EL MUNDO INFOTECNO EDUCACION TURISMO Buscar: Home LA PROVINCIA Decomisaron elementos de pesca prohibidos en el lago Urugua-í LA PROVINCIA Decomisaron elementos de pesca prohibidos en el lago Urugua-í By Redacción Economis 11 meses ago 🔊 Escuchar este articulo Compartí esta noticia ! Durante una recorrida por el Paisaje Protegido Lago Urugua-í, guardaparques del Ministerio de Ecología decomisaron elementos de pesca ilegales. Fue el viernes último, cuando los agentes de preservación del Parque Provincial Urugua-í y guardafaunas patrullaron el sector que abarca la desembocadura de los arroyos Tirica, Tortuguita y Monte Quemado. El grupo se encontró con 11 redes de diferentes medidas, una canoa, un espinel, una tarrafa y dos cámaras de camión utilizadas como botes por los infractores. Por el decomiso de los elementos, se labraron las actuaciones sumariales correspondientes. About The Author Redacción Economis See author's posts Compartí esta noticia ! Tags: Diarios de Misiones , Economis , Economis.com.ar , Misiones Continue Reading Anterior El operativo Estamos con vos llegó a Garupá y convocó a centenares de vecinos Siguiente Equipo recuperado por el IMAS abastecerá a 15 familias de 25 de mayo Deja un comentario Cancelar respuesta Tu dirección de correo electrónico no será publicada. Los campos obligatorios están marcados con * Comentario * Nombre * Correo electrónico * Web Guardar mi nombre, correo electrónico y sitio web en este navegador para la próxima vez que haga un comentario. 1.7 mil Followers 8500 Fans 7435 Followers 7331 Followers Escribinos a : (+54)	3764 -428248 redaccion@economis.com.ar publicidad@economis.com.ar open@economis.com.ar Ediciones Anteriores marzo 2025 L M X J V S D 1 2 3 4 5 6 7 8 9 10 11 12 13 14 15 16 17 18 19 20 21 22 23 24 25 26 27 28 29 30 31 « Feb Viñeta Redacción Economis 11 diciembre, 2023 Viñeta Redacción Economis 26 noviembre, 2023 Viñeta Redacción Economis 23 marzo, 2023 Viñeta Redacción Economis 21 marzo, 2023 Categorías Búsqueda Laborales (77) CASO Kiczka (56) CIENCIA (108) CINE (495) Ciudades (110) COLUMNISTAS (3.204) CON SELLO PROPIO (832) Coronavirus (7.532) CULTURA (5.534) DEBATE ECONOMIS (9) DEPORTES (2.680) ECONOMIA (21.678) EDUCA (10) EDUCACION (5.601) EL MUNDO (4.147) EL PAIS (9.785) ELLAS DECIDEN (716) EMPRENDEDORES (615) EMPRESA (2.521) EN CAMPAÑA (598) EN FOCO (358) ENTREVISTA OPEN (202) ENTREVISTAS (862) ESTADÍSTICAS (47) FINANZAS (2.539) Fines de semana (438) INDUSTRIA DE LA MODA (171) INFOTECNO (4.069) INTERNACIONALES (699) JUDICIALES (1.306) JUEGOS DE AZAR (708) LA CHACRA (5.357) LA CIUDAD (6.661) LA PROVINCIA (10.431) LA REGION (2.051) LADRILLOS (49) Lifestyle (305) MADERA DURA (768) MERCADO (577) Otras Noticias (1.884) PERSPECTIVAS (38) Perspectivas-2024 (11) PLACER Y NEGOCIOS (568) Poder de la naturaleza (14) POLITICA (18.803) PRODUCCION (516) SALUD (4.802) Seguridad (2.262) SELVA VIVA (2.264) Sin categoría (176) Tech (4) TELAM (490) Top News (445) Travel (240) TURISMO (4.774) Ultima Hora (3) Ultimas Noticias (37.622) Uncategorized (119) Universidades (94) Video (669) Viñetas (110) Economis Economis es el primer diario sobre economía, negocios y política de la provincia de Misiones. Realizado por un grupo de periodistas con casi dos décadas de trayectoria en la profesión en los distintos medios nacionales y provinciales de primer nivel La plataforma es enteramente digital www.economis.com.ar y a través de las redes sociales. Escríbenos a Te queres comunicar con nosotros podemos escribirnos a (+54)	3764 -428248 redaccion@economis.com.ar publicidad@economis.com.ar open@economis.com.ar Buscar: Copyright 2024 © Economis. All rights reserved. Solverwp- WordPress Theme and Plugin"
"output/pdfs-2024/cxT2wVHS1725468503.pdf","https://goo.su/Hs0R","[Source: www.cadenagramonte.cu] Servicio de Guardacostas de Estados Unidos devolvió este viernes 16 migrantes cubanos | Radio Cadena Agramonte Radio Cadena Agramonte Camagüey: En el corazón del pueblo Radio Cadena Agramonte emisiora de Camagüey Escúchenos en vivo lunes, 3 de marzo de 2025 Menú Noticias Destacadas Camagüey Nacionales Internacionales Cultura Ciencia y Entorno Curiosas Deportes Secciones Videos - Deportes Noticias sobre el bloqueo Opinión Fotorreportajes Hit Parade Efemérides Efemérides Multimedias Ignacio Agramonte Aniversario 60 de la emisora Cadena Agramonte Dramatizados Novelas Series Subsitios Idiomas Inglés Francés Búsquedas Buscar Inicio Noticias Nacionales 28 2024-04-12 19:55:15 Cuba, Servicio de Guardacostas, Estados Unidos, migrantes irregulares, Puerto de Orozco, Bahía Honda, Artemisa () (1) Servicio de Guardacostas de Estados Unidos devolvió este viernes 16 migrantes cubanos La Habana, 12 abr.- El Servicio de Guardacostas de Estados Unidos devolvió  hoy a16 migrantes irregulares por el Puerto de Orozco, Bahía Honda, provincia de Artemisa. Los 11 hombres y cinco mujeres habían participado en una salida ilegal del país el pasado 6 de abril por Jaimanita, en el municipio habanero de Playa, y la mayoría reside en Sancti Spíritus, anunció el Ministerio del Interior en su sitio oficial. Señaló que uno de los devueltos se encontraba en libertad condicional por el cumplimiento de sanciones penales en el momento de abandonar  la nación y  será puesto a disposición de los tribunales correspondientes para la revocación de ese beneficio. Esta es la vigésimo octava operación, recordó, de retorno de migrantes irregulares desde varios países de la región con 357 personas reintegradas en lo que va de año. De acuerdo con la misma fuente, Cuba mantiene firme su compromiso con una migración segura y ordenada, al tiempo que reitera el peligro y condiciones de riesgo para la vida que representan las salidas ilegales de su territorio. (Texto: ACN)(Foto: MININT) En esta categoría Presidente de Zimbabue recibe a Esteban Lazo (+ Post) Denuncia vicecanciller de Cuba política agresiva del Gobierno de Estados Unidos Primer ministro de Cuba examina recuperación turística Lo m&aacutes destacado Analizan estudiantes universitarios de Camagüey funcionamiento de organización juvenil (+ Fotos) Denuncia vicecanciller de Cuba política agresiva del Gobierno de Estados Unidos Primer ministro de Cuba examina recuperación turística Parlamento Cubano Noticias m&aacutes vistas Presidente de Cuba lamenta muerte de popular cantautor Paulo FG Unidos por la seguridad: Camagüey intensifica acciones contra delitos e ilegalidades Maricela: orgullo del Hospital Militar de Camagüey Convocan al Premio Periodístico Primero de Mayo Intensifican acciones de control por un Camagüey más seguro Detectan hechos delictivos en puntos de gas licuado en La Habana Comentarios Tu direcci&oacuten de correo no será publicada * Nombre * Correo * Tu comentario * No soy un robot Su comentario fue enviado,muchas gracias Radio Cadena Agramonte es una emisora radial de Cuba con noticias y audios de Camagüey y el mundo Últimas noticias Emisoras municipales Radio Camagüey Radio Cubitas Radio Florida Radio Esmeralda Radio Guáimaro La Voz del Bayatabo Radio Nuevitas Radio Vertientes Radio Santa Cruz Contacto Facebook rcadigital@icrt.cu (+53) 32298673 Calle Cisneros #310, Camagüey, Cuba Nuestra aplicación móvil ©2025 Radio Cadena Agramonte . Todos los derechos reservados"
"output/pdfs-2024/cxT2wVHS1725468503.pdf","https://goo.su/0U2NK","[Source: www.dicapi.mil.pe] DICAPI - Dirección General de Capitanías y Guardacostas Organization Historical Review Mission & Vision Organizational Chart General Director Executive Director Technical Supervisor Directions General Direction Aquatic Activities Control Aquatic Environment International Affairs & OMI Coast Guard Operations Maritime Administration Inspections, Audits, and Supervisions Department TUPAM Procedures Regulatory Framework Consultations IFC LATAM PERU es Español Inglés Últimas publicaciones Últimas Publicaciones Correo Web Intranet DICAPI Acceso a Geoportal Correo Web Acceso a Geoportal Home Organization Historical Review Mission & Vision Organizational Chart General Director Executive Director Technical Supervisor Directions General Direction Aquatic Activities Control Aquatic Environment International Affairs & OMI Coast Guard Operations Maritime Administration Inspections, Audits, and Supervisions Department TUPAM Procedures Regulatory Framework Consultations IFC LATAM PERU Organization Historical Review Mission & Vision Organizational Chart General Director Executive Director Technical Supervisor Contact Us Address Constitution St. 150, Callao Digital Office 24 Hours In-person office: 08:00 am - 4:00 pm Telephone 012099300, Extension: 6862 MGP - DICAPI - 2025"
"output/pdfs-2024/cxT2wVHS1725468503.pdf","https://goo.su/8KzkA7","[Source: www.dicapi.mil.pe] DICAPI - Dirección General de Capitanías y Guardacostas Organization Historical Review Mission & Vision Organizational Chart General Director Executive Director Technical Supervisor Directions General Direction Aquatic Activities Control Aquatic Environment International Affairs & OMI Coast Guard Operations Maritime Administration Inspections, Audits, and Supervisions Department TUPAM Procedures Regulatory Framework Consultations IFC LATAM PERU es Español Inglés Últimas publicaciones Últimas Publicaciones Correo Web Intranet DICAPI Acceso a Geoportal Correo Web Acceso a Geoportal Home Organization Historical Review Mission & Vision Organizational Chart General Director Executive Director Technical Supervisor Directions General Direction Aquatic Activities Control Aquatic Environment International Affairs & OMI Coast Guard Operations Maritime Administration Inspections, Audits, and Supervisions Department TUPAM Procedures Regulatory Framework Consultations IFC LATAM PERU Organization Historical Review Mission & Vision Organizational Chart General Director Executive Director Technical Supervisor Contact Us Address Constitution St. 150, Callao Digital Office 24 Hours In-person office: 08:00 am - 4:00 pm Telephone 012099300, Extension: 6862 MGP - DICAPI - 2025"
"output/pdfs-2024/cxT2wVHS1725468503.pdf","https://goo.su/EideL","[Source: diariocorreo.pe] Fiscalía interviene empresas de transporte fluvial en Huánuco | EDICION | CORREO Cuadro de búsqueda Menú Política Perú Mundo Deportes Economía Espectáculos Tendencia Videos Fiscalía interviene empresas de transporte fluvial en Huánuco diariocorreo.pe Términos y Condiciones Política de Privacidad Politica de Cookies Oficinas Concesionarias TEMAS: AREQUIPA AYACUCHO CHIMBOTE CUSCO HUANCAVELICA HUANCAYO HUÁNUCO ICA LA LIBERTAD LAMBAYEQUE LIMA PIURA PUNO TACNA TUMBES Huánuco Fiscalía interviene empresas de transporte fluvial en Huánuco En distrito de Mariano Dámaso Beraún, usuarios denuncian falta de seguridad en transporte La seguridad no es el plato fuerte en el transporte fluvial Arelia Luna Actualizado el 12/04/2024, 08:49 p.m. En el distrito de Mariano Dámaso Beraún, provincia de Leoncio Prado, la Fiscalía Especializada en Prevención del Delito, funcionarios de Defensa Civil y fiscalizadores municipales, realizaron acciones de protección a la población ante las denuncias de los usuarios a locales de empresas abocadas al rubro del transporte fluvial. Estos emprendimientos están ubicados en la orilla próxima del sector de la Cueva de las Lechuzas. El Ministerio Público actuó de oficio ante las denuncias públicas de falta de seguridad, que fueron advertidas por los usuarios a través de los medios de información. La acción es proactiva para evitar la comisión del delito contra la vida, el cuerpo y la salud, homicidio culposo, previsto y sancionado en el Código Penal. Los conductores de estos establecimientos fueron exhortados a cumplir sus funciones con las medidas de seguridad, para evitar incurrir en actos sancionados por la ley. MIRE ESTO TAMBIÉN : Inspeccionan almacenes de alimentos y quioscos de cinco colegios en Huánuco Huánuco: cuatro personas sentenciadas por torturar e intentar asesinar a escolar de 16 años Especialistas de Educación en Huánuco hacen sacrificio sin límites y llegan a zonas inaccesibles Copiar enlace Privacy Manager TAGS RELACIONADOS Intervienen empresas fluviales Fiscalía evalúa transporte por río Autoridades verifican condiciones de navegación últimas noticias Huánuco: periodista denuncia amenazas de muerte y ataques contra su familia Cárcel para sujeto que robó ganado de raza Brown Swiss en Huánuco Continúan investigaciones por muerte de estudiante de Ingeniería Civil en Huánuco Semana macrorregional de vóley femenino U15 en el Coliseo 15 de Agosto de Huánuco Huánuco: 75 mujeres en situación de vulnerabilidad culminan la primaria NO TE PIERDAS Contenido de Correo Clausuran Plaza Lima Sur por desprendimiento de techo en zona de comidas La Libertad: Río se desborda, arrasa con casas y cultivos en la provincia de Bolívar FBC Melgar mentalizado en Cerro Porteño por la Copa Libertadores Siguiente artículo Director: Iván Marco Slocovich Pardo Editor Web: Johana Liz Ugaz Oscanoa johana.ugaz@prensmart.pe Teléfono: (+511) 311 6500 Publicidad:  fonoavisos@comercio.com.pe PRENSMART S.A.C. Prensmart Jr. Jorge Salazar Araoz. Nro. 171 Urb. Santa Catalina, La Victoria, Lima - Perú Copyright © PrenSmart S.A.C. Todos los derechos reservados Privacy Manager Términos y Condiciones Política de Privacidad Politica de Cookies Oficinas Concesionarias Síguenos NUESTRAS SECCIONES Política Perú Mundo Deportes Economía Opinión Espectáculos Tendencia Videos Premium Red el Comercio: elcomercio.pe clubelcomercio.pe gestion.pe depor.com trome.com diariocorreo.pe peruquiosco.pe mag"
"output/pdfs-2024/mO2xSg7M1725471357.pdf","https://goo.su/pbU8NA","[Source: diarioinforme.net] Zulia: Detienen a piratas del Lago frente a costas de La Cañada de Urdaneta - Diario Informe INICIO NACIONALES POLÍTICA SUCESOS INTERNACIONALES ECONOMÍA DEPORTES BEISBOL FÚTBOL BALONCESTO MOTORES SALUD ENTRETENIMIENTO CINE CURIOSIDADES TEATRO RELIGIÓN TECNOLOGÍA Nacionales Sucesos Zulia: Detienen a piratas del Lago frente a costas de La Cañada de Urdaneta 8 de marzo, 2024 - 10:55 pm 800noticias/ foto referencial El patrullaje lacustre de las nuevas unidades policiales capturaron a cuatro sujetos sospechosos de navegar bajo la piratería, en las aguas del Lago de Maracaibo. Como parte de las propuestas elevadas por el pueblo pescador a las autoridades nacionales y regionales en relación a la inseguridad del oficio en el Lago; desde hace varias semanas, unidades del Cuerpo de Policía Bolivariana del estado Zulia y la GNB, hacen patrullaje en el estuario, cumpliendo con los acuerdos citados. Refiere la minuta oficial que: “La acción se ejecutó a diez minutos para la 1.00 de la madrugada del 7 de marzo del año corriente, posterior a procesar una denuncia recibida por el Cuadrante de Paz en coordinación con el Centro de Control Policial (CCP) N° 13 La Cañada de Urdaneta de un robo cometido en un balneario del sector Potrero, vía La Ensenada”. Relata la minuta que “la comisión de patrullaje lacustre zarpó en una lancha junto con el pescador denunciante, quien indicó la ruta a seguir para dar con el par de botes sospechosos que este había logrado observar, y efectivamente, el par de embarcaciones se encontraba en el lugar”. Los policiales abordaron las dos embarcaciones y “cuatro individuos fueron sometidos a la revisión corporal correspondiente y los botes fueron requisados, encontrándose en uno de ellos un arma de fuego tipo escopeta”. Las evidencias La minuta policial refiere que en la operación se incautaron: “Un arma de fuego tipo escopeta, marca Warning, calibre 12 con cinco municiones en su estado original; un bote de pesca de color blanco con verde de nombre «Daniela II», serial: 1557; un bote de pesca de color blanco con celeste de nombre «Daniela», serial 004-14; un motor fuera de borda, marca Tohatsu, serial: 055625XH y un motor fuera de borda, marca Yamaha, serial 1042162”. “De forma inmediata -dicta la minuta policial-, los sabuesos del URRA trasladaron a los dos botes con los cuatro individuos hasta la orilla realizándose ahí el trasbordo de los cuatro ciudadanos en calidad de detenidos, quienes responden a los nombres de: Jordan David León Áñez (31), Juan Carlos Zuleta Mora (20), Rafael Ángel Márquez Ortega (49) y Carlos Germán Luzardo Chourio (46). Procedimiento que pasa con expediente de apertura y evidencias de interés criminalístico a la Fiscalía Cuadragésimo Sexta (46°) del Ministerio Público”, describió al cierre. Nota de Prensa Únete a nuestro canal de Telegram, información sin censura:  https://t.me/canal800noticias Suscribir vía Telegram 4 piratas del lago Cañada de Urdaneta capturan Zulia Lea también ■ Sucesos Choque de vehículos deja tres heridos en El Junquito 1 de noviembre, 2024 - 2:50 pm ■ Sucesos GNB y PNB disuelven rodada del terror en Maracaibo 1 de noviembre, 2024 - 12:20 pm ■ Sucesos Condenada una mujer que mató y abandonó a su recién nacida 1 de noviembre, 2024 - 11:07 am ■ Sucesos Detienen a propietario de gasolinera por corrupción 1 de noviembre, 2024 - 9:51 am © 2013-2025 diarioinforme.net Derechos Reservados. Contacte al editor"
